,x
13,국세청 등 세무당국과 금융감독원이 유병언 전 세모그룹 회장과 청해진해운을 대상으로 탈세 및 불법 외환거래 여부 등에 대한 조사에 착수했다 국세청은  일 오전 경남 고성군 동해면 장기리에 있는 청해진해운의 대주주 ㈜천해지 본사에 조사관  여명을 보내 회계 관련 장부 등을 압수했다 국세청은 청해진해운 관계사  곳을 대상으로 조사하고 있으며 수천억원의 자산을 보유한 유 전 회장 일가가 국내외에서 부동산 등 자산 거래를 하면서 조세를 포탈한 혐의가 있는지 조사할 것으로 알려졌다 관세청도 유 전 회장 일가 및 그들이 지배하는 회사의 해외 무역 및 자본거래 흐름에 대한 본격 조사에 나섰다 양승혁 외환조사과장은 청해진해운뿐만 아니라 지배회사나 관계사 자료 등을 폭넓게 검토하고 있다며 직접투자나 대차 무역거래 등 어떤 형태로 얼마만한 규모로 해외로 돈이 빠져나갔다가 자본세탁을 거쳐서 다시 들어왔는지 등을 살펴볼 것이라고 말했다 금융감독원은 세월호 침몰 사고를 일으킨 청해진해운의 실소유주인 유병언 전 세모그룹 회장 일가와 청해진해운에 대한 불법 외환거래 여부를 조사하고 있다고 이날 밝혔다 외국환거래법은 자본 거래를 할 경우 그 거래 목적과 내용을 외국환 거래은행에 미리 신고하도록 의무화하고 있다 조성래 금감원 외환감독국장은 유 전 회장과 청해진해운 등이 해외자산을 취득하고 투자를 하는 과정에서 사전 신고 의무를 위반했는지 등에 대한 조사가 이루어지고 있다며 세월호 사고 이후 집중적으로 들여다보고 있다고 말했다 유 전 회장 일가가 보유한 재산은  억원 안팎으로 추정되고 있으며 미국을 비롯한 해외에도 상당한 재산을 보유하고 있을 가능성이 있는 것으로 관측된다 금감원은 불법 외환거래 사실이 확인되면 검찰 등에 통보할 계획이다황보연 류이근 기자  
14, 세월호 사고에 분노하는 여론과 박근혜 대통령의 엄벌 지시에 따라 검찰이 해운업계 전반의 불법행위를 이참에 뿌리뽑겠다며 소매를 걷어붙였다 이미 검찰의 칼끝은 청해진해운 실소유주 일가의 재산도 겨누고 있다 인천지검과 부산지검 특수부는 세월호와 관련된 감독 기관의 문제와 함께 해운업계 전반의 구조적 비리를 조사한다는 계획이다 여기에 인천지검이 청해진해운 실소유주 일가의 개인 비리까지 샅샅이 뒤지는 구도다 세월호는 지난해  월 인천지방해양항만청으로부터 해상여객운송사업 면허를 받았다 검찰은 인천항만청이 세월호에 면허를 내주기에 앞서 면허 발급 요건에 대한 검사가 제대로 이뤄졌는지 결격 사유는 없었는지 등을 살펴볼 것으로 보인다 세월호 정기검사를 맡은 한국선급 특별점검을 하는 인천해양경찰청도 수사 대상이다 세월호는 선박 증축 뒤 복원력에 문제가 생겼다는 증언이 여럿 나왔다 따라서 안전 점검 기관들이 수직 증축으로 인한 위험을 제대로 살폈는지도 중요한 확인 대목이다 업계의 구조적 비리를 캐는 수사는 해수부 마피아에 초점이 맞춰질 것으로 보인다 해양수산부나 국토해양부 전직 관료들은 낙하산을 타고 해운조합과 한국선급 등 해수부 산하 관변 조직의 핵심 보직을 맡아오고 있다 검찰 관계자는 원양어선 화물선 등의 문제까지 다 살펴보기는 힘들다 국민 안전과 직결되는 연안여객 중심으로 볼 것이라고 말했다 세월호 선사인 청해진해운과 선주 쪽 수사를 담당하는 김회종 인천지검 특별수사팀장은  일 남은 가족들의 손해배상 소송을 지원하기 위해 실소유주인 유병언 전 회장 일가의 은닉 재산을 찾는 데도 주력하겠다고 말했다 세월호는 인명 피해의 경우  인당  억 만원까지 보상받을 수 있는 보험에 가입돼 있다 하지만 가족들은 이와 별도로 선사를 상대로 손해배상 청구 소송을 낼 수 있다 선장 이준석 구속씨에게는 특정범죄가중처벌법의 도주선박 혐의가 적용됐는데 이 혐의가 법원에서 유죄로 확정되면 사망자들은 과실범이 아닌 고의범의 피해자가 돼 위자료 액수가 크게 늘 수 있다 결국 인천지검의 움직임은 청해진해운의 실소유주인 유병언  전 세모그룹 회장과 그의 장남 유대균  차남 유혁기 씨를 압박해 사재를 내놓도록 하겠다는 의미로 읽힌다 서울 지역 법원의 한 부장판사는 법적인 배상 책임은 청해진해운 회사에 있고 유씨 일가에게는 없다 검찰 수사는 유씨 일가가 사재를 출연하도록 압박하겠다는 뜻으로 보인다고 말했다 검찰의 이런 움직임은 이른바 별건 수사에 해당하지만 세월호 사고 책임자들에 대해 분노하는 여론을 등에 업은 만큼 수사는 매섭고 빠르게 진행될 것으로 보인다 김원철 기자  관련영상 한겨레 포커스촛불 시민 아직 끝난 게 아니다 한 아이라도 돌아오길 
15,세월호 침몰 사고 일주일째인  일 오전 인천시 중구 항동 인천연안여객터미널 안 청해진해운 매표창구와 대합실이 텅 비어 있다인천이정아 기자  
16,세월호에서 어렵게 수습되고도 가족들 품에 안기지 못하는 주검들이 늘고 있다 키  ㎝ 반팔티 곤색감색 반바지 짧은 머리 약간 곱슬 옅은 눈썹 넓은 이마 왼쪽 무릎 상처 통통한 편 손목에 하늘색 패션시계  일 전남 진도체육관 게시판에는  번 시신의 정보가 적힌 종이사진가 제일 높은 곳에 붙어 있었다 가족이 신원을 확인해 주검을 인수하면 인상착의가 적힌 종이를 떼지만  번 주검은 아직 가족을 못 찾았기 때문이다  일 오전에 수습됐으니 벌써 사흘째 무연고로 남아 있는 것이다 주검이 있는 목포 세안병원 장례식장으로 확인하러 온 이도 없었다 병원은 주검이  대 신원 미상의 남자라고 설명했다 주검은 부패를 막기 위해 이날 다른 병원 냉동 안치실로 옮겨졌다 해경 신원확인반 직원은 지문 확인을 했는데 이름이 뜨지 않았다 학생인지 외국인인지 알 수가 없다고 했다  일 오전 객실  층에서 수습한  번 시신도 가족을 찾지 못해 이튿날까지 정보를 담은 쪽지가 붙어 있었다 주검이 안치된 목포 기독병원 장례식장은 진주로 피어싱을 했고 검은색에 흰색 꽃무늬가 있는 티셔츠를 입었다 학생으로 추정된다고 설명했다  일 새벽  시 분께 기독병원으로 옮겨진  번 시신도 단원고 학생으로만 추정될 뿐이다  번 주검과 같은 시간에 수습된  번 시신은 이틀이 지난  일 오후 가족과 만났다 단원고 남학생이었다 체육관 신원확인소에 찾아온 가족은 시신 번호가  번이 넘었는데 이제야 확인해주는 게 어딨냐고 소리쳤다 신원확인반 쪽은 지문 등록이 안 된 학생은 부모와 학생의 유전자 검사 결과가 나와야만 누구인지 확인된다고 해명했다 신원 미확인 주검을 보관하고 있는 한 장례식장 관계자는 일반적으로 가족이 찾아오지 않으면 무연고자로 처리해 장례 절차를 밟지만 이번 사고 희생자는 그렇게 하지 않을 것이라고 했다 진도최우리 목포이재욱 기자  관련영상 한겨레 포커스촛불 시민 아직 끝난 게 아니다 한 아이라도 돌아오길 관련영상 한겨레포커스미안하다 얘들아 안산 세월호 촛불 현장 
17,세월호 침몰 사고로 남편을 잃은 중국동포 최아무개 씨는 연신 눈물을 닦아냈다 바다밑에서 공포와 추위 숨막힘 속에 변을 당했을 남편을 생각하면 가슴이 미어진다고 했다 머나먼 한국 땅에 와서 이게 뭐예요 우리 불쌍한 남편 어떻게 해요 이들 부부는 원래 중국 길림성 교하시에서 살았다 최씨는  년 전에 남편은 최근에 한국으로 왔다 중국동포인 남편 이아무개 씨는 친구들과 제주도 여행을 가는 길에 참변을 당했다 함께 간 일행들은 모두 구조됐지만 남편만 배 밖으로 빠져나오지 못했다 실종자 명단에 오른 남편이 살아 돌아오길 바랐지만 남편은 싸늘한 주검이 되어 최씨에게 인계됐다 남편의 주검은 깨끗했다 어디하나 상한 데가 없었다 최씨는 남편이 죽었다는 사실을 믿을 수 없다 당장이라도 일어나 나를 불러줄 것 같다고 했다 최씨는 해경으로부터 남편의 빨간 지갑과 휴대전화를 건네받았다 해경은 남편이 입고 있던 옷 안에 있던 것이라고 했다 바닷물에 축축하게 젖은 지갑 안에는 천원짜리 지폐  장과 남편의 사진이 들어 있었다  일 목포 세안병원 장례식장에서 만난 최씨는 남편의 지갑과 휴대전화의 물기를 손수건으로 계속 닦아냈다 남편이 이승에 남긴 마지막 물건이었다 최씨는 이거 애기 아빠 몸에서 나온 거예요 평생 간직할 거예요며 말을 잇지 못했다 최씨는 남편을 서울로 옮겨 장례를 치를 예정이지만 이 역시 쉽지 않다 장례를 치르기 위해서는 유전자 검사를 거쳐 신원확인을 마쳐야 하는데 중국에 있는 아들 과 시어머니가 한국에 오기까지 시간이 꽤 걸릴 것 같아서다 최씨는 중국에 전화를 해보니 여권이 나오는데 최소한 열흘은 걸린다고 한다 그때까지 어떻게 기다리냐고 했다 최씨는 정부에 호소했다 이거 다 인재잖아요 다른 사람들이 잘못했는데 왜 우리 남편이 죽어야 하나요 억울하지만 장례라도 치를 수 있게 대한민국 정부가 도와줬으면 좋겠어요 도와줄 수 있나요 목포글사진 이재욱 기자  관련영상 한겨레 포커스촛불 시민 아직 끝난 게 아니다 한 아이라도 돌아오길 
18,남편은 스스로를 죄인이라고 했다 세월호 침몰 당시 남편은 구명조끼를 입고  층 라운지로 나오려는 아내에게 얼른 들어가라는 손짓을 했다 배는 옆으로  도 이상 기울어진 상황이었다 현재 위치에서 절대 이동하지 말라 움직이면 더 위험하다는 안내방송을 믿었다 시키는 대로 하면 다 살 수 있을 거라고 생각했어요 그런데 그게 마지막이 될 줄 누가 알았겠어요 부부는 결혼  돌을 맞아 제주도로  박 일 기념여행을 떠나던 길이었다  일 오후  시 진도실내체육관에 누워있던 정아무개 씨는 멍하니 천장만 바라봤다 아내를 두고 혼자 빠져나왔다는 죄책감 탓에 그는 하루하루가 지옥이라고 했다 벌써  주일이 흘렀지만 정씨의 기억은 여전히 그날에 머물러 있었다  층 식당 앞 소파에 앉아 커피를 두 모금 정도 마셨는데 갑자기 배가 왼쪽으로 기우는 거예요 소파는 그대로 벽으로 가서 꽂혔고 아이들도 우르르 밀려 내려와 벽에 부딪혔어요죄책감으로 하루하루가 지옥 무슨 자격으로 밥을 먹겠나주검 계속 느는데 아내는 없어 멍하니 체육관 천장만 바라보며 살이 보일때까지 손톱 물어뜯어 커피를 좋아하지 않는 아내는 먼저 객실로 돌아갔다 객실에 휴대전화를 두고 온 정씨는 아내에게 전화를 할 수 없었다 저 멀리 아내가 보였다 다급히 손으로 오케이 신호를 보냈다 곧 괜찮아질테니 움직이지 말라고 했다 그러나 물은 순식간에 차올랐다 구명조끼를 입지 못한 정씨는 정신없이 헤엄쳤다 그리고 뭍에서 만날 줄 알았던 아내의 모습은 보이지 않았다 정신없이 찾았죠 목포에도 구조자를 태운 버스를 보냈다고 해서 한가닥 희망을 걸었었는데 이날 밤  시 분께 체육관이 술렁이기 시작했다 대형 텔레비전 속 뉴스에서 선체  층에서 주검을 여럿 인양하고 있다는 속보가 나왔다 정씨는 손톱을 물어뜯었다 손톱 밑 살이 보였다 손톱을 계속 만지작거리며 텔레비전을 보던 그가 고개를 떨꿨다 아들이 따라한다고 아내가 손톱 물어뜯는 버릇 좀 고치라고 계속 잔소리를 했었어요 그때는 잔소리라고만 생각했는데  구의 주검이 수습됐다고 했다 불과 며칠 전까지 살을 맞댔던 이들이 번호가 매겨진 주검이 돼 가족의 품으로 돌아왔다 체육관  번 출입구 앞의 화이트 보드에 붙은 사망자 인적사항을 한참 바라보던 그는 조용히 발걸음을 돌렸다 없네요 옷이 아니에요 아내는 진분홍색 점퍼를 입고 있고 검은색 등산복 바지를 입고 있어요 정씨 뒤로 다른 가족들의 울부짖는 소리가 들려왔다 급격하게 늘어나던 사망자 숫자는 이날 밤  명에서 멈췄다 지친 가족들은 자정이 넘어서야 자리에 눕기 시작했다 가족들은 체육관 나무 바닥에 합성고무로 된 매트를 깔고 하늘색 담요를 덮었다 새벽 내내 그칠 줄 몰랐던 가족들의 울음소리는 사고  주일째로 넘어가는  일 새벽  시 분께 한 차례만 들렸을 뿐이다  일 아침 가족들을 깨운 건 뉴스속보였다 오전  시 분께 주검  구가 추가로 인양됐다 정씨도 여느 실종자 가족들처럼 텔레비전 화면만 멍하니 바라봤다 아내는 아니었다 정씨는 어제처럼 다시 몸을 돌려 누웠다  명에 멈춰있던 사망자 수는 오전  시께 야속하게도  명을 채워버렸다  분 뒤에는  명으로 오후에는  명으로 불어났다 정씨는 체육관을 빠져나와 입구 쪽에 마련된 조계종 천막을 찾았다 텔레비전을 안 봐야죠 매일 같은 얘기만 나오고 너무 스트레스를 받으니까 스님과 얘기하고 기도하고 그렇게 마음을 다스리는 거죠 스님과 한참 동안 얘기를 나눈 정씨는 다시 자리로 돌아와 누웠다 추가 사망자를 알리는 소식과 수색작업을 계속하고 있다는 얘기는 하루 전과 다를 게 없었다 그 사이 사망자만 늘었을 뿐이었다 식사는 잘 챙기느냐는 질문에 정씨가 말했다 사람들이 보고 있는데 어떻게 밥을 먹어요 저는 죄인이에요 아내 두고 혼자 살아남은 제가 무슨 자격으로 밥을 먹겠어요 시계는 오후  시를 가리켰다 실낱같은 희망과 무거운 절망을 번갈아 짊어지는 실종자 가족들의  시간은 또 그렇게 흘러가고 있었다 진도서영지 기자  관련영상 한겨레 포커스촛불 시민 아직 끝난 게 아니다 한 아이라도 돌아오길 
19,세월호가 사고 발생 뒤 제주 해상교통관제센터에 긴급 구조 요청을 하기 전  분 동안 도대체 무슨 일이 있었던 것일까 사고 당시 세월호의 움직임을 가늠해볼 수 있는 새 항적도가 나와 사고 원인 규명에 도움이 될 것으로 보인다 해양수산부가 중앙해양안전심판원을 통해 전남 목포의 선박자동식별장치 기지국 원데이터를 분석한 결과다 선박자동식별장치란 선박에 탑재돼 선박의 위치 침로 속력 등 항해 정보를  분에  회 실시간으로 제공하는 장치다 새로 공개된 항적도를 보면 세월호는 맹골수도를 지나던  일 오전  시 분 초에 이상 징후를 보인다 알 수 없는 이유로 자동식별장치가 꺼져버렸다 해수부는 정전블랙아웃 때문인 것으로 추정한다 그래서 이후  초 동안이동거리   정도 세월호의 항적은 잡히지 않았다 무슨 이유로 정전이 됐는지도 밝혀지지 않았다 사고 초기에는 암초와의 충돌 등 외부 요인 가능성이 거론되기도 했다 정전과 관련해  급 항해사 이아무개씨는 보통 배에 발전기가  대 있다 한 대가 멈추면 자동으로  초 안에 다른 발전기가 작동하게 돼 있다  초 동안 자동식별장치가 끊어졌다면 발전기가 모두 멈춘 것으로 볼 수 있다고 했다 발전기는 자동식별장치나 객실 등 배의 모든 부분에 전기를 제공하며 이것이 멈추면 메인 엔진프로펠러 가동도 꺼진다는 게 이씨의 설명이다 발전기가 멈춰도 객실 등에 있는 비상등은 배터리로 작동해 켜져 있게 된다 세월호는 이후 비상용 배터리에 의해 자동식별장치가 복원되면서  시 분 초에 다시 항적이 잡혔다 이때는 선수뱃머리가 오른쪽으로 약간 틀어져 있었다 이후 서서히 선수가 돌아가  초 뒤인  시 분 초에는 선수가 애초 이상 징후가 나타났을 때에 비해  도 오른쪽으로 돌아가 있었다 이 상황은  초 동안 계속됐다 이어  시 분 초에는 애초에 비해  도가량 오른쪽으로 틀어져 있었고  초 동안이나 이런 상태가 이어졌다 해수부 관계자는 이 구간에서 배가 급회전하면서 균형을 잃고 넘어지는 외방경사가 일어난 것 같다고 설명했다 그 뒤 조류에 밀려 떠내려가기 시작한 시간은  시 분 초 그러나 선장 등 승무원들은 이런 위급 상황에서도 구조 요청을 하지 않다가  분 뒤에야 초단파무선통신 채널 를 통해 무려  ㎞나 떨어진 제주 해상교통관제센터에 본선 위험합니다 지금 배 넘어갑니다라며 다급한 상황을 알렸다 이후 관제 책임을 맡은 진도 해상교통관제센터와 교신하기까지 다시  분이 걸렸다 해수부 관계자는 사고 원인과 관련해 세월호는  노트시속  ㎞로 진행하다 맹골수도를 지나면서 오른쪽으로  도가량 꺾게 돼 있는데 정전 뒤 속도가  노트 등으로 점점 줄면서  분 초에 선수가 오른쪽으로 확 꺾였다며 원인은 나중에 화물 적재가 어떻게 돼 있는지와 평형수배 아래나 좌우에 넣어 균형을 잡는 데 쓰는 물 부족 여부 등을 정밀하게 분석해봐야 알 것이라고 말했다 그는 이어 변침방향 전환을 하다 평소보다 더 돌았을 수 있는데 전타조타기를 최대치인  도로 꺾는 것까지는 아닌 것 같다고 했다 애초 조타수가 무리하게 조타기를 돌린 게 결정적 요인이라는 추정이 나왔으나 다른 기계적 결함이 사태를 촉발했거나 악화시켰을 가능성이 제기되는 대목이다 결국 정전이 일어난 것으로 짐작되는  초간이 원인 규명에 핵심적인 시간이 될 수 있다  급 항해사 이씨는 꺾여 있는 조타기는 정전이 되면 계속 꺾인 상태로 가는데 그렇다고 배가 넘어가는 것은 아니다라고 말했다 그는 배가 기울어진 상태에서 전원이 끊기면 복원력이 있으면 그 상태대로 멈춘다 하지만 세월호는 증축으로 무게중심이 올라가 복원력이 없었기 때문에 그 상태에서 확 넘어간 것 같다고 분석했다 세종김경무 선임기자 이경미 기자   관련영상  의 생각  불신의 땅 대한민국 
20, 일 전남 진도 팽목항에는 민관군 합동구조팀이 수습한 주검들이 연이어 들어왔다 이날 오전 세월호 선체와 주변 해역에서 주검  구가 추가로 발견되며 사망자 수가  명을 오후  시에는  명을 넘어섰다 밤  시에는  명까지 늘었다 깨끗한 주검들을 확인한 일부 유족들 사이에서는 구조 가능성이 있었는데도 정부의 늑장 대처로 목숨을 잃은 것은 아닌지 규명해야 한다며 부검을 하자는 움직임까지 일고 있다 팽목항 여객선 선착장 위쪽에 마련된 사망자 신원확인소는 수습한 주검을 확인하려는 실종자 가족들로 붐볐다 팽목항과 가족들이 머무는 진도체육관 게시판에 내걸린 신원확인 정보 쪽지도 늘어났다 주검이 수습되면 신원확인 정보가 게시판 등을 통해 먼저 가족들에게 제공된다 그리고  시간 정도 지나면 해당 주검은 배에 실려 팽목항으로 들어오게 된다 범정부사고대책본부는 이날 늘어나는 주검을 수용하기 위해 팽목항에  구를 안치할 수 있는 간이 영안실을 마련하기로 했다 주검  구가 오전  시 분께부터 해양경찰청 경비함에 실려 항구로 들어왔다 단원고 학생 이아무개 군과 학생으로 추정되지만 신원이 확인되지 않은 여성  명의 시신이었다 이들은 담요에 싸여 구급차에 실린 뒤 신원확인소로 옮겨졌다 이곳에서 가족들이 신원을 확인하기 전에 주검을 씻기는 작업이 진행된다 물속에서 여러 날을 보낸 뒤 수습된 주검들을 가족들에게 곧바로 확인시켰다가 거센 항의를 받자  일부터 주검을 단정히 하는 절차가 생겼다수습된 주검 운구 세월호 침몰사고 발생 일주일째인  일 오전 수습된 시신들이 경찰선을 통해 진도 팽목항으로 옮겨진 뒤 앰뷸런스로 운구되고 있다진도이정용 기자   오전  시께부터 가족들의 신원확인이 시작됐다 우리 아들 살려내 일어나 아가야 불쌍해서 어떻게 해라고 말하는 소리가 밖으로 흘러나왔다  분 뒤 주검  구가 팽목항에 다시 도착했다 신원확인 정보를 대책본부 관계자가 설명했다 딸의 이름을 부르는 어머니가 제대로 걷지 못하고 비틀거렸다 실종자 가족을 알리는 비표에는 교복을 입은 딸의 증명사진이 손바닥만한 크기로 확대돼 끼어 있었다 통곡하는 어머니 곁으로 다가온 큰딸이 정신차려야 돼 그 길은 같이 못 가라며 달랬다 주검 수습 속도가 빨라지면서 장례식장이 있는 목포로 이송되는 주검도 늘었다 목포 분위기 역시 무겁게 가라앉았다 목포 기독병원으로 아들의 시신을 이송한 단원고 학생의 어머니는 죽는 게 제일 무섭다고 했는데 얼마나 무서웠어 얼마나 무서웠어 얼마 살지도 못하고 우리 아들 보고 싶은데 없어서 어떻게 살아라며 통곡했다 실종자 가족 대표단은 이날 정확한 사인을 알기 위해 부검을 원하는 가족들의 신청을 받기로 했다며 모진 결정을 내렸다 죽은 가족에게 다시 칼을 대는 결정을 하는 것은 쉬운 일이 아니다 가족 대표단은 단순 익사라고 보기 힘든 사망자들이 나오고 있어 사망 원인을 면밀히 파악할 필요성이 있다 실제 구조 가능성이 있었던 것은 아닌지 부검을 통해 밝혀 보자는 취지라고 말했다 진도박승헌 목포이재욱 기자  관련영상 한겨레 포커스촛불 시민 아직 끝난 게 아니다 한 아이라도 돌아오길 
