,x
1, 일 오전 시쯤 전남 진도군 관매도 인근 해상에서 조난 신고를 한 배는 청해진해운 소속 세월호다 세월호는 전장  선폭  총톤수 톤 규모의 여객선으로 정원은 명이다 인천과 제주 간 마일약 ㎞을 시간분 동안 운항하며 최고속도는 노트다 운임은 인당 최저 만원에서 최고 만원이다 사고가 난 세월호에는 안산 단원고 학년 학생 명과 교사 명 등 승객과 승무원을 포함해 총 명이 탑승한 것으로 알려졌다 현재 이 배는 좌현이 도 가까이 기울어져 있고 해경이 경비정과 헬기를 투입해 구조에 나섰다 
2, 사고가 난 여객선 세월호에 타고 있던 안산 단원고등학교 학생 임모군은 과의 전화통화에서 사고 당시쿵 하는 큰 소리가 났고 배가 옆으로 기울기 시작했다며 선생님들과 함께 잠긴 문을 열고 바다에 뛰어내렸는데 보트가 와서 구조해줬다고 말했다 현재 구조된 여명의 학생과 함께 있다는 임군은 배가 기울면서 애들이 많이 넘어졌고 부딪히면서 피가 나고 다친 사람도 생겼다며 배에 물이 차기 시작했고 잠긴 문을 열고 밖으로 나가니까 바다 수면까지 층 높이가 안 돼서 구명조끼를 입은 채 뛰어내렸다고 말했다 임군은 다른 곳에 있던 학생들도 대부분 나와서 바다로 뛰어들었고 구조된 것으로 알고 있다며 지금은 대부분 안정을 되찾은 상태라고 말했다 
3, 전남 진도에서 발생한 여객선 세월호 침몰 사고로 현재까지 단원고 학년 학생을 포함 명이 사망한 것으로 알려졌다 이런 가운데 중앙재난안전대책본부중대본가 발표한 생존자 숫자가 줄곧 혼선을 빚었다 일 오전 시 분쯤 청해진해운 소속 여객선 세월호가 전남 진도군 관매도 인근 해상에서 침몰해 오후 시 분 현재 선사 여직원 박모씨와 단원고 학년 정모군이 사망한 것으로 전해졌다 당초 명이 구조된 것으로 알려졌으나 이는 중대본의 착오인 것으로 드러났다 중대본이 오후 시 분 현재 공식 발표한 인명피해 현황은 총 명의 탑승자 중 명 사망 명 구조 명 실종이다 일 오후 인천항을 출발해 제주도로 향하던 세월호에는 수학여행에 나선 안산 단원고등학교 학년 학생 명과 교사 명이 탑승했던 것으로 알려졌다 구조된 탑승객들은 해남종합병원 목포한국병원 중앙병원 등으로 이송됐다 
4, 일 전남 진도 해상에서 여객선 세월호가 침몰해 최소 명이 사망하고 여명이 실종된 가운데 주요 외신들도 일제히 이번 사고를 비중있게 보도했다 은 이번 사고를 혼란스러운 상황이라고 표현하며 대부분의 탑승객이 학생이라고 전했다 와 뉴욕타임스도 헤드라인으로 소식을 전하며 사고 발생 후 많은 시간이 지났지만 실종자가 여전히 수백여명이라는 점에 우려를 표혔다 영국 와 중국 일본 아사히신문 등도 실시간으로 구조자 집계를 보도하며 이번 사고의 추이를 지켜보고 있다 아래는 조선 보도 원문 ☞ 해당 뉴스 조선 영상 보러가기 앵커 외신도 세월호 침몰 소식을 일제히 머리기사로 전했습니다 문경원 기자입니다 리포트 해외 주요 방송사들은 일제히 생방송으로 세월호 사고 소식을 긴급 보도했습니다 녹취 주로 학생들입니다 아직 사고 초기라 정확한 집계는 달라질 수 있습니다 혼란스러운 상황입니다 은 인터넷에서도 차가운 물을 헤치고 구조선까지 헤엄쳐 나온 학생의 이야기를 전하며 살고 싶었다는 제목의 기사를 보도했습니다 등 미국 주요 방송과 뉴욕타임즈 등 주요 신문도 머리기사로 사고 발생 수시간이 지나도록 수백여명이 여전히 실종 상태라며 우려를 표했습니다 영국 는 당국이 한때 구조자 수를 잘못 전하면서 혼란이 일었다고도 보도했습니다 중국과 일본 매체도 아직 많은 승객이 갇힌 것으로 보인다며 구조 상황을 중심으로 집중 보도했습니다 일본 아사히 신문은 한국 군경 뿐 아니라 인근 섬에서 어선들이 구조를 위해 대거 출동했다고 했고 중국 도 실시간으로 구조자 집계를 보도하는 등 전세계가 여객선 침몰과 승객 구조 상황에 촉각을 곤두세우고 있습니다 
5, 전남 진도 해상에서 발생한 여객선 세월호 침몰 사고로 현재까지 단원고 학년 학생을 포함 명이 사망한 것으로 알려졌다 일 오전 시 분쯤 청해진해운 소속 여객선 세월호가 전남 진도군 관매도 인근 해상에서 침몰해 오후 시 분 현재 선사 여직원 박모씨와 단원고 학년 정모군이 사망한 것으로 전해졌다 현재까지 실종자는 명에 이른다 일 오후 인천항을 출발해 제주도로 향하던 세월호에는 수학여행에 나선 안산 단원고등학교 학년 학생 명과 교사 명 등 명이 탑승했던 것으로 알려졌다 실종자 현황이 속속 파악되면서 년 월 전북 부안군 위도면 위수도 인근 해상에서 침몰한 서해 페리호 사건이 재연되는게 아니냐는 우려가 커지고 있다 서해 페리호는 높은 파도로 인해 전복돼 침몰했고 당시 사고로 명이 사망했다 
6, 전남 진도 해상에서 발생한 여객선 세월호 침몰 사고로 현재까지 단원고 학년 학생을 포함 명이 사망한 것으로 알려졌다 일 오전 시 분쯤 청해진해운 소속 여객선 세월호가 전남 진도군 관매도 인근 해상에서 침몰해 오후 시 분 현재 선사 여직원 박모씨와 단원고 학년 정모군이 사망한 것으로 전해졌다 현재까지 실종자는 명에 이른다 일 오후 인천항을 출발해 제주도로 향하던 세월호에는 수학여행에 나선 안산 단원고등학교 학년 학생 명과 교사 명 등 명이 탑승했던 것으로 알려졌다 실종자 현황이 속속 파악되면서 년 월 전북 부안군 위도면 위수도 인근 해상에서 침몰한 서해 페리호 사건이 재연되는게 아니냐는 우려가 커지고 있다 서해 페리호는 탑승 가능 인원을 초과해 승객을 태운 데다 높은 파도로 인해 항해 중 전복됐다 당시 사고로 명이 사망했다 
7, 전남 진도에서 발생한 여객선 세월호 침몰 사고로 현재까지 단원고 학년 학생을 포함 명이 사망한 것으로 알려졌다 일 오전 시 분쯤 청해진해운 소속 여객선 세월호가 전남 진도군 관매도 인근 해상에서 침몰해 오후 시 분 현재 선사 여직원 박지영씨와 단원고 학년 정차웅군이 사망한 것으로 전해졌다 현재까지 실종자는 명으로 알려졌다 일 오후 인천항을 출발해 제주도로 향하던 세월호에는 수학여행에 나선 안산 단원고등학교 학년 학생 명과 교사 명 등 명이 탑승했던 것으로 알려졌다 한편 사고현장에선 해경과 해군 함정 척관공선 등 척이 해상에서 헬기 대가 상공에서 수색 작업을 벌이고 있다 해군과 해경 잠수요원 명은 수중 수색에 나섰지만 시계가 좋지 않고 조류가 센 탓에 구조 작업에 난항을 겪고 있다 미 해군 함대도 일 오후 여객선 세월호가 침몰한 전남 진도 해상으로 상륙강습함 본험리차드호를 투입했다 상륙강습함은 헬리콥터 항공모함의 한 유형으로 군사작전시 적의 영토에 지상군을 투입시키는 상륙작전을 할 때 사용되는 군함이다 구조된 탑승객들은 해남종합병원 목포한국병원 중앙병원 등으로 이송됐다 
8, 전남 진도에서 발생한 여객선 세월호 침몰 사고로 현재까지 단원고 학년 학생을 포함 명이 사망한 것으로 알려졌다 일 오전 시 분쯤 청해진해운 소속 여객선 세월호가 전남 진도군 관매도 인근 해상에서 침몰해 오후 시 분 현재 선사 여직원 박모씨와 단원고 학년 정모군이 사망한 것으로 전해졌다 현재까지 실종자는 명에 이른다 일 오후 인천항을 출발해 제주도로 향하던 세월호에는 수학여행에 나선 안산 단원고등학교 학년 학생 명과 교사 명 등 여 명이 탑승했던 것으로 알려졌다 해군과 해경은 유도탄고속함 척 고속정 척 링스 헬기 등을 사고 해안으로 출동해 구조 작업을 진행 중이다 미 해군 함대도 일 오후 여객선 세월호가 침몰한 전남 진도 해상으로 상륙강습함 본험리차드호를 투입했다 상륙강습함은 헬리콥터 항공모함의 한 유형으로 군사작전시 적의 영토에 지상군을 투입시키는 상륙작전을 할 때 사용되는 군함이다 구조된 탑승객들은 해남종합병원 목포한국병원 중앙병원 등으로 이송됐다 
9, 일 오전 전남 진도군 관매도 인근 해상에서 침몰 중인 여객선은 인천과 제주도를 오가는 청해진해운의 대형 선박 세월호급다 세월호는 제주도로 향하는 대표적인 카페리여객과 자동차를 싣고 운항하는 배로 지난 년 운항을 시작해 매주 차례 인천과 제주도를 오가며 운항해왔다 정원 명 차량 대  트럭 대 컨테이너 개를 실을 수 있는 대형 선박이다 매주 화요일과 목요일 저녁 시 분 인천을 출발하는 세월호는 다음날 오전 시 제주도에 도착하는 일정으로 운항된다 선박 내부에는 객실 뿐 아니라 게임룸 샤워실 레스토랑 등 편의 시설이 갖춰져 있다 세월호의 침몰 이유는 아직 밝혀지지 않았으며 현장에서는 지속적인 구조작업이 이루어져 오전 시 현재 전체 명 승객 중 명 가량이 구조된 것으로 전해졌다 
10, 일 오전 전남 진도군 관매도 인근 해상에서 침몰 중인 여객선은 인천과 제주도를 오가는 청해진해운의 대형 선박 세월호급다 세월호는 제주도로 향하는 대표적인 카페리여객과 자동차를 싣고 운항하는 배로 지난 년 운항을 시작해 매주 차례 인천과 제주도를 오가며 운항해왔다 정원 명 차량 대  트럭 대 컨테이너 개를 실을 수 있는 대형 선박이다 매주 화요일과 목요일 저녁 시 분 인천을 출발하는 세월호는 다음날 오전 시 제주도에 도착하는 일정으로 운항된다 청해진해운 측은 세월호를 국내 최대 크루즈 선박이라고 홍보하고 있다 선박 내부에는 객실 뿐 아니라 게임룸 샤워실 레스토랑 등 편의 시설이 갖춰져 있다 세월호의 침몰 이유는 아직 밝혀지지 않았으며 현장에서는 지속적인 구조작업이 이루어져 오전 시 현재 전체 명 승객 중 명 가량이 구조된 것으로 전해졌다 
11, 전남 진도에서 발생한 여객선 세월호 침몰 사고로 현재까지 단원고 학년 학생을 포함 명이 사망한 것으로 알려졌다 일 오전 시 분쯤 청해진해운 소속 여객선 세월호가 전남 진도군 관매도 인근 해상에서 침몰해 오후 시 분 현재 선사 여직원 박지영씨와 단원고 학년 정차웅군이 사망한 것으로 전해졌다 현재까지 실종자는 명에 이른다 박씨는 시신 상태로 발견됐으며 정군은 의식이 없는 상태로 구조된 후 응급처치를 받다 숨졌다 당초 중앙재난안전대책본부는 명이 구조됐다고 밝혔지만 착오였던 것으로 확인됐다 사고 선박엔 총 명이 탑승했으며 이 중 안산 단원고 학생이 명 교사가 명이었으며 일반 승객 명과 승조원 명이 탄 것으로 알려졌다 한편 사고현장에선 해경과 해군 함정 척관공선 등 척이 해상에서 헬기 대가 상공에서 수색 작업을 벌이고 있다 해군과 해경 잠수요원 명은 수중 수색에 나섰지만 시계가 좋지 않고 조류가 센 탓에 구조 작업에 난항을 겪고 있다 현재 사고여객선은 최초 사고지점에서 마일 정도 떠내려간 상태로 선체는 뻘 바닥에 걸려서 움직이지 못하고 뱃머리만 물 밖으로 나와 있는 상태다 
12, 전남 진도에서 발생한 여객선 세월호 침몰 사고로 현재까지 명이 사망한 것으로 알려졌다 일 오전 시 분쯤 청해진해운 소속 여객선 세월호가 전남 진도군 관매도 인근 해상에서 침몰해 시 분 현재 선사 여직원 명과 신원미상의 남성 한 명이 사망한 것으로 전해졌다 급 여객선 세월호는 이날 쿵 소리와 함께 갑자기 좌현 쪽으로 기울면서 침수가 돼 침몰한 것으로 알려졌다 이 때문에 암초 등에 의한 외부 충격으로 좌초한 것으로 추정되고 있다 사망자 중 명은 선사 여직원 박모씨로 알려졌으며 신원미상의 남성은 대 후반에서 대 초반으로 추정된다 아직까지 탑승 인원 중 명이 실종되거나 배 안에 있는 것으로 확인됐다 일 오후 인천항을 출발해 제주도로 향하던 세월호에는 수학여행에 나선 안산 단원고등학교 학년 학생 명과 교사 명 등 여 명이 탑승했던 것으로 알려졌다 해군과 해경은 유도탄고속함 척 고속정 척 링스 헬기 등을 사고 해안으로 출동해 구조 작업을 진행 중이다 중앙재난대책본부에 따르면 시 기준 약 명이 구조됐으며 진도 팽목항에 구조 학생 명이 도착해 해남종합병원 목포한국병원 중앙병원 등으로 이송 중이다 
13, 세월호에 탑승했던 안산 단원고 학생 명과 교사 명이 사고 발생 시간이 경과한 시쯤 전원 구조됐다 에 따르면 오전 시 분쯤 배 안의 누수가 발견돼 해경에 조난 신고가 접수됐고 오전 시 분쯤엔 여객선 선내방송에서 여객선 침몰이 임박했으니 탑승객은 바다로 뛰어내리는 상황에 대비하라는 방송이 나오는 등 긴박한 상황이 계속됐지만 신속한 구조작업으로 학생과 교사 전원이 구조됐다 구조 작업에는 헬기 대와 해경과 해군 소방 등에서 동원된 선박 척 등 사고 해역 주변 대부분의 구조 가능 장비가 동원됐다 박일 일정으로 제주도 수학여행에 나선 이들은 일 오후 시 분에 인천을 출발해 제주로 향하고 있었다 세월호는 일 오전 시 분쯤 전남 진도군 조도면 병풍도 북쪽  해상에서 배에 물이 새고 있다며 조난 신고를 했다 
14, 전남 진도에서 발생한 여객선 세월호 침몰 사고로 현재까지 단원고 학년 학생을 포함 명이 사망한 것으로 알려졌다 일 오전 시 분쯤 청해진해운 소속 여객선 세월호가 전남 진도군 관매도 인근 해상에서 침몰해 오후 시 분 현재 선사 여직원 박지영씨와 단원고 학년 정차웅군이 사망한 것으로 전해졌다 현재까지 실종자는 명에 이른다 박씨는 시신 상태로 발견됐으며 정군은 의식이 없는 상태로 구조된 후 응급처치를 받다 숨졌다 당초 중앙재난안전대책본부는 명이 구조됐다고 밝혔지만 착오였던 것으로 확인됐다 사고 선박엔 총 명이 탑승했으며 이 중 안산 단원고 학생이 명 교사가 명이었으며 일반 승객 명과 승조원 명이 탄 것으로 알려졌다 
15, 전남 진도에서 발생한 여객선 세월호 침몰 사고로 현재까지 단원고 학년 학생을 포함 명이 사망한 것으로 알려졌다 일 오전 시 분쯤 청해진해운 소속 여객선 세월호가 전남 진도군 관매도 인근 해상에서 침몰해 오후 시 분 현재 선사 여직원 박모씨와 단원고 학년 정모군이 사망한 것으로 전해졌다 현재까지 실종자는 명에 이른다 한편 인천시의 집계 결과 인천 용유초등학교 동창생들이 단체로 배를 탔다 사고를 당한 것으로 알려졌다 인천시는 오후 시분경 보도자료를 통해 용유초 동창생 명이 세월호에 탑승한 것으로 확인됐다며 현재 명만 구조되고 나머지 인원에 대해선 상황을 파악하고 있다고 밝혔다 일 오후 인천항을 출발해 제주도로 향하던 세월호에는 수학여행에 나선 안산 단원고등학교 학년 학생 명과 교사 명 등 여 명이 탑승했던 것으로 알려졌다 구조된 탑승객들은 해남종합병원 목포한국병원 중앙병원 등으로 이송됐다 
16, 일 승객 명을 태운 여객선 세월호가 침몰한 해역의 유속流速과 시야視野 등 구조 환경이 과거 천안함 침몰 해역보다도 더 좋지 않은 최악의 상황이라 구조 작업에 어려움이 예상된다 국방부 대변인은 일 브리핑을 통해 과거 천안함 구조작업 당시 인근 해역의 유속이 였고 확보된 시야가  미만이라 큰 어려움을 겪었다며 그런데 이번 세월호 침몰 해역은 유속이 에 시야는 도 안 된다고 밝혔다 이어 수심은 여로 깊지는 않지만 환경이 워낙 좋지 않아 섣불리 수중 구조작업에 나섰다간 잠수부들의 안전도 장담할 수 없는 상황이라고 말했다 국방부는 현재 수중 구조 작업은 이뤄지지 않고 있다고 밝혔다 현장에 급파된 여명의 잠수 가능한 특전사 신속대응부대는 혹시 있을지 모를 실종자를 찾기 위해 주변 탐색을 진행 중이다 국방부는 본격적인 수중 구조 작업은 구조함艦인 청해진함과 평택함이 사고 현장에 도착한 뒤에야 가능하다고 밝혔다 구조함은 속력이 느려 청해진함과 평택함 모두 일 오전 시가 돼야 사고 현장에 도착할 예정이다 국방부는 사고 발생 후 척의 해군함정과 구조헬기 등을 현장에 급파한 상태다 미 해군상륙강습함정 본험리차드함도 현재 사고 현장으로 향하고 있다 
17, 제주도 수학여행을 나선 고등학생 등 승객과 승무원 명이 탑승한 여객선 세월호가 일 오전 전남 진도 해상에서 침몰해 최소 명이 사망하고 명이 실종된 가운데 사고 원인에 대해 관심이 쏠리고 있다 서해지방해양경찰청이 이날 저녁까지 밝힌 사실은 세월호가 좌현으로 심하게 기울고 침수돼 침몰했다는 것 뿐이다 관계 당국은 세월호가 갑자기 기울어진 원인에 대해선 명확한 설명을 내놓지 못하고 있다 생존자 다수는 사고 당시 쾅하는 큰 소리가 났다고 주장하고 있다 해양수산부는 사고지역이 암반지대라고 밝히기도 했다 이 때문에 세월호가 암초 등의 장애물에 충돌해 선체가 파손되면서 바닷물이 유입돼 한쪽으로 기울어 침몰로 이어졌다는 가설이 나오고 있으나 사실 여부는 확인되지 않았다 이에 대해 세월호 조타수 등 승선원들은 사고 해상에는 암초가 거의 없는 것으로 안다며 쾅 소리는 선박에 실린 컨테이너가 컨테이너끼리 또는 선체와 부딪히면서 난 소리였을 것으로 보인다고 주장하고 있다 세월호는 당초 일 오후 시 분쯤 인천항에서 출항할 예정이었으나 짙은 안개 때문에 예정보다 시간 분 늦은 밤 시쯤 항구를 떠났다고 알려졌다 때문에 관계 당국은 출항 시각이 늦어지자 선장 등이 항해 시간을 줄이기 위해 항로를 변경했다가 암초 등과 충돌했을 가능성이 있다고 밝혔다 그러나 사고 선박의 선사인 청해진해운 측은 세월호가 안전 항로에서 크게 벗어나지 않은 것으로 알고 있다고 주장했다 해양수산부도 평소에 오가던 항로에서 크게 벗어난 것은 아니라는 잠정 결론이 나왔다며 이를 뒷받침했다 또 이날 선박을 운항한 선장이 대리 선장이라는 지적도 제기됐지만 사고와 직접적인 연관성은 없다는 것이 중론이다 조타수 오모씨는 신모 선장은 매월 주어지는 박일의 휴가를 간 상태였기 때문에 또 다른 선장 이모씨가 세월호 운항을 맡은 것이라며 이는 당연한 일이라고 설명했다 또 구조된 학생들은 배가 기울기 시작했는데도 여객선측이 아무런 설명도 없이 방송으로만 움직이지 말고 그대로 있으라고 했다고 주장했다 때문에 미흡한 초기대응이 대형 참사를 불러온 것 아니냐는 지적도 나온다 움직이지 말라는 말이 결국 대형참사를 불렀다는 것이다 한편 중앙재난안전대책본부에 따르면 사고 선박에는 총 명의 승객이 타고 있었으며 현재까지 사망 인원은 명 구조인원은 명이다 명은 아직 생사 여부가 확인되지 않았다 
18, 전남 진도에서 발생한 여객선 세월호 침몰 사고로 현재까지 단원고 학년 학생을 포함 명이 사망한 것으로 알려졌다 일 오전 시 분쯤 청해진해운 소속 여객선 세월호가 전남 진도군 관매도 인근 해상에서 침몰해 시 분 현재 선사 여직원 명과 단원고 학년 남학생이 사망한 것으로 전해졌다 급 여객선 세월호는 이날 쿵 소리와 함께 갑자기 좌현 쪽으로 기울면서 침수가 돼 침몰한 것으로 알려졌다 이 때문에 암초 등에 의한 외부 충격으로 좌초한 것으로 추정되고 있다 사망자 중 명은 선사 여직원 박모씨와 단원고 학년 정모군으로 알려졌다 현재까지 실종자는 명에 이른다 일 오후 인천항을 출발해 제주도로 향하던 세월호에는 수학여행에 나선 안산 단원고등학교 학년 학생 명과 교사 명 등 여 명이 탑승했던 것으로 알려졌다 해군과 해경은 유도탄고속함 척 고속정 척 링스 헬기 등을 사고 해안으로 출동해 구조 작업을 진행 중이다 구조된 탑승객들은 해남종합병원 목포한국병원 중앙병원 등으로 이송됐다 
19, 전남 진도에서 발생한 여객선 세월호 침몰 사고로 현재까지 단원고 학년 학생을 포함 명이 사망한 것으로 알려졌다 일 오전 시 분쯤 청해진해운 소속 여객선 세월호가 전남 진도군 관매도 인근 해상에서 침몰해 오후 시 분 현재 선사 여직원 박모씨와 단원고 학년 정모군이 사망한 것으로 전해졌다 현재까지 실종자는 명에 이른다 한편 인천시의 집계 결과 인천 용유초등학교 동창생들이 단체로 배를 탔다 사고를 당한 것으로 알려졌다 인천시는 오후 시분경 보도자료를 통해 용유초 동창생 명이 세월호에 탑승한 것으로 확인됐다며 현재 명만 구조되고 나머지 인원에 대해선 상황을 파악하고 있다고 밝혔다 일 오후 인천항을 출발해 제주도로 향하던 세월호에는 수학여행에 나선 안산 단원고등학교 학년 학생 명과 교사 명 등 여 명이 탑승했던 것으로 알려졌다 구조된 탑승객들은 해남종합병원 목포한국병원 중앙병원 등으로 이송됐다 
20, 전남 진도에서 발생한 여객선 세월호 침몰 사고로 현재까지 단원고 학년 남학생을 포함 명이 사망한 것으로 알려졌다 일 오전 시 분쯤 청해진해운 소속 여객선 세월호가 전남 진도군 관매도 인근 해상에서 침몰해 시 분 현재 선사 여직원 명과 신원미상의 남성 한 명이 사망한 것으로 전해졌다 급 여객선 세월호는 이날 쿵 소리와 함께 갑자기 좌현 쪽으로 기울면서 침수가 돼 침몰한 것으로 알려졌다 이 때문에 암초 등에 의한 외부 충격으로 좌초한 것으로 추정되고 있다 사망자 중 명은 선사 여직원 박모씨와 단원고 학년 정모군으로 알려졌다 또 다른 신원미상의 남성은 대 후반에서 대 초반으로 추정된다 현재까지 실종자는 명에 이른다 일 오후 인천항을 출발해 제주도로 향하던 세월호에는 수학여행에 나선 안산 단원고등학교 학년 학생 명과 교사 명 등 여 명이 탑승했던 것으로 알려졌다 해군과 해경은 유도탄고속함 척 고속정 척 링스 헬기 등을 사고 해안으로 출동해 구조 작업을 진행 중이다 중앙재난대책본부에 따르면 시 기준 약 명이 구조됐으며 진도 팽목항에 구조 학생 명이 도착해 해남종합병원 목포한국병원 중앙병원 등으로 이송 중이다 
21, 일 진도 앞바다에서 침몰한 세월호에는 인천 중구 용유초등학교 동창생 명도 단체 탑승했던 것으로 알려졌다 이 중 명만이 구조됐으며 나머지는 생사가 불투명하다 인천시는 오후 시 분쯤 보도자료를 통해 용유초 동창생 명이 세월호에 탑승한 것으로 확인됐다며 현재 명만 구조되고 나머지 인원에 대해선 상황을 파악하고 있다고 밝혔다 이들의 단체 탑승여부는 탑승객 가족 명이 세월호 선사인 청해진 해운 본사를 찾아 구조자 명단을 확인하는 과정에서 알려졌다 세월호 탑승객 중 안산단원고 학생 및 교사 선원들을 제외한 일반 승객의 신원 확인은 더욱 더디게 확인되고 있다 일반 승객들의 경우 승선표 기재사항이 성명 연락처 생년월일만 적게 돼 있어 거주지 파악 등에 어려움을 겪고 있는 것으로 알려졌다 한편 시는 사고 발생 직후 송영길 시장 주재로 긴급 간부회의를 개최하고 탑승객 명단 확인 작업에 돌입했다 
