,x
20, 세월호 참사로 인해 뷰티풀민트라이프이하 뷰민라 일방적 취소에 대해 가수 김가 불편한 심경을 드러냈다 지난 일 김는 자신의 트위터에 공연을 하고 안하고는 정치가들의 판단 대상이 아니다라는 글을 남긴 뒤 이어 살면서 단 한번이라도 음악으로 위로 받아본 적 없는 이들이었다면 인생을 되짚어 볼 필요가 있다 음악은 흥만을 위한 것이 아니다 심지어 작두타는 점쟁이에게 음악이 없다면 작두타기는 불가능하다는 얘기도 들었다 즐거움 뿐만 아니라 위로가 필요할때도 음악은이라는 글을 남겼다 이는 앞서 지난 일 개최 예정이던 뷰민라가 고양문화재단의 일방적인 취소 통보로 인해 무산된 것 김외에도 수많은 음악인들이 이에 대해 안타까운 심경을 드러내고 있다 세월호 참사로 인한 뷰민라 공연 취소 소식을 접한 누리꾼들은 세월호 참사 다 준비해놓은 공연을 시간 전에 취소하는 게 말인가 세월호 참사 안타깝지만 나라가 애도를 지나치게 강요하네요 세월호 참사 뷰민라 취소는 좀 어이없다 음악이 다 놀고 먹는건가 등의 반응을 보였다 
21, 세월호 침몰 사고 원인을 조사 중인 검경합동수사본부가 초기 대응 부실 논란을 빚은 해경에 수사의 칼날을 겨누기 시작했다 합수부는 지난 일 서해지방해양경찰청 관할 진도 해상교통관제센터에 수사관을 보내 압수수색하고 세월호 침몰 당시 교신 내역과 항적 자료 관제 관련 서류 내부 화면 등을 확보해 분석 중이라고 일 밝혔다 합수부는 진도가 지난 일 세월호가 관제구역에 진입한 사실을 레이더와 선박자동식별시스템을 통해 인지하고서도 이상 징후를 발견하지 못하는 등 부실 관제로 초동 대처에 문제가 있었던 것으로 보고 있다 합수부는 일 해운항만청이 관리하는 제주에 수사관을 보내 사고 당시 업무 준칙 준수 여부 등에 대한 조사를 진행했다 목포해경 상황실도 수사 대상인 것으로 알려졌다 목포해경 상황실은 최초 신고한 학생에게 위도와 경도 등을 물어보며 분을 지체했다 합수부는 승객 대부분을 남겨두고 탈출한 선박직 승무원 명 중 지난 일 가장 먼저 구속된 선장 이준석씨와 급항해사 박한결여씨 조타수 조준기씨 등 명을 검찰에 일 송치했다 광주지법 목포지원은 지난 일 조타수 박모오모씨 조기장 전모씨 조기수 김모씨 등 명에 대한 사전 구속영장을 발부했다 이로써 승객 구조 의무를 저버리고 세월호에서 탈출한 선박직 승무원 명 전원이 구속됐다 합수부는 또 세월호 화물 적재고정 선박 증설설계 업체 관계자 명을 참고인 신분으로 불러 조사했다 한국선급 비리를 수사 중인 부산지검 특별수사팀은 수사 대상에 오른 전현직 한국선급 임직원에 대해 계좌 추적을 벌인다고 일 밝혔다 특별수사팀은 한국선급에서 압수한 회계장부와 전산 자료 등을 분석해 자금 흐름을 추적하는 한편 일부터 비리 의혹이 있는 임직원들의 계좌를 조사할 계획이다 앞서 합수부는 지난 일 선박해양 관련 산학연 전문가들이 참여하는 전문가 자문단을 꾸려 운영에 들어갔다 자문단은 세월호와 똑같은 형태의 모형 배를 만들고 모의실험시뮬레이션을 해 세월호 침몰 원인을 과학적으로 규명하게 된다 
22, 세월호 참사에 영국 가수 코니탤벗이 노란리본달기 캠페인에 동참했다 지난 일 서울 용산구 한남동 블루스퀘어홀에서는 코니탤벗의 내한 공연 코니와 친구들의 행복한 콘서트가 열렸다 이날 코니탤벗은 노란드레스를 입고 마이크와 악기에 노란리본을 다는 모습으로 노란리본달기 캠페인에 동참하며 따뜻한 마음씨를 보였다 앞서 코니탤벗은 지난 일 내한 공연에 앞서 자신의 트위터를 통해 세월호에 공연 수익금을 기부하겠다는 뜻을 밝혀 화제가 됐으며 이에 지난 일 열린 콘서트 기자간담회에서 내가 무슨 일을 할 수 있을까 고민하다 조금이나마 돕고 싶어서 수익금을 기부하기로 했다 한국은 나를 항상 반갑게 환영을 해준다 조금이나마 힘이 되고 싶다고 수익금을 기부하기로 한 결정에 대해 밝히기도 했다 세월호 코니탤벗 노란리본달기 캠페인과 수익금 기부 소식을 접한 누리꾼들은 세월호 코니탤벗 노란리본달기 캠페인 진짜 고맙네 세월호 코니탤벗 노란리본달기 캠페인 노란색 드레스까지 입다니 세월호 코니탤벗 노란리본달기 캠페인 감사합니다 등의 반응을 보였다 
23, 그것이 알고 싶다 세월호가 많은 관심을 받고 있다 지난 일 방송된 그것이 알고싶다에서는 세월호 침몰 사고의 원인과 관련된 불편한 진실에 대해 다뤘다 이날 방송에서 제작진은 피해자 가족과의 인터뷰를 진행하던 도중 이를 몰래 녹취하던 사복 차림의 남성을 발견하고 소속을 밝히라 요청한다 알고보니 사복 차림의 남성은 자신이 경찰임을 고백하며 부정보도가 나올 것을 우려해 녹취를 했다 이번에 모 방송 홍 씨 때문에 많이 당한 거 아시죠 조심하세요라고 말을 한다 후에 제작진은 해당 경찰서에 신분 확인을 요청하자 관계자는 저희 소속 해양 경찰관이 맞다고 밝히며 녹취는 해당 경찰의 개인적인 돌발행동이라고 하는 모습을 보였다 그것이 알고 싶다 세월호 편을 본 누리꾼들은 그것이 알고 싶다 세월호 진짜 이상한 점이 한 둘이 아니네 그것이 알고 싶다 세월호 배 기우는 모습 나올때마다 소름 돋아서 못 보겠다 그것이 알고 싶다 세월호 경찰 녹취 정말 소름 돋았음 등의 반응을 보였다 
24, 그것이 알고 싶다 세월호 특집이 방송된 가운데 배정훈 가 김상중에 고마움을 전했다 지난 일 배정훈 는 자신의 트위터를 통해 나이 들면 눈물을 보이기 쉽지 않다고 한다 진심으로 같이 울어준 김상중 형님의 마지막 말이 너무나 고마웠다 형님 가슴에 얹힌 그 노란 리본은 평생 기억할 것 같아요라는 글을 게재했다 이는 앞서 방송된 그것이 알고 싶다의 진행을 맡고 있는 김상중이 차디찬 바다 밑에서 어른들의 말을 믿고 어른들이 구해주길 기다렸을 아이들과 그날의 공포에서 벗어나지 못한 생존자에게 드리고 싶은 말이 있다 부끄럽고 무기력한 어른이라 죄송하다 지켜주지 못해 미안하다고 하며 눈시울을 붉혔다 그것이 알고 싶다 세월호 특집을 접한 누리꾼들은 그것이 알고 싶다 세월호 정말 의심스러운 점이 한 둘이 아니네요 그것이 알고 싶다 세월호 김상중 씨 님 정말 감사합니다 그것이 알고 싶다 세월호 재방으로 봤는데 눈물이 났지만 끝까지 봤습니다 등의 반응을 보였다 
25, 아베 신조安倍晋三 일본 총리가 세월호 침몰 사건 희생자를 추도했다 일 교도통신에 따르면 아베 총리는 이날 도쿄도 미나토구의 재일본대한민국민단 중앙본부에 설치된 세월호 참사 희생자 추모 헌화대에 꽃을 올리고 고개를 숙여 애도했다 아베 총리가 헌화 후 많은 분이 희생됐다 정말 마음이 아프다고 말했다 이후 아베 총리는 이병기 주일 한국대사와 만나 한국 국민과 박근혜 대통령에게 애도의 뜻을 전한다고 언급한 것으로 알려졌다 아베 총리뿐만 아니라 일본 정부 대변인인 스가 요시히데菅義偉 관방장관 기시다 후미오岸田文雄 일본 외무상도 이날 추모 헌화대를 방문 헌화하고 애도를 표했다 기시다 외무상은 이 대사에게 마음이 아프고 일본 국민 중 한 명으로서 다시 한 번 유족과 피해자 한국 국민에게 위로의 말씀을 전한다고 했다 
26, 이른바 구원파로 불리는 기독교복음침례회가 한국 언론이 사실검증 없는 보도로 종교탄압을 하고 있다며 우리는 오대양 사건과 무관하고 죄를 지어도 죄가 아니다 등의 교리도 없다며 등에 공정성 회복 촉구 집회를 벌였다 기독교복음침례회 신도 여명은 일 오후 서울 여의도 본관 앞에서 집회를 열고 언론이 폭로성 허위날조 보도로 우리 신자들이 충격과 고통을 받고 있다면서 이같이 촉구했다 이들은 오대양 사건은 일부 이탈한 신도들이 저지른 사건이라며서 그럼에도 언론이 폭로성 주장을 검증 없이 보도해 신자들이 마녀사냥을 당하고 있다고 주장했다 또 무차별 폭격 보도로 우리 아이들이 학교에서 따돌림을 받는 등 인권의 사각지대에 버려지고 있다면서 우리도 국민으로서 인격을 보호받을 권리가 있다고 주장했다 이들은 세월호 침몰 참사 유가족들의 슬픔을 애도한다면서도 언론과 검찰이 구원파와 관련 없는 의혹을 제기하고 있다 기독교복음침례회가 세월호를 침몰시킨 장본인이냐고 반문했다 이들은 언론이 이준석 선장을 구원파로 몰고 생명경시를 일삼는 구원파가 아이들을 세월호에 버려두고 나온 것이라는 논리를 만들어냈다면서 이 선장은 신도가 아니며 구조된 선원 가운데 명만이 구원파 신도인 것으로 확인됐다고 밝혔다 이들에 따르면 청해진해운 직원 가운데 신도는 에 불과하다 이들은 구원파가 세월호 선사인 청해진해운의 관계사와 거액의 자금을 주고 받았다는 일부 언론과 검찰의 의혹을 전면 부인했다 이어 신도들의 헌금이 유병언 전 세모그룹 회장 측으로 흘러갔다는 일부 언론의 보도가 악의적이고 편파적인 보도라며 사실 무근이라고 주장했다 이들은 지난 일 이태원 크라운 호텔에서 기자회견을 열고 자신들을 둘러싼 세간의 의혹을 전면 부인한 바 있다 세월호 수사를 담당하고 있는 검경 합동수사본부는 유병언 전 회장의 자금줄를 구원파 인사들로 보고 관련인들을 조사 중이다 한편 구원파 기독교복음침례회는 기독교에선 이단으로 규정하는 종파다 기독교복음침례회는 년 유 전 회장과 그의 장인인 권신찬 목사에 의해 시작된 것으로 알려졌다 유 전 회장은 년 기독교복음침례회에서 목사 안수를 받았다 이날 집회에 참여한 기독교복음침례회 신도들은 왼쪽 가슴에 세월호 희생자를 추모하는 노란 리본을 달고 우의를 입었다 
27, 이른바 구원파로 불리는 기독교복음침례회가 한국 언론이 사실검증 없는 보도로 종교탄압을 하고 있다며 우리는 오대양 사건과 무관하고 죄를 지어도 죄가 아니다 등의 교리도 없다며 등에 공정성 회복 촉구 집회를 벌였다 기독교복음침례회 신도 여명은 일 오후 서울 여의도 본관 앞에서 집회를 열고 언론이 폭로성 허위날조 보도로 우리 신자들이 충격과 고통을 받고 있다면서 이같이 촉구했다 이들은 오대양 사건은 일부 이탈한 신도들이 저지른 사건이라며서 그럼에도 언론이 폭로성 주장을 검증 없이 보도해 신자들이 마녀사냥을 당하고 있다고 주장했다 또 무차별 폭격 보도로 우리 아이들이 학교에서 따돌림을 받는 등 인권의 사각지대에 버려지고 있다면서 우리도 국민으로서 인격을 보호받을 권리가 있다고 주장했다 이들은 세월호 침몰 참사 유가족들의 슬픔을 애도한다면서도 언론과 검찰이 구원파와 관련 없는 의혹을 제기하고 있다 기독교복음침례회가 세월호를 침몰시킨 장본인이냐고 반문했다 이들은 언론이 이준석 선장을 구원파로 몰고 생명경시를 일삼는 구원파가 아이들을 세월호에 버려두고 나온 것이라는 논리를 만들어냈다면서 이 선장은 신도가 아니며 구조된 선원 가운데 명만이 구원파 신도인 것으로 확인됐다고 밝혔다 이들에 따르면 청해진해운 직원 가운데 신도는 에 불과하다 이들은 구원파가 세월호 선사인 청해진해운의 관계사와 거액의 자금을 주고 받았다는 일부 언론과 검찰의 의혹을 전면 부인했다 이어 신도들의 헌금이 유병언 전 세모그룹 회장 측으로 흘러갔다는 일부 언론의 보도가 악의적이고 편파적인 보도라며 사실 무근이라고 주장했다 이들은 지난 일 이태원 크라운 호텔에서 기자회견을 열고 자신들을 둘러싼 세간의 의혹을 전면 부인한 바 있다 세월호 수사를 담당하고 있는 검경 합동수사본부는 유병언 전 회장의 자금줄를 구원파 인사들로 보고 관련인들을 조사 중이다 한편 구원파 기독교복음침례회는 기독교에선 이단으로 규정하는 종파다 기독교복음침례회는 년 유 전 회장과 그의 장인인 권신찬 목사에 의해 시작된 것으로 알려졌다 유 전 회장은 년 기독교복음침례회에서 목사 안수를 받았다 이날 집회에 참여한 기독교복음침례회 신도들은 왼쪽 가슴에 세월호 희생자를 추모하는 노란 리본을 달고 우의를 입었다 
28, 방송인 최희가 그것이 알고싶다 세월호 시청 소감을 남겼다 지난 일 최희는 자신의 트위터에 그것이 알고 싶다를 봤어요 정말 미안하고 또 미안하네요 믿어지지않는 너무나 나약하고 비극적인 그리고 이기적인 현실 속에 희생당한 이들을 추모합니다 잊지말고 꼭 변화가 있기를 바랍니다라는 글을 게재했다 앞서 지난 일 그것이 알고 싶다에서는 희망은 왜 가라앉았나세월호 특집을 마련해 세월호 침몰 사고의 원인과 관련된 불편한 진실에 대해 다뤘다 그것이 알고 싶다 세월호 최희 시청소감을 접한 누리꾼들은 그것이 알고 싶다 세월호 정말 의혹이 많은 회였다 그것이 알고 싶다 세월호 최희 말에 정말 동감이다 그것이 알고 싶다 세월호 너무 의문이 많아서 화난다 등의 반응을 보였다 
29, 그것이 알고 싶다 세월호 편을 접한 최희가 소감을 남겼다 지난 일 최희는 자신의 트위터에 그것이 알고 싶다를 봤어요 정말 미안하고 또 미안하네요 믿어지지 않는 너무나 나약하고 비극적인 그리고 이기적인 현실 속에 희생당한 이들을 추모합니다 잊지 말고 꼭 변화가 있길 바랍니다라는 글을 남겼다 앞서 지난 일 그것이 알고 싶다에서는 희망은 왜 가라앉았나세월호 특집을 마련해 세월호 침몰 사고의 원인과 관련된 불편한 진실에 대해 다뤘다 그것이 알고 싶다 세월호 편을 접한 누리꾼들은 그것이 알고 싶다 세월호 최희 말 공감 이기적인 현실이다 정말 그것이 알고 싶다 세월호 이상한 점이 너무나 많다 그것이 알고 싶다 세월호 정말 제대로 알고 싶다 등의 반응을 보였다 
30, 세월호 침몰 당시 탑승자가 보낸 마지막 메시지는 일 오전 시 분 카카오톡을 통해서 발신된 것으로 밝혀졌다 이 때는 세월호가 도 가량 기운 채 침몰하고 있던 시점이다 일 검경 합동수사본부는 승객 전체의 카카오톡 메시지 내용을 압수수색해 분석한 결과 맨 마지막에 보낸 것으로 확인 된 것은 일 오전 시 분 메시지였으며 이 탑승객은 학생으로 알려졌다 이 탑승객의 구조 여부는 아직 알려지지 않았지만 실종됐을 가능성이 큰 것으로 추정되고 있다 만약 이 탑승객이 살아있었다면 그 이후에도 카카오톡을 계속 이용했을 것이기 때문이다 이 학생이 실종자라면 일 오전 시 분까지는 탑승객들이 생존했다는 뜻이 된다 세월호가 침몰할 당시 해경이 촬영한 영상에 따르면 일 오전 시 분 당시 여객선은 도로 전도돼 있었고 해경은 정이 도착해 구조활동을 벌이고 있었다 상공에는 헬기 대가 비행하고 있었고 어선 수척도 구조 활동에 합류한 상태였다 합수부 책임자인 안상돈 광주고검 차장검사는 승객들의 카카오톡 메시지 전체를 확보해 분석하고 있다며 분석이 완료되면 침몰 당시의 정황을 어느 정도 파악할 수 있을 것으로 기대한다고 밝혔다 토론 鄭 총리 사의 표명 정부 책임 차원 당연 사태수습 먼저 무책임 
31, 희생자 시신 유실을 방지하기 위해 민관군이 참여하는 특별대책반이 꾸려지고 희생자 가족에 대 전담공무원이 배치된다 범정부 사고대책본부 고명석 대변인은 일 오전 시 진도군청에서 브리핑을 열고 이같이 밝혔다 특별대책반은 희생자 시신 유실 방지 대책의 일환으로 구성됐다 수중수색반 선박수색반 항공수색반 해안도서수색반 어선수색반 해양조사반 등 개반으로 나뉜다 기관간 긴밀한 협력체계를 구축하는 한편 헬기 함정 어선 행정선 인력 등을 동원해 희생자 시신 수색에 나서겠다는 방침이다 앞서 각 부처별로 나뉜 구조작업으로 인해 업무혼선이 빚어진데 따른 조치로 풀이된다 대책본부에 따르면 이미 희생자 가족별 대 전담공무원 배치 추진 계획에 여 가족이 지원 희망 의사를 밝혔다 해당 가족들에게는 전담공무원이 배치돼 희생자 이송 장례 보상 등 전 과정을 돕는다 더불어 진도 실내체육관과 팽목항에 이동파출소를 설치하고 실종자 가족 주거지역 순찰과 방범활동을 강화하기로 했다 고 대변인은 또 진도 교신 파일 조작의혹에 대해 해명했다 그는 진도 교신 파일 원본은 이미 전 언론에 공개했고 세월호와 교신 내용만 편집해 올린 것이라며 교신 당시 상황 그대로 녹음된 것으로 어떤 조작이나 의도된 편집이 없었다고 거듭 밝혔다 뒤늦은 최초 구조 영상 공개에 대해서도 해경 개인의 휴대전화 촬영본으로 합수부에서도 구조영상을 뒤늦게 확보해 공개한 것이라고 해명했다 세월호 인양과 관련해서는 인양을 준비하고 있지만 시기는 실종자 가족들과 협의해 계획을 세울 것이라고 전했다 한편 이날 고 대변인이 브리핑을 진행하던 중에 한 민간 잠수사가 단상에 올라가 해경측이 곧 현장에 도착할 이주영 해양수산부 장관의 격려를 받고 가라며 민간잠수요원을 제지했다며 거세게 항의하는 등 해프닝이 있었지만 이는 사실과 다른 것으로 확인됐다 
32, 세월호 참사로 집권 후 최대 난관에 직면한 박근혜 대통령이 일 정홍원 국무총리의 사의辭意를 수용함으로써 인적人的 개편 카드를 꺼내 들었다 청와대 주변에서는 기 내각이라는 말이 나올 정도의 대대적 인적 개편이 뒤따를 것이란 관측이 나오고 있다 박 대통령은 아울러 정부 조직에 대한 개편도 준비 중인 것으로 전해졌다 ◇단계 인적 개편 카드 인적 개편과 관련해 박 대통령이 내놓은 단계 조치는 총리 교체였다 박 대통령은 정 총리의 사퇴 기자회견이 있은 지 시간여 만에 민경욱 청와대 대변인을 통해 사의 수용을 밝혔다 지금까지 청와대가 선先 사고 수습 후後 인적 개편 입장을 견지해 온 것에 비춰보면 한 템포 빠른 수용이었다 사고 수습이 끝나지 않았는데도 박 대통령이 총리 사퇴 카드를 선택한 것에 대해 청와대의 한 관계자는 갈수록 악화되는 대정부 비판 여론을 그냥 내버려두기 어렵다고 판단한 것이라고 했다 아울러 그만둘 사람에게 계속 일을 맡기는 어정쩡한 상황도 감수할 수밖에 없다고 본 것이다 주목되는 것은 이어질 박 대통령의 단계 조치다 박 대통령이 이날 총리 교체를 기정사실화한 것을 놓고 참모들은 내각 개편에 대한 강한 의지를 피력한 것이라고 했다 다만 신임 총리 지명 등 인적 개편의 속도와 관련해선 관측이 엇갈린다 정부 고위 관계자는 그동안 후임 총리 후보를 물색하는 작업이 꽤 진척된 것으로 안다며 이르면 내달 초에도 후임 총리 후보를 발표할 수 있다고 했다 하지만 여당의 한 고위 관계자는 지방선거 전에는 총리만 교체하고 지방선거가 끝난 뒤 신임 총리가 제청하는 형식으로 개각을 단행할 가능성이 있다고 했다 ◇대대적 개편 가능성 배제 못 해 개각의 규모와 관련해 그동안 청와대 내에선 중폭은 넘지 않을 것이란 기류가 많았다 그러나 박 대통령이 예상보다 일찍 총리 교체 카드를 꺼내 놓았기 때문에 이제 그 폭을 가늠하기는 어렵게 됐다는 말들이 나오기 시작했다 여권 고위 관계자는 박 대통령이 비상非常한 생각을 하고 있는 것 같다며 폭은 정확히 모르지만 대대적인 개편 가능성도 배제할 수 없는 상황이라고 했다 일단 이번 사고 대응에 책임이 있는 강병규 안전행정부 장관 이주영 해양수산부 장관 서남수 교육부 장관 등은 교체 대상에서 빠지기 어렵다는 관측이다 여기에 현오석 경제부총리 등 경질론이 불거졌던 일부 장관들이 포함될 것이란 얘기가 나오기 시작했다 새누리당에서는 국가정보원장도 교체 대상이 될 수 있다는 말이 나왔다 박 대통령의 고민은 이들을 모두 교체할 경우 상당 기간 국정 공백이 불가피하다는 점이다 이와 관련해 청와대 관계자들은 경제 지표가 호전되고 있기 때문에 현 부총리 등 경제 라인의 교체가 시급한 것은 아니지 않으냐 북한의 추가 핵실험 위협 앞에서 안보 라인 교체도 어려운 것 같다고 했다 이런 가운데 여권에서는 청와대 역시 개편이 필요하다는 지적이 나오고 있다 여당의 한 초선 의원은 박근혜 정부를 전면적으로 일신하기 위해 내각 총사퇴론까지 나오는 마당에 청와대 참모들도 예외가 될 수 없지 않으냐고 했다 또 다른 여당 의원도 이번 세월호 사고 발생 직후 청와대 참모들이 박 대통령에게 구조救助 가능성을 낙관적으로 보고하는 등 정부의 부실한 대응과 관련해 책임을 면하기 어렵다고 했다 아울러 박 대통령은 이번 사고로 드러난 잘못된 시스템과 관행을 대대적으로 바꾸는 방안을 조만간 발표할 것으로 알려졌다 정부 관계자는 세월호 참사로 국가 재난 컨트롤타워의 재정비 필요성이 제기됐다면서 그 주무 부처인 총리실과 안전행정부 등의 조직을 개편하고 관련 법규의 개정도 추진 중이라고 했다 박 대통령은 지난 일 청와대 수석비서관 회의에서 보다 더 강력한 재난 대응 컨트롤 타워가 필요하다고 본다고 대책 마련을 지시했었다 
33, 목포해경 소속 경비정 정 김경일 정장이 일 오전 시 진도 서망항에서 기자회견을 갖고 세월호 침몰과 초기 구조활동 당시 상황에 대해 밝혔다 김 정장은 사고해역 도착과 동시에 구명정을 내리고 승객 전원 탈출하라는 대공 방송을 했다며 선체가 좌측으로 도가량 기울어져 있는 등 경사가 심했고 나오는 사람들을 구조하느라 해경이 선내에 진입할 수 없었다고 말했다 김 정장은 또 구조 당시 선원과 승객 모두 겁에 질려 있던 상황이라고 전했다 김 정장에 따르면 당시 정은 오전 시 분쯤 세월호 사고에 대한 교신을 받았고 오전 시 분쯤 인근에서 조업 중이던 어선들에게 총동원 명령을 내렸다 정은 전속력으로 사고해역에 접근해 오전 시 분쯤 도착했고 도착하자마자 정내 방송장치를 이용해 승객 여러분 전원 바다에 뛰어내리십시오라는 방송을 했다고 밝혔다 오전 시 분쯤앤 인근 어선 척 정도가 모여들었다고 한다 김 정장은 방송을 한 뒤 분이 지나자 사람이 보였고 단정이 최초로 가서 먼저 구했다며 긴박한 상황이었기 때문에 승객인지 선원인지 알 수 없었다고 말했다 해경은 당시 조타실에 있는 사람을 발견 망치로 창문을 깨고 승무원 명을 먼저 구했다 사람이 명씩 내려오기 때문에 누구인지 분간이 안 갔고 우선적으로 구조 활동을 벌였다는 설명이다 그 뒤 선내에 진입해 선내 방송을 하려 했으나 경사가 심해 진입에 실패했다고 김 정장은 밝혔다 
