,x
35, 세월호 사고 희생자 정부 합동분향소에서 박근혜 대통령이 어깨를 감싸며 위로한 할머니는 희생자 가족이 아니라 분향소 인근 주민인 것으로 일 밝혀졌다 당사자인 오모여씨는 그러나 일각에서 제기된 청와대 연출 의혹에 대해 손자 같은 아이들이 너무 안타까워 조문을 갔다가 박 대통령을 만났을 뿐이라고 반박했고 오씨의 아들도 사실과 다른 의혹이 제기돼 어머니와 가족이 상처를 받았다고 말했다 앞서 박 대통령이 전날 오전 시 분쯤 안산시 단원구 초지동 화랑유원지에 마련된 정부 합동분향소를 찾아 조문하는 과정에서 유족으로 보이는 한 할머니를 위로하는 장면이 사진이 보도되자 유가족대책위원회에서 이 할머니가 유족이 아니라는 주장이 제기되면서 청와대가 연출한 것 아니냐는 논란이 제기됐다 단원고 피해학생의 유족이자 유가족대책위 공동대표인 유경근씨는 이날 오전 라디오방송에서 실제 유가족이라면 실례가 되겠지만 이 할머니가 어느 분인가 하고 수소문을 해 봤는데 희한하게도 아는 분이 없다고 말했다 경향신문에 따르면 이 할머니는 분향소 인근인 초지동에 사는 오씨로 조문을 갔다가 박 대통령을 만났다 오씨는 이날 경향신문 인터뷰에서 어제 분향소에서 박 대통령을 만났다 유가족은 아니다라며 평소에도 화랑유원지에 운동하러 자주 다녔는데 분향소를 만드는 것을 보고 완성이 되면 반드시 가봐야겠다고 생각해 찾아간 것이라고 밝혔다 지인과 함께 오전 시 분향소 앞에서 만나기로 했지만 분 가량 먼저 도착했던 오씨는 오전 시부터 일반인 조문을 받는 줄은 몰랐다며 처음에 출구를 잘못 찾았다가 다른 출구 쪽으로 사람이 들어가길래 들어가도 되는 줄 알고 따라 들어갔다가 박 대통령을 만났다고 했다 박 대통령이 유가족이세요라고 물으며 손을 내밀어 오씨는 아니다라고 대답했으며 이후 다른 대화는 없었다고 오씨는 전했다 오씨는 나중에 뉴스에도 나왔다는 사실은 손자를 통해 들었다라며 내 손자 같은 애들이 그렇게 되서 너무 안타깝다 밥도 못 먹고 아이들이 무사히 돌아오기를 간절히 기도했는데라고 울먹였다고 경향신문은 전했다 권혁문 안전행정부 의정담당관은 일반적으로 대통령이 오면 경호를 엄격하게 하지만 이날은 유족의 마음이 상하지 않게 배려하는 차원에서 통제를 하지 않았다고 말했다 오씨의 아들인 김모씨는 일요신문 인터뷰에서 어머니가 박 대통령의 촬영을 위해 대동한 사람이라는 일부의 억측은 사실과 전혀 다르다고 말했다 김씨는 어머니가 평소 세월호 사건에 대해 너무 마음 아파하던 중 집 근처에 분향소가 생겨서 안 된 마음에 또 한 번 조문을 간 것 뿐이라며 어머니가 입장할 때 아무도 제지하는 사람이 없었고 바로 분향해도 되는 줄 알았다고 했다고 말했다 김씨는 어머니는 앞에서 분향하고 있는 사람이 대통령인 줄은 몰랐다고 한다며 어머니 말씀으로는 박 대통령이 분향하기 전에 왜 뒤를 돌아봤는지는 모르겠고 악수를 청해 악수를 하고는 서로 조문객인 입장에서 애틋한 마음이 들어서 살짝 포옹을 했다고 한다고 주장했다 그는 어머니는 세월호 사건 유족과 아무런 관계가 없다며 사실과 다른 의혹들이 제기되는 바람에 어머니와 우리 가족은 이번 일로 큰 상처를 받았다고 말했다 앞서 민경욱 청와대 대변인은 이날 오후 조문 당시 할머니 한 분을 위로하는 사진에 대해서 연출 의혹이 제기됐는데 사실이 아니다라며 분향소에는 조문객 유가족 일반인이 다 섞여있어 누가 누구인지 알 수 없는 상황이었고 그 가운데 한 분이 대통령께 다가와 인사한 것이라고 말했다 그는 또 연출해서 득이 될 게 아무것도 없다 연출은 절대 아니다고 강조했다 민 대변인은 진도를 방문했을 당시 울고 있는 아이를 대통령이 위로했을 때도 병원에 있는 아픈 아이를 데려다 연출했다는 보도가 나와 그 가족이 부인하고 항의한 적이 있다며 이번에도 사실이 아닌 내용을 퍼뜨리고 확산하는 것은 우리 사회에 전혀 도움이 되지 않는다고 말했다 민 대변인은 이날 밤 서면브리핑에서도 대통령이 합동분향소에 조문을 갔다가 우연히 만난 할머니와 인사한 것을 두고 쇼를 하기 위해 연출했다는 말이 안 되는 보도가 나왔다면서 조문하러 왔다가 졸지에 동원된 배우가 된 할머니 가족의 마음에 상처를 주는 일이라고 밝혔다 그는 인터넷이 발달한 지금 시대에는 이런 잘못된 보도가 국민들 사이에 급속히 불신을 야기시키고 국민과 정부 사이를 갈라놓을 수 있다며 부디 슬픔에 잠긴 국민이 안정을 되찾고 합심해서 이 충격에서 벗어날 수 있도록 언론에서 사실에 입각한 올바른 보도를 해 주길 부탁드린다고 덧붙였다 청와대는 또 당시 할머니를 부축한 사람은 대통령 경호원이 아닌 안산시와 계약한 상조업체 소속 장례지도사라고 전했다 
36, 박근혜 대통령은 일 세월호 참사 이후 첫 국무회의에서 겹겹이 쌓여온 잘못된 적폐積弊를 집권 초에 바로잡지 못하고 이런 일이 일어난 것이 너무도 한스럽다면서 국가 개조를 하는 수준의 고강도 수습책을 주문했다 그는 사고 대응 과정에 대한 내각의 반성을 언급하는 등 향후 적잖은 폭의 개각改閣도 예고했다 ◇모든 민관民官 유착 근절 박 대통령은 이날 원전문화재해운업계 등 사건사고로 비리 사슬 구조가 드러난 분야들을 언급하면서 비단 그 분야에 국한된 게 아니다라고 했다 그는 문제는 이런 비리 사슬이 철도에너지금융교육 등 국민 생활과 밀접한 곳곳에 산재해 있다면서 국민은 물론 언론 시민단체도 쉽게 파악통제가 어려워 이 시점에서 쇄신하지 않으면 점점 더 고착화되고 비정상을 증폭시킬 것이라고 했다 그 대책의 일환으로 박 대통령은 앞으로 유관 기관에 퇴직 공무원들이 가지 못하도록 하는 등 관련 제도를 근본적으로 쇄신해야 할 것이라고 말했다 그동안 고위 공무원들이 유관 기관에 자리를 잡고 업계의 이익을 대변 정부의 감시가 제대로 이뤄지지 않다는 얘기였다 거의 모든 부서가 이런 공생 관계에서 자유로울 수 없기 때문에 이 방안이 현실화될 경우 공직사회에는 상당한 후폭풍이 불 전망이다 청와대 관계자는 현재 장관들 중에서도 공직에서 물러난 후 자신의 업무와 관련이 있는 기관에 자리를 잡았던 사람이 있다고 했다 ◇관료 시스템 개혁 박 대통령은 관피아관료와 마피아의 합성어나 공직 철밥통이라는 부끄러운 용어를 우리 사회에서 완전히 추방해야 한다고 했다 이어 박 대통령은 관행적으로 내려온 소수 인맥의 독과점과 유착은 모든 부처의 문제라면서 폐쇄적 채용 구조 속에서 그들만의 리그를 형성하고 부처 칸막이 속에서 부처 이기주의가 만연하고 있다는 지적은 어제오늘의 문제가 아니다라고 했다 이와 관련해 박 대통령은 이 자리에 있는 모든 고위 공직자가 소속 기관의 이런 병폐를 낱낱이 찾아 고쳐 나가야 할 것이라면서 공무원의 임용 방식 보직 관리 평가 보상 등 인사 시스템 전반에 대해 개혁 방안을 마련하라고 지시했다 청와대 관계자는 핵심 국정과제였던 규제혁파와 공공부문 개혁은 물론 이번 세월호 사고에서 또다시 관료들의 보신주의와 무사안일함이 드러났다면서 대통령이 그동안 관료들을 중용해왔지만 이제부터는 국민들의 분노를 동력으로 공무원 사회의 구조를 개혁해 나갈 것으로 보인다고 했다 아울러 박 대통령은 안전 시스템 전체를 완전히 새로 만든다는 각오를 가져야 한다면서 가칭 국가안전처 신설 방침을 밝혔다 총리실이 관장하게 될 국가안전처는 사회재난과 자연재해 관리를 모두 맡게 된다 박 대통령은 특공대처럼 대응팀을 만들어 평소 훈련하고 사고가 나면 전문팀을 파견해서 현장에서 사고에 대응토록 해야 할 것이라고 했다 ◇사고 수습 후 개각 시사 박 대통령은 장관들을 향해 지금은 실종자 찾는 노력이 더 중요하다면서도 각자의 자리에서 국민과 국가를 위한 충정으로 최선을 다한 후에 그 직에서 물러날 경우에도 후회 없는 국무위원들이 되길 바란다고 당부했다 박 대통령은 여기 계신 국무위원들은 가족을 지킨다는 마음으로 끝까지 헌신과 노력으로 소명을 다해 달라며 그 이후의 판단은 국민들께서 해주실 것이라고 생각한다고도 했다 그는 또 사고 대응 과정을 보면 부처 입장에 서 있는 공직자들이 많았는데 각 부처 장관들은 철저히 반성하고 협업의 틀을 짜라고 했다 사고 수습 후 큰 폭의 개각이 있을 것이란 예고로 받아들여졌다 
37, 씨스타 보라가 흠잡을 데 없는 무결점 각선미를 뽐냈다 월일 서울 양천구 목동 홀에서 열린 닥터 이방인 제작발표회에 참석한 보라는 블랙 크롭톱과 라인 핫팬츠를 매치한 스타일링으로 세련된 여성미를 자아내 눈길을 모았다 더불어 화이트 펌프스를 코디해 다리라인을 더욱 강조하는 센스를 과시하기도 또한 그는 크롭톱의 디테일을 고려해 액세서리의 활용을 최소화하고 왼쪽 가슴에 노란 리본을 달아 세월호 참사에 대한 애도의 뜻을 드러냈다 한편 천재 탈북 의사가 한국 최고의 병원에서 근무하면서 의사 집단에 끼지 못하고 이방인으로 살아가는 이야기를 그린 드라마 닥터 이방인은 월일 에서 첫 방송된다 패션 조선 에디터 전수정 사진 이현무 기자 
38, 배우 진세연이 단아한 원피스 자태를 뽐냈다 월일 서울 양천구 목동 홀에서 열린 닥터 이방인 제작발표회에 참석한 진세연은 펀칭 디테일이 멋스러운 원피스를 입고 물오른 여성미를 자아내 눈길을 모았다 더불어 베이지 샌들을 코디해 전체적인 룩에 안정감을 주고 다리가 길어 보이는 착시효과를 연출하기도 특히 전체적으로 차분한 옷차림과 헤어 메이크업을 보여준 그는 노란리본 달기 캠페인에 동참하며 세월호 참사에 대한 애도의 뜻을 드러냈다 한편 천재 탈북 의사가 한국 최고의 병원에서 근무하면서 의사 집단에 끼지 못하고 이방인으로 살아가는 이야기를 그린 드라마 닥터 이방인은 월일 에서 첫 방송된다 패션 조선 에디터 전수정 사진 이현무 기자 
39, 배우 박해진이 우월한 비주얼로 여심을 사로잡았다 월일 서울 양천구 목동 홀에서 열린 닥터 이방인 제작발표회에 참석한 박해진은 밑단 디테일이 돋보이는 셔츠에 깔끔한 점퍼와 슬랙스를 매치하고 워커로 스타일링을 마무리 기존의 단정하고 클래식한 이미지를 벗고 색다른 변신에 나서 큰 호응을 얻었다 특히 그는 모든 아이템을 블랙 컬러로 선택하고 액세서리의 활용을 최소화한 것은 물론 노란 리본을 달며 세월호 참사에 대한 애도의 뜻을 전해 눈길을 모았다 한편 천재 탈북 의사가 한국 최고의 병원에서 근무하면서 의사 집단에 끼지 못하고 이방인으로 살아가는 이야기를 그린 드라마 닥터 이방인은 월일 에서 첫 방송된다 패션 조선 에디터 전수정 사진 이현무 기자 
40, 배우 이종석이 깔끔한 블랙 수트룩을 선보였다 월일 서울 양천구 목동 홀에서 열린 닥터 이방인 제작발표회에 참석한 이종석은 블랙 수트를 입고 물오른 남성미를 드러내 눈길을 모았다 자칫 단조로울 수 있는 룩이지만 큰 키와 탄탄한 몸매로 이를 완벽하게 소화해내며 모델 출신의 위엄을 입증하기도 이처럼 스타일링을 블랙 아이템만으로 깔끔하게 마친 그는 재킷 왼쪽 라펠 부분에 노란 리본을 달아 세월호 참사에 대한 애도의 뜻을 전했다 한편 천재 탈북 의사가 한국 최고의 병원에서 근무하면서 의사 집단에 끼지 못하고 이방인으로 살아가는 이야기를 그린 드라마 닥터 이방인은 월일 에서 첫 방송된다 패션 조선 에디터 전수정 사진 이현무 기자 
41, 배우 강소라가 우아한 시스루룩을 선보였다 월일 서울 양천구 목동 홀에서 열린 닥터 이방인 제작발표회에 참석한 강소라는 고급스러운 블랙 시스루 드레스를 입고 세련된 여성미를 뽐내 눈길을 모았다 더불어 킬힐을 코디해 전체적인 룩에 통일감을 주고 가녀린 각선미를 더욱 강조하는 센스를 과시한 그는 심플한 손목시계로 코디를 마무리 기품 넘치는 시스루룩을 완성했다 또한 강소라는 노란리본 달기 캠페인에 동참하며 세월호 참사에 대한 애도를 표현했다 한편 천재 탈북 의사가 한국 최고의 병원에서 근무하면서 의사 집단에 끼지 못하고 이방인으로 살아가는 이야기를 그린 드라마 닥터 이방인은 월일 에서 첫 방송된다 패션 조선 에디터 전수정 사진 이현무 기자 
42, 미국 救難구난 시스템은 통했다사고여객기 엔진 스톱 초 만에 개 기관 현장 출동일자 면 미국이 잘나서 이렇게 일사불란하게 움직이는 게 아니다 오히려 다민족 국가라 법제 시스템을 엄히 따르고 대충 넘어가지 않으며 책임을 확실히 짚고 넘어가는 의식이 어릴 때부터 배어 있어서다 년째 살고 있는 미국에도 다른 문제가 많지만 한국처럼 부정하지 못하면 손해다 다 남 잘못이다같은 것은 없다 이주형 일사일언 그립네요 탁명환씨일자 면 세월호 참사를 보면 공권력이 뭘 해야 하는지 뭐가 부족해 국민이 권력이나 국가를 믿지 못하는지 새삼 느껴진다 세모가 자라도록 키워온 정치권력이 더없이 한스럽다 국가와 정치권 담당 관리 부서는 도대체 하는 일이 뭘까 김익수 
43, 유병언 전 세모그룹 회장 일가의 비리를 수사 중인 인천지검 특별수사팀은 일 유씨의 측근 인방 중 한 명인 김한식 청해진해운 대표를 피의자 신분으로 소환 조사했다 청해진해운은 세월호 선사船社이다 검찰은 김 대표가 유씨의 사진들을 고가高價에 매입하고 자문료 명목으로 유씨 측에 회사 돈 억원 이상을 보낸 혐의배임를 찾아냈다 검찰은 이 과정에서 유씨 일가의 페이퍼컴퍼니 붉은머리오목눈이 등이 이용된 사실을 포착했다 검찰은 김 대표가 청해진해운에서 아무런 직책도 없는 유씨에게 매달 만원가량을 월급 명목으로 건넨 사실도 밝혀냈다 검찰은 이런 사실이 유씨가 청해진해운 경영과 전혀 무관하다고 주장해 온 부분과 정면으로 배치되는 것으로 판단하고 있다 검찰은 배임횡령 혐의로 금명간 김씨에 대해 구속영장을 청구할 방침이다 검찰은 이날 유씨 일가가 운영하는 계열사 문진미디어의 전직 임원 자택과 회계 법인 사무실 등 곳을 압수 수색했다 출판업체인 문진미디어는 유씨의 차남 혁기씨가 대표를 맡고 있다 
44, 일 서울 등 수도권은 종일 흐리겠고 그 밖의 전국 곳곳에 비가 오는 지역이 많을 전망이다 기상청은 강원 영동과 경북 지역은 일까지 비가 계속 이어지다가 이날 늦은 오후에 그치고 충청남북도와 전북경남 지역도 낮부터 늦은 오후 사이에 비가 조금 올 것이라고 예보했다 일 자정까지 예상 강수량은 강원 영동 ㎜ 경북 동해안 ㎜ 경남과 경북 내륙 ㎜ 충청남북도와 전북에서 ㎜ 내외 정도다 기상청에 따르면 서울은 일 비는 오지 않고 종일 흐린 가운데 낮 최고기온이 전날도보다 도 정도 오른 도를 기록할 전망이다 전국적으로도 낮 기온은 도 안팎으로 평년과 비슷한 수준을 유지할 것으로 기상청은 내다봤다 허진호 기상청 통보관은 특히 강원도 동해안 일대는 일 새벽까지 비가 강하게 내릴 수 있으니 비 피해가 없도록 주의해 달라고 말했다 한편 여객선 세월호 침몰 사고가 난 전남 진도 앞바다는 일 구름이 많이 끼는 가운데 풍속은 초속  파고는  정도로 일 것으로 기상청은 예상했다 
45, 현대중공업 하도급 업체 근로자가 지난 일 저녁 작업을 하다 바다에 빠져 숨졌다 이 근로자는 의 선박 블록을 운송하는 차량 신호수 역할을 하며 뒷걸음하다 발을 헛디딘 것으로 추정된다 이번 사고 외에도 현대중공업과 계열사인 현대삼호중공업현대미포조선 등 개사에서 지난 두 달 새 하도급 업체 직원이 명이나 숨졌다 그중 한 명은 사고사인지 자살인지가 분명치 않지만 다른 명은 모두 작업 도중 사고를 당했다 지난 월엔 현대중공업 임직원 여명이 협력업체들로부터 납품 청탁 대가로 모두 억원을 받은 혐의로 구속 기소됐다 어느 간부는 협력업체로부터 억만원을 받은 뒤 나중에 받을 대가를 미리 계산해 억원의 공정 증서를 작성하게 하고 퇴사 후 돈을 달라고 요구하기도 했다 세계 위 조선 회사가 하도급 근로자의 죽음을 나 몰라라 하고 협력업체에 뇌물 상납을 강요하는 데서도 세계 최고의 수완을 과시하고 싶은 모양이다 다른 대기업에서도 협력업체 직원들의 산재産災 피해가 잇따르고 있다 현대제철 당진제철소에서 년 월부터 지난 월까지 안전사고 건으로 모두 명이 목숨을 잃었다 삼성전자에서도 지난 월 협력업체 직원이 소화용消火用 이산화탄소 가스에 질식돼 숨졌다 대기업들은 원가原價 절감을 위해 사고 위험성이 높은 작업장에 주로 하도급 업체 직원을 배치하면서 이들의 안전에는 신경을 쓰지 않는다 협력업체들이 일감을 따내려고 덤핑 수주受注를 하다 보니 근로자들은 안전 장비를 제대로 갖추지 않은 채 위험에 노출되고 있다 하도급 근로자들의 희생을 줄이려면 원청 업체에 대해서도 책임을 묻는 방안을 적극 검토할 필요가 있다 사설 대통령 사과와 국가안전처를 보는 국민의 시선 사설 세월호 안으로 뛰어들지 않고 배 밖에서만 구조한 海警 
46, 지난 일 세월호가 침몰한 직후 현장인 진도로 내려가다 쇼크로 쓰러져 병원에 입원했던 김한식 청해진해운 대표가 검찰 소환을 앞두고 별 문제없는 위를 억지로 잘라내는 위절제 수술을 받았다는 의혹을 받고 있다고 조선이 일 보도했다 김 대표는 분당의 한 대형병원에서 복통을 호소했다가 이 병원이 수술을 거부하자 다른 병원에서 위절제 수술을 받은 것으로 전해졌다 청해진 해운의 실소유주인 유병언 전 세모그룹 회장의 측근 인방 중 한 명인 김 대표는 일 검찰에 피의자 신분으로 소환돼 조사를 받았다 검찰은 김 대표가 유 전 회장의 사진들을 고가高價에 매입하고 자문료 명목으로 유씨 측에 회사 돈 억원 이상을 보낸 혐의배임를 찾아낸 것으로 전해졌다 다음은 조선 보도 원문 ☞ 해당 뉴스 조선 영상 보러가기 앵커 어제 검찰 조사를 받은 김한식 청해진 해운 대표가 침몰 사고 이후 위절제 수술을 받았다고 합니다 별 문제가 없는데도 억지로 위를 잘라냈다는 말도 나옵니다 왜 그랬는지는 저나 시청자 여러분이나 생각이 같을 겁니다 이채림 기자입니다 리포트 김한식 청해진해운 대표가 부축을 받으며 한발한발 내딛습니다 혼자 걷기도 힘든 것처럼 보입니다 김 대표는 지난 일 사고 현장인 진도로 내려가다 쓰러져 병원에 입원했던 것으로 알려져 있습니다 그런데 김 대표가 검찰 소환을 앞두고 일부러 위절제 수술을 받았다는 의혹이 제기됐습니다 분당의 대형병원의 한 관계자는 김대표가 복통을 호소하며 수술을 검토해달라고 요구했다고 전했습니다 하지만 검사에서 아무런 이상이 발견되지 않아 병원측이 수술을 거부했다고 밝혔습니다 결국 김 대표는 다른 병원에 가서 위절제 수술을 받은 것으로 전해졌습니다 김 대표는 또 병실 기자회견을 고집해 병원과 마찰을 빚기도 한 것으로 알려졌습니다 녹취 모병원 관계자 다른 환자가 피해가 있을 거 같으니까 못하게 했어요 자기네들이 그냥 마음대로 아마 그 회사 사람들이 임의로 얘기했던 거 같아요 실제로 김 대표는 지난 일 저녁 이 병원에서 대국민사과를 하기로 했다가 갑작스럽게 인천의 회사로 기자회견 장소를 바꾸기도 했습니다 이런 정황으로 볼때 김 대표가 환자복을 무기로 검찰조사를 피하거나 동정을 얻으려고 한 것 아니냐는 분석이 나오고 있습니다 조선 이채림입니다 
47, 박근혜 대통령은 일 오전 경기도 안산시 단원구 화랑유원지에 마련된 세월호 희생자의 정부 합동분향소를 찾아 분간 조문했다 당초 박 대통령은 분간 조문할 예정이었지만 유족들의 얘기를 들으면서 여분을 더 머물렀다 오전 시 분쯤 검은색 차이나칼라 재킷 아래 검은색 긴 치마를 입고 분향소를 찾은 박 대통령은 근조 리본에 흰 장갑을 끼고 분향소에 들어섰다 박 대통령은 국화꽃 한 송이를 들고 학생들의 영정 사진을 보며 왼쪽 끝에서 오른쪽 끝까지 천천히 걸어갔다 유족으로 보이는 한 노인 여성이 울면서 말을 건네자 박 대통령은 어깨를 감싸 안으며 위로했다 박 대통령은 헌화분향하고 묵념한 뒤 조의록에 갑작스러운 사고로 유명을 달리하신 분들의 넋을 기리며 삼가 고개 숙여 명복을 빕니다라고 적었다 남성 유족 한 명이 대통령이 왔으면 가족들을 만나야 할 것 아니냐고 흥분한 목소리로 외쳤고 다른 여성은 대통령님 내 자식이기도 하지만 대통령의 자식이에요라며 울부짖었다 박 대통령은 유족들에게 다가가 그들의 울분과 하소연을 들었다 한 남성 유족이 할 말이 있다며 무릎을 꿇자 박 대통령은 위로하며 어깨에 손을 얹었다 이 남성은 자기 목숨 부지하기 위해 전전긍긍하는 해경 관계자들을 엄중 문책해 달라 다시는 이런 일 없게 해달라고 했다 박 대통령은 반드시 그렇게 하겠다고 답했다 한 여성 유족은 대통령이 끝까지 현장에 있으셨어야지 지금 바다에 있는 아이들도 대통령님이 내려가서 직접 지휘하시라고 했다 일부 유족들은 분향소 개소에 관한 공지가 제대로 이뤄지지 않았다며 분통을 터트렸다 정부가 이날 오전 시 공식 분향소를 개소하면서 정작 단원고 학부모 등 유족에게는 화장한 유골이나 위패를 어디에 안치해야 하는지도 제대로 알려주지 않았다는 것이다 한 유족 남성은 임시 분향소가 있던 안산 올림픽기념관에 유가족이 있는데 분향소 이전 공고를 오늘 했다는데 아무것도 모른다며 학교에서 공지 문자를 주는 것은 죽은 학생 전화번호라고 했다 이 남성은 화랑 유원지로 왔는데 연락을 못 받았다 너무 지치게 만든다며 울먹였다 박 대통령은 이 말을 들으며 한숨을 쉬었다 결국 박 대통령은 박준우 정무수석을 가족 앞으로 데리고 나와 가족분들의 요구가 어떻게 해서 중간에 이렇게 됐는지 제가 알아보고 거기에 대해서도 책임을 묻겠다며 정무수석이 여기 남으셔서 이런 분들의 어려움 얘기한 대로 안 되는 어려움을 전부 자세하게 듣고 해결하시기를 바란다고 했다 
