,x
29,여객선 침몰과 같은 큰 사고를 겪은 뒤 정신적으로 해당 사건을 재경험하는 등 심한 스트레스로 잠을 제대로 이루지 못하거나 우울 증상이 지속되는 사람들이 있다 이번 세월호 침몰 사고에서 구조된 고등학생들을 진료한 의사들의 말을 종합하면 전체의 약  가 제대로 잠을 자지 못하고 있다고 한다 이런 증상이 사고를 겪은 이들 모두한테 나타나는 건 아니고 일부가 일시적으로 겪기도 한다 하지만 한달 넘게 지속되면 외상 후 스트레스 장애라고 부른다 관련 학회나 전문의들은 사건을 겪은 이들의 용기를 북돋우고 정서적인 지지를 우선 제공해야 한다고 말했다 아울러 외상 후 스트레스 장애가 나타날 수 있음도 충분히 설명해야 한다고 강조했다 같은 사건이라도 나이 어리거나 노인층에서 더 심해 여객선 침몰은 물론 홍수나 태풍 등 자연재해나 교통사고 화재 전쟁 고문 등과 같은 사건을 겪으면 누구나 특징적인 불안 및 우울 증상에 시달리게 된다 외상과 관련된 이야기를 피하거나 비슷한 장소에 가는 것마저 피하게 된다 또 불안해하며 잠에 들지 못하거나 잠을 자다가도 가위에 눌리는 등 깊은 잠을 자지 못할 수도 있다 자주 깜짝깜짝 놀라거나 우울 증상이 나타나거나 집중력이 떨어져서 일상생활을 제대로 하지 못하는 이들도 있다 이런 증상은 같은 사건을 겪은 사람 모두가 꼭 경험하는 것은 아니며 잘 나타나는 경향을 가진 사람들이 있다 일반적으로 중장년층보다 나이가 어리거나 노인들에게 더 심하게 나타날 수 있다 남성보다는 여성이 더 취약하다 또 가족 및 동료 등 주변 사람들의 정서적인 지지가 부족할 때나 아동기에 심리적인 외상이 있을 때 더 잘 나타난다는 보고도 있다 아울러 이번 사고처럼 사망한 학생의 상황과 자신의 상황을 같게 생각하거나 가까운 친구나 이성 친구가 숨진 학생이 더 취약하다 어린이나 노인 여성이 더 취약  명 가운데  명은 악화되기도 장애 증상 나타날 가능성 알리고 슬픈 감정 얘기하도록 도와줘야 증상은 짧게는 일주일 뒤 길게는  년 뒤에 나타나기도 외상 후 스트레스 장애 증상은 시간에 따라 양상이 변하고 스트레스 강도가 클 때 강하게 나타난다는 특징이 있다 보통 짧게는 사건을 겪은 뒤 일주일 만에 나타나지만 길게는  년 뒤에 이 증상을 겪는다는 보고도 있다 대체로 치료를 하지 않아도 시간이 흐르며 나아지는 경우도 꽤 있는데  명 가운데  명 정도가 이에 해당된다 하지만  명 가운데  명은 증상이 가볍거나 중하게 나타날 수 있지만 해당 증상을 지속적으로 겪을 수 있고  명 정도는 증상이 좋아지지 않고 악화되는 것으로 알려져 있다 외상 후 스트레스 장애 나타날 수 있음을 충분히 알려야 정서적으로 예민한 고등학생들은 이번 사건에 더 충격을 받을 수 있으므로 부모를 비롯해 주변에서 주의할 점이 많다 우선 사망자 애도는 정상적인 반응이므로 애도 반응을 숨기거나 억제시킬 필요가 없다 대신 슬픈 감정을 얘기하도록 돕는 것이 좋다 아울러 외상 후 스트레스 장애 증상이 나타날 수 있음을 미리 설명해 증상에 따른 불안을 겪지 않도록 할 필요가 있다 절대적으로 하지 말아야 할 것은 사고 소식을 반복적으로 듣게 방치하는 것이다 병원에 입원한 경우라도 확인되지 않은 소문 등에 시달리지 않도록 하고 방송 인터뷰 등으로 언론에 노출되는 일을 삼가야 한다 이런 정서적 지지와 함께 강한 스트레스를 줄여주는 이완 요법 예를 들면 숨을 크게 쉬는 등과 같은 요령도 가르치는 것이 좋다 이런 방법과 함께 약물치료도 고려할 수 있는데 주로 우울증을 치료하는 약을 쓴다 자해하거나 다른 사람을 해칠 우려가 있을 정도로 증상이 심하면 입원 치료가 필요할 수 있다 한편 이런 사건을 직접 겪지 않고도 해당 소식을 전해 들으며 외상 후 스트레스 장애 증상이나 우울 증상을 호소하는 경우도 있다 이들한테는 우선 해당 소식을 반복적으로 듣지 않도록 권고해야 하며 증상이 심하면 약물치료가 필요할 수 있다 김양중 의료전문기자  도움말 대한소아청소년정신의학회 대한신경정신의학회 최수희 서울대병원 정신건강의학과 교수 관련영상 한겨레 포커스촛불 시민 아직 끝난 게 아니다 한 아이라도 돌아오길 
30,도심 속 천년 한옥 짓는 석공과 목수극한 직업교육방송 밤  시 분 성냥갑 모양의 아파트에 싫증을 느낀 이들이 한옥을 찾고 있다 서울 도심의 한복판에서 한옥을 짓는 장인들을 만난다 한옥은 한 번 지으면 천년은 간다고 한다 그만큼 수많은 장인이 힘을 합친다 여러 사람이 모여  ㎏이 넘는 거친 돌을 깎고 다듬어 초석을 놓는다 망치와 정만 갖고   수작업으로 단단한 돌을 깎아내는 솜씨가 놀랍다 어디로 튈지 모르는 돌조각 때문에 석공들은 늘 긴장 속에서 작업한다 같은 시각 강릉의 제재소도 작업이 한창이다 목수들은 수만번 대패질 해 마른 나무에 숨결을 불어넣는다 톱밥 먼지가 입과 코로 들어가는 건 이제 일상이다 한옥을 짓기에 적절한 목재들을 정교한 기술로 다듬고 깎아야 한다 휜 나무부터 곧게 자란 나무까지 나무를 찾는 일도 목수들의 몫이다 우두머리 목수인 도편수 정태도씨는 처마의 곡선을 결정짓는 추녀도 만든다 추녀의 끝에는 집마다 다른 무늬가 들어간다 고도의 기술이 필요하다 섬세한 손놀림으로 곡선을 살려 목재를 깎아내는 과정이 흥미롭다 장인들은 한옥은 기술이 아니라 마음으로 빚는 집이라고 말한다 그들이 생각하는 한옥의 장점 등도 듣는다세계 최대 화물기의 제작 비밀크게 더 크게 슈퍼 수송기 안토노프내셔널지오그래픽 밤  시 세계 최대의 화물 수송기 안토노프  의 제작 과정을 알아본다 안토노프  는 길이가  층 건물 높이다 날개 길이만  층 버스  대를 주차한 것과 비슷하다고 한다 동굴 같은 화물실에는 가족용 차량  대를 실을 수 있다 전투용 탱크와 비행기 등 모든 화물을 전세계 곳곳에 수송하는데 다큐에서는 큰 기차를 독일에서 인도로 수송하는 과정을 따라간다 안토노프  를 제작하면서 엔지니어들은  가지 엔진공학기술의 장벽에 부딪혔다고 한다 어떻게 해결했을까 비밀도 듣는다꼭 돌아와 무사생환 염원 현장코리아 투데이아리랑티브이 오전  시 세월호 희생자들과 유족 등을 애도하는 현장을 담는다  일 시민단체와 단원고 재학생 학부모 등은 안산 화랑유원지에서 실종자들의 무사귀환을 염원하는 촛불 기도회를 진행했다 시민  여명이 참석했다 학생들은 침묵으로 기도했고 교가를 틀어놓고 각자의 바람을 담아 촛불을 켰다 서울 조계사에서는 석가탄신일을 전후한 불교계 최대 축제인 연등회 행사를 추모제 형태로 진행했다 신도들은 촛불을 켜놓고  배 철야 정진을 열었다 실종자들의 생환을 바라는 마음이 하늘에 닿길 기원하며 연등을 달았다 
31,영국에서 슬픈 소식세월호 침몰을 접했을 때 저도 가족들도 눈물을 흘렸어요 제가 무슨 일을 할 수 있을까 고민했죠 무슨 일을 하더라도 슬픈 소식을 어떻게 할 수는 없다는 생각도 했지만 조금이라도 힘을 보태자는 생각에 수익금을 기부하기로 했어요 오는  일 경기도 오산과  일 서울에서  년 만에 내한 공연을 하는 영국 가수 코니 탤벗 사진은  일 오후 서울 광화문의 카페에서 열린 간담회에서 세월호 침몰 피해자를 위해 기부하기로 한 뜻을 설명했다 한국 분들에게 슬픈 시기인 것 같지만 제 공연으로 조금이라도 행복감을 느꼈으면 좋겠어요 이날 자리에 함께한 어머니 샤론 탤벗 은 한국은 저희를 환영해주는 특별한 곳이라며 세월호 이야기를 듣고 이런 때 공연을 하는 건 옳지 않다고 생각했어요 그런데 트위터를 보니 공연으로 용기를 북돋아줄 수도 있다는 의견이 있더라고요 그래서 수익금을 기부해야겠다고 생각했고 한국행을 결정했다고 말했다  년에 이어 한국을 찾은 탤벗은 입국하기 전인 지난  일 자신의 에스엔에스에 슬픈 시기를 보내는 한국으로 내일 떠난다 콘서트 수익금을 여객선 사고 피해자들에게 기부할 것이라고 적었다 그는 만 여섯살 나이로 오디션 프로그램 브리튼스 갓 탤런트에서 폴 포츠에 이어  위에 오르며 화제를 모았다 그 뒤 데뷔 앨범 가  만장 넘게 팔리며 최연소 가수로 기네스북에 등재됐다 한국에서도  만장 이상 팔린 덕에 그는  년 연말 크리스마스캐럴 앨범 발매에 맞춰 기타리스트 이병우와 크로스오버 테너 겸 뮤지컬 배우 임태경 등과 첫 내한 공연을 열었다 이날 간담회에서 그는  년 전이나 지금이나 많은 한국 사람들이 친절하게 대해줘서 감사하다고 인사를 했다 귀여운 꼬마에서 예쁜 숙녀로 변신한 그는 정작 키만 컸지 크게 변한 건 없는 것 같다고 부끄러워하기도 했다 하지만 지난해  월 자작곡이 포함된 정규  집 를 발표하며 성숙한 숙녀 아티스트로 변모해가는 모습을 증명한 그는 최근 유튜브를 통해 피아노와 기타를 연주하며 노래하는 모습을 선보였다 요즘은 팝을 좋아하고 있다는 그는 이번 내한 공연에서 디즈니 뮤지컬 애니메이션 의 주제곡 렛 잇 고를 비롯해 영국의 전설적인 록밴드 비틀스의 렛 잇 비 비틀스 출신 존 레넌의 이매진 등 다양한 곡을 들려줄 예정이다 초록우산 어린이재단이 주최하는 이번 공연은 빈곤 국가 어린이 식수 지원 캠페인 워터 차일드 후원도 겸한다 공연기획사 메이드림 쪽은 탤벗이 이번 공연 외에 또다른 방법으로 한국에 도움을 주는 방안을 찾고 있다고 전했다 뉴시스 관련영상 한겨레 포커스촛불 시민 아직 끝난 게 아니다 한 아이라도 돌아오길 
32,패션그룹 형지의 최병오사진 회장은  일 세월호 참사로 고통받는 유가족과 학생들을 위해  억원을 기부했다 최 회장은 이날 유니세프 한국위원회를 방문해 성금을 전달했다 유니세프는 신체적정신적 상처를 입은 유가족들과 안산 단원고 학생들을 위해 성금을 사용할 계획이다 
33,◇ 서울에이피클럽회장 조병량은  일 오후  시 분 서울프레스센터  층 프레스클럽에서 내수경제 활성화와 광고산업 특별세미나를 연다◇ 한국시멘트협회는  일 제 대 협회장에 이윤호 쌍용양회 대표이사를 선임했다◇ 여신금융협회는  일 이기연 전 금융감독원 부원장보를 부회장에 선임했다 ◇ 코오롱그룹 오운문화재단은  일 제 회 우정선행상 대상에 마산 봉사여왕 김숙자 씨를 선정했다 김씨는  년 새마을부녀회 지도자교육을 계기로 봉사활동을 해왔다 ◇ 대한불교진흥원 원효학술상운영위원회는 최근 올해 원효학술상 교수 부문 우수상에 박찬국 서울대 철학과 교수 비전임교수 부문에서 동국대 불교대학원 겸임교수인 서광 스님을 각각 선정했다◇ 사랑의열매 사회복지공동모금회회장 허동수는  일 세월호 침몰사고 피해지원 기부금으로 차승원배우씨로부터  억원 김태균야구선수씨로부터  천만원 대한치과의사협회협회장 김세영로부터  억원을 기탁받았다 ◇ 대한적십자사총재 유중근는  일 대한예수교 장로회 잠실교회담임목사 림형천로부터 세월호 침몰 사고 희생자들을 위해 써달라며 부활절 헌금 전액인  억 천만원을 기탁받았다◇ 금융그룹은  일 어린이재단에  희망 자전거  대를 기증했다 기증된 자전거는 베트남 빈곤층 아이들에게 전달된다 
34,미국 보스턴 마라톤 대회가  일현지시각  년 전 테러의 아픔을 딛고 다시 열렸다 지난해  월 일 열린 이 대회에서 체첸 출신의 타메를란 차르나예프 형제가 결승선 부근에서 사제 폭탄을 터뜨려 관람객  명이 숨지고  여명이 다치는 테러가 발생했다 삼엄한 경비 속에 치러진 이번 대회엔 작년보다  명 이상 늘어난  만 명이 참가했고 관중도 갑절 가까운  만명이 모였다 대회 중간에는 지난해 폭탄 테러의 부상자들이 나와 희생자들을 추모하고 결승선을 통과하는 행사도 열렸다 관중들은 보스턴은 강하다라는 문구가 적힌 셔츠를 입고 참가자들을 격려했다 한국인 참가자들은 세월호 희생자들을 기리는 묵념을 하기도 했다 우승은  시간 분 초를 기록한 메브라톰 케플레지기 미국가 차지했다 지난해 이 대회에 참가했다가 두 다리를 잃은 설레스트 코코런왼쪽 둘째이 함께 부상을 당했던 딸왼쪽 셋째을 비롯한 가족들과 함께 결승선을 통과하며 환호성을 지르고 있다 보스턴 뉴시스 
35,인명 구조에서 생사를 가르는 시간을 골든타임이라고 한다 재난 발생 시 골든타임 때의 조치를 보면 선진국과 후진국이 확연히 갈린다 이번 세월호 침몰은  년 전 대구지하철 화재 참사와 판박이다 당시 기관사는 위험하니 전동차 안에 있으라고 방송해놓고 통제 열쇠마저 뽑아들고 빠져나갔다 그 말만 믿은 승객들은 객차에 갇혀 참혹하게 죽어갔다 사망자만  명에 이르러 지하철 사고로는 세계 둘째 규모 대참사였다 작년 태안반도 사설 청소년캠프 사고 때도 교관 지시에 따른 고교생  명이 파도에 휩쓸려  명이 숨졌다 이번도 마찬가지다 선실에 가만히 있으라는 방송만 열 번 가까이 해놓은 채 선장과 항해사 조타수 등 항해승무원들만 모두 승객들 몰래 구명보트에 탔다 최우선이어야 할 승객들의 목숨은 고사하고 조리원 사무원 아르바이트생까지 한솥밥 먹던 동료들마저 버릴 정도로 현장 책임자들의 조처는 후진적이었다 대한민국에 대형 참사가 잦은 이유는 크게 세 가지로 볼 수 있다 먼저 정부와 정치권에 국민 안전에 대한 강력하고 일관된 정책 의지가 없다 사고가 나면 그때만 요란하지 얼마 지나지 않아 집단 망각에 빠진다 더 큰 문제는 재난 대비나 구조를 실행할 종합적 현장 시스템이 제대로 갖춰져 있지 않다는 데 있다 현 정부는 출범 초 정부조직 개편을 통해 행정안전부의 이름을 안전행정부로 바꿨다 안전을 더 중시하겠다는 취지는 국민들도 반길 일이지만 요란하게 간판만 바꾼 것 아닌가 하는 의구심이 든다 지난해  월 재난 및 안전관리 기본법을 전면 개정해 이번  월부터 시행할 때도 별로 달라진 건 없었다 개정법의 핵심은 안행부에 중앙재난안전대책본부중대본를 신설해 기존 소방방재청은 자연재해를 전담하고 인적사회적 재난 대응은 중대본이 지휘한다는 것이었다 그전까지 모든 유형의 재해를 도맡아야 했던 방재청의 부담을 덜고 중앙부처 차원으로 업무 중요도를 격상시킨다는 것이니 그럴듯해 보일 수 있지만 이번 참사에 대한 초기 대응을 짚어보면 되레 더 퇴보한 듯하다 그런 까닭에 일각에선 그동안 재난 대응을 전담해온 소방방재청 전문인력들을 중대본이 제대로 흡수하지 않고 행정관료들이 주가 된 것이 이번에 드러난 여러 문제들의 원인이라는 지적도 나온다 하지만 문제는 방재청 인력을 흡수하고 안 하고가 아니다 방재청은 행정안전부가 안전행정부로 이름이 바뀐 것과 무관하게 줄곧 안행부 산하에 있어왔기 때문이다 재난관리 책임이 건설부 소관에서 내무부 즉 지금의 안행부로 넘어온 것은  년이었다 안행부가 재난 대응의 컨트롤타워를 맡은 건 이번  월부터가 아니라  년 전부터라는 얘기다 하지만 우리나라의 재난 대응 컨트롤타워는 그동안 진화하지 못했다 대형 참사가 반복될 때마다 언젠가 본 듯한 데자뷔로 느껴지는 것도 이 때문이다 셋째 문제는 안전에 대한 우리 어른들의 심각한 불감증이다 이번 세월호 침몰 사고는 특히 더 그렇다 해운회사와 운항 관계자들은 과적 과속은 물론 기본적인 운항관리규정도 무시했다 아이들은 어른들에 비해 지휘자나 권위자의 지시를 더 잘 따른다 그래서 그 많은 아이들이 죽고 실종된 지금의 상황은 안전불감증이 만연하도록 둔 우리의 공동책임이다 대한민국은 지금 우울하다 하지만 이런 집단적 우울증이 제대로 치유되려면 지금 분위기가 빨리 바뀌거나 잊혀지면 안 된다 이미 드러난 맨얼굴을 서둘러 가리려 해선 안 된다 이번에야말로 정부와 정치권도 책임을 통감하고 말이 아닌 실천에 나서야 한다 대응 매뉴얼은 발생 가능한 최악의 재난 시나리오들을 가정해 현장에서 반드시 쓰일 수 있도록 실행 가능하고 구체적으로 보완해야 하고 비치용으로 전락하지 않도록 불시점검 등 모든 수단을 동원해 제대로 쓰이게 해야 한다 또한 어떠한 곳에서 재난이 발생하더라도 즉각적인 정부 개입과 전폭적 지원이 가능하도록 미국 연방재난관리청 같은 정부 단일접촉창구도 확립해야 한다 당신이 무언가를 간절히 원할 때 온 우주가 그 소망이 실현되도록 도와준다는 글귀를 되뇌며 생존자 구조 소식을 기다린다 곽승준 고려대 경제학과 교수 관련영상 한겨레 포커스촛불 시민 아직 끝난 게 아니다 한 아이라도 돌아오길 
36, 세월호대한민국 선장대통령 선원들고위 공직자들 승객국민들 선내방송언론매체들 최근 온라인에 올라온 글이다 최근 현실에 대한 절묘한 비유란 생각이 든다 세월호 사고 이후 박근혜 대통령은 강력히 책임을 묻겠다며 공무원들을 질타하고 있다 대통령은 근엄한 표정으로 네 탓이오 네 큰 탓이로소이다를 되뇐다 자기가 책임질 일을 남 이야기 하듯 하는 대한민국호 선장이 세월호 선장을 살인과도 같은 행태라고 준열히 질타했다 큰일이 터질 때마다 이런 대통령 모습을 보는 것은 괴로운 일이다 침몰하는 세월호에서 자신들만 아는 통로로 먼저 탈출한 선원들처럼 사망자 명단 앞에서 기념사진을 찍는 고위 공무원은 그들만의 특권 세계에 갇혀 지낸다  명이 넘는 승객들이 선내에서 기다려라는 안내방송을 믿었다 끝내 탈출을 못했다 세월호의 안내방송이 승객들을 죽음으로 내몬 흉기 구실을 했다 남 탓은 그만하고 내가 일하는 언론계 상황부터 돌아보자 대한민국호의 안내방송 격인 언론매체들은 제구실을 하고 있을까  일 경찰이 한 종합편성채널과의 인터뷰에서 해경이 민간 잠수사 구조를 막는다고 말한 홍아무개씨의 구속영장을 신청했다는 소식이 전해지자 홍씨 인터뷰를 내보낸 종편 책임자는 왜 처벌하지 않느냐는 누리꾼들의 반발이 일었다 일부 누리꾼들은 세월호 사고 언론 보도에 대해 기레기라고 비판하고 있다 기레기는 기자쓰레기를 합친 말이다 나는 세월호 사고와 관련해 쓰레기 같은 기사는 만들지 않았다고 스스로를 위로해 보지만 이게 최선입니까란 질문 앞에는 그렇다는 답을 쉽게 못 하겠다 정부 부처가 범한 초동대처 미숙 부서 간 혼선 같은 문제들이 취재 과정에서도 비슷하게 벌어졌기 때문이다  년 전 천안함 사고 당시 이명박 정부는 북한을 공공의 적으로 삼아 국민의 충격을 외부로 돌릴 수 있었다 그런데 세월호 사고 뒤 온 국민의 슬픔이 출구를 찾지 못한 채 우리 사회 안에서 부글부글 끓고 있다 최근 독일 일간지 은 칼럼에서 세월호 침몰이 박 대통령에게 치명상을 입힐 수 있다며 정부의 운명은 때로는 정치와 전혀 연관되지 않은 사건들에 의해 결정된다고 분석한 바 있다 심심치 않는 여론의 흐름을 의식한 박 대통령은 탑승객을 버리고 도망간 선장과 일부 승무원을 겨냥해 상식적으로 도저히 납득할 수 없고 용납할 수도 없는 살인과도 같은 형태라고 강하게 비판했다 이 말이 틀리진 않았지만 몇몇을 죽일 놈으로 만들어 풀릴 문제가 아니라고 생각한다 세월호 사고를 수습하려면 사람이 아니라 문제 분노가 아니라 대책에 집중해야 하기 때문이다 박 대통령은 세월호 관련 유언비어를 지목해 사회적 혼란을 야기하는 불순한 의도라며 거짓말과 유언비어의 진원지를 끝까지 추적하라고 지시했다 내가 볼 때 유언비어의 진원지는 정부 당국과 언론이다 구조자 탑승자 수를 여러 차례 바꿔 신뢰 잃은 정부와 속보 경쟁에 매몰돼 오보를 양산한 언론이 유언비어 양산의 온상이다 언론과 정부가 제구실을 못 하니까 온갖 유언비어가 창궐하고 있다 그런데도 대통령은 유언비어 엄단만 강조한다  명이 넘는 세월호 승객들이 안내방송을 믿고 구명조끼를 입고 기울어진 배 안에서 구조대를 기다리다 물속으로 가라앉았다 이 막막한 죽음 앞에서 대한민국호의 선장 선원들 선내 방송 담당자는 살아남은 자의 의무가 무엇인지 고민해야 한다 권혁철 사회 부 지역데스크 
37,인명이나 재산에 손상을 끼치는 대형 재난은 언제 어디서 터질지 모른다 모든 위험은 예고 없이 다가온다 위험은 국경이나 대상을 가리지도 않는다 그래서 독일 사회학자 울리히 벡은 위험은 민주적이다라고도 했다 그는  년  월 방한해 한국은 내가 지금까지 말해온 위험사회보다 더 심각한 특별한 위험에 노출되어 있는 것 같다고 경고한 바 있다 우리 사회가 울리히 벡에게 특별한 느낌을 준 까닭이 세월호 참사에서 잘 드러난다 세월호 참사와 관련해 박근혜 대통령이  일 청와대 수석비서관 회의에서 엄포성 메시지를 던졌다 두 가지이다 우선 지위 고하를 막론하고 책임을 엄중하게 묻겠다고 했다 또 하나는 강력한 재난위기 대응체계를 구축하라는 것이다 승객을 버리고 먼저 빠져나온 세월호의 선장과 승무원 등 직접적인 사고 원인 제공자에 대한 법적 처벌은 마땅하다 그러나 사고 발생 뒤 대응과 수습 과정에서 보여준 재난 대응체계의 총체적 부실에 대해선 어떻게 책임을 물어야 하나 국민의 생명과 재산 보호는 정부의 기본 임무이다 헌법  조는 국가는 재해를 예방하고 그 위험으로부터 국민을 보호하기 위해 노력하여야 한다고 규정하고 있다 박 대통령은 취임사에서도 국민의 생명과 안전을 지키는 것은 국민 행복의 필수적 요건이다 언제 어느 곳에서도 또는 그 누구라도 안심하고 살아갈 수 있도록 하는 데 정부의 역량을 집중하겠다고 약속했다 얼마 전까지 국무총리실 누리집에는 박근혜 정부의 국가재난관리 국정과제 세부내용이란 게 있었다 통합 재난대응 시스템 구축 예방 중심의 선제적 재난관리 및 재난 대응 컨트롤기능 강화 등 번지르르한 수사들로 가득 찼다 세월호 사태에서 확인된 국가의 배임은 온 국민을 더욱 좌절감에 빠뜨리고 있다 울리히 벡은 그의 저서 에서 위험 요소를 스스로 통제하지 못한다는 감정이 팽배한 경우를 특별한 위험이라고 했다 박순빈 논설위원  관련영상 한겨레 포커스촛불 시민 아직 끝난 게 아니다 한 아이라도 돌아오길 
