,x
22, 전남 진도에서 발생한 여객선 세월호 침몰 사고로 현재까지 단원고 학년 학생을 포함 명이 사망한 것으로 알려졌다 일 오전 시 분쯤 청해진해운 소속 여객선 세월호가 전남 진도군 관매도 인근 해상에서 침몰해 오후 시 분 현재 선사 여직원 박모씨와 단원고 학년 정모군이 사망한 것으로 전해졌다 현재까지 실종자는 명에 이른다 일 오후 인천항을 출발해 제주도로 향하던 세월호에는 수학여행에 나선 안산 단원고등학교 학년 학생 명과 교사 명 등 여 명이 탑승했던 것으로 알려졌다 실종자 현황이 속속 파악되면서 년 월 전북 부안군 위도면 위수도 인근 해상에서 침몰한 서해훼리호 사건이 재연되는게 아니냐는 우려가 나오고 있다 서해훼리호는 높은 파도로 인해 전복돼 침몰했고 당시 사고로 명이 사망했다 
23, 해군은 일 오전 전남 진도군 관매도 인근 해상에서 침몰 중인 여객선 세월호 구조를 위해 유도탄 고속함 척과 고속정 척 해상초계가 가능한 링스헬기 대를 투입했다고 밝혔다 군 관계자는 침몰 여객선 주변에 있던 해군 전 세력을 출동해 긴급 조치를 진행하고 있다고 밝혔다 앞서 이날 오전 시쯤 전남 진도군 관매도 인근 해상에서 여객선 세월호가 침몰하고 있다는 신고가 접수됐다 전날 오후 시 분쯤 인천항을 출발해 제주로 향하던 세월호에는 수학여행에 나선 안산 단원고 학생과 교사 여명 등 명이 탑승하고 있는 것으로 전해졌다 
24, 일 오전 발생한 전남 진도 여객선 세월호 침몰 사고와 관련 해경은 여객선 항해사와 기관장 등 승무원들의 신병을 확보해 본격적인 조사에 착수했다 서해지방해양경찰청은 이날 오후 박모 기관장과 항해사 조타수 등 승무원 명을 목포해경으로 소환해 사고원인 등에 대해 조사를 벌이고 있다 사고가 난 세월호에는 선장과 기관장 갑판장 항해사 등 여객선 관계자 명이 탑승하고 있었고 이 밖에도 외국인 가수 명과 아르바이트 명 불꽃놀이 담당자 명도 승선했던 것으로 전해졌다 해경은 당초 선장 이모씨도 함께 소환했으나 실종 승객 구조지원을 위해 다시 사고해역으로 되돌려 보냈다 해경은 해상교통관제센터 확인을 통해 세월호의 항로 궤적을 확인하고 있다 또 생존자들이 쾅하는 소리가 난 뒤 배가 기울어지기 시작했다고 진술함에 따라 선체에 구멍이 뚫린 이유가 암초와 부딪혀 발생한 것인지 내부 원인에 의한 것인지도 규명할 예정이다 해경은 이평연 총괄안전부장을 본부장으로 수사인력 명을 투입해 조사하고 있다 
25, 제주도로 수학여행을 떠난 안산 단원고등학교 학생 등 승객과 승무원 명이 탑승한 여객선 세월호가 일 오전 진도 해상서 좌초해 사실상 침몰했다 현재 최소 명이 숨지고 명의 생사가 확인되지 않은 상태다 현재까지 구조된 승객 및 승무원은 명으로 집계됐다 아래는 해당 사고 시간대별 상황 일 오전 시 분쯤 전남 진도군 조도면 병풍도 북쪽  해상에서 청해진해운 소속 급 여객선 세월호 침몰 중이라는 신고 접수 오전 시 분 해양경찰청 구조본부 가동 오전 시 분 정부 중앙재난안전대책본부이하 중대본본부장 안전행정부 장관 가동 오전 시 박근혜 대통령 인명 피해 단 한명도 없도록 구조 최선 다하라 지시 중대본 차 공식브리핑 해당 선박 명 승선안산 단원고 학생 명 시 분 여객선 침몰이 임박했으니 탑승객은 바다로 뛰어내리는 상황에 대비하라 선내 방송 오전 시 분 안산 단원고 학생과 교사 명 전원 구조됐다 해경 아직 파악 필요하다 오전 시 분 세월호 완전 침몰 오전 시분 중대본 차 공식 브리핑 공식 구조 인원 명 민간 선박 구조 동참해 실제 구조인원은 이보다 더 많을 것 낮 시분 중대본 차 공식 브리핑 공식 구조 인원 명 선사 직원 박지영씨 사망 낮 시 분 중대본 단원고 학년생 정차웅군 사망 오후 시분 중대본 구조 인원 명 사망 명 확인 오후 시 중대본 차 공식 브리핑 중상자 명 병원 이송 특수 구조 인원 명 현장 투입해당 선박 출항 늦어 입항시간 당기려고 항로 변경 가능성 있다 오후 시 해경 중대본에 구조자 수 집계 오류 가능성 통보 오후 시 분 중대본 정정 브리핑 구조자 수 집계 오류 있다 현재 확인 중 오후 시분 중대본 차 공식 브리핑 탑승자 명 구조 명 사망 명 실종 명명 중 단원고 학생 명 교사 명 일반인 명 선원 명 오후 시분 정부 브리핑 사망 한 명 늘어 명 학생 추정 남성구조자 중 신분 확인된 단원고 학생 명 오후 시 중대본 사망자 추가 발견 사망 명 실종 명 
26, 수학여행에 나선 학생들 여명이 타고 있는 여객선이 조난 신고를 보내 해경이 구조에 나섰다 목포해양경찰서는 일 오전 시쯤 전남 진도군 관매도 인근 해상에서 제주로 향하던 여객선 세월호가 조난신고를 보내 구조 작업을 진행 중이라고 밝혔다 인천에서 출발해 제주로 향하던 세월호에는 수학여행에 나선 학생 등 여명이 탑승하고 있다고 알려졌다 현재 선박 내부가 침수돼 선체가 좌현으로 도 가량 기울어 있는 상황이다 해경은 침몰 우려가 있어 경비정 등을 급파해 승객들을 구조하고 있다고 말했다 
27, 일 오전 시쯤 전남 진도 해상에서 여객선 세월호가 침몰한 가운데 탑승한 안산 단원고등학교 학부모들이 학교 측의 대응에 거세게 항의하고 있다 이날 안산 단원고 측은 오전 시분쯤 수학여행을 떠나 세월호에 타고 있던 학년 학부모들에게 학생 전원구조에 성공했다는 내용의 전체 문자메시지를 보냈다 하지만 중앙재해대책본부의 발표와 언론을 통해 학년 정차웅 학생이 숨졌다는 소식이 전해졌다 그제서야 학교 측에서는 오후 시분쯤 기자회견을 열어 생존 확인 인원이 명이라고 번복했다 안산교육지원청은 장학사 명을 급파했으며 구조 여부가 왜 학부모들에게 잘못 전달 됐는지 조사 중이다 
28, 수학여행에 나선 학생들 여명이 타고 있는 여객선이 조난 신고를 보내 해경이 구조에 나섰다 목포해양경찰서는 일 오전 시쯤 전남 진도군 관매도 남서쪽  해상에서 제주로 향하던 급 여객선 세월호가 조난신고를 보내 구조 작업을 진행 중이라고 밝혔다 인천에서 출발해 제주로 향하던 세월호에는 수학여행에 나선 경기 안산 단원고등학교 학생 등 여명이 탑승하고 있는 것으로 알려졌다 현재 선박 내부가 침수돼 선체가 좌현으로 도 가량 기울어 있는 상황이다 해경은 선체  정도가 기울었고 침몰 우려가 있어 경비정과 헬기 등을 급파해 승객들을 구조하고 있다고 말했다 
29, 일 오전 전남 진도군 조도면 병풍동 북방 마일 해상에서 승객 등 명이 탑승한 급 여객선 세월호가 침몰한 가운데 여성 승무원 명과 안산 단원고등학교 학생 명의 사망이 확인됐다 서해지방해양경찰청은 세월호에 탑승했던 여성 승무원 박지영여씨와 정차웅남군의 사망이 확인됐다고 밝혔다 정차웅군은 당초 신원미상의 대 남성 사망자로 알려졌었다 정차웅군은 목포 한국병원으로 이송돼 심폐소생술을 받았지만 끝내 숨졌다 구조된 탑승객 중 부상자는 진도와 목포 한국병원 해남종합병원에 이송됐다 대부분의 승객들은 진도 실내체육관에서 안정을 취하고 있다 
30, 일 오전 시 분쯤 전남 진도군 조도면 병풍도 북쪽  해상에서 승객 명이 탄 급 여객선 세월호가 침몰한 가운데 여성 승객 명이 사망한 것으로 확인됐다 서해지방해양경찰청은 이날 오전 시 분쯤 브리핑을 열고 해당 선박에서 사망자가 명 발생했다고 밝혔다 사망자는 선사 직원 박지영여씨로 확인됐다 박씨는 선상 안내 방송을 맡았던 것으로 알려졌다 추가적인 사망자가 있는지는 아직 확인되지 않고 있다 해경은 이날 정오 현재 명이 구조됐다고 밝혔다 해경에 따르면 구조된 탑승객 중 부상자는 진도와 목포 한국병원 해남종합병원에 나눠 이송됐으며 경상자는 진도 실내체육관에서 안정을 취하고 있다 해경은 세월호가 암초에 부딪혀 침몰한 것이 아닌가 보고 정확한 사고 원인을 조사중이다 
31, 수학여행에 나선 학생 등 여명이 타고 있는 여객선이 조난 신고를 보내 해경이 구조에 나섰다 목포해양경찰서는 일 오전 시쯤 전남 진도군 관매도 남서쪽  해상에서 제주로 향하던 급 여객선 세월호가 조난신고를 보내 구조 작업을 진행 중이라고 밝혔다 인천에서 출발해 제주로 향하던 세월호에는 수학여행에 나선 경기 안산 단원고등학교 학생 여명 등 명이 탑승하고 있는 것으로 알려졌다 오전 시 분쯤 속보에 의하면 침몰 중인 함내에서는 바다로 뛰어내리라는 공지가 전달됐다 탑승객들이 구명정에 모두 탑승하지 못한 것으로 추정된다 한편 안전행정부에 따르면 사고 현장에는 해군 함정 척 해군 링스헬기 대 소방당국 헬기 대 민간 상선 등이 승객들을 구조하는 작업을 진행 중이다 해군은 조난 신호를 보낸 여객선 구조를 위해 유도탄고속함 척과 고속정 척 해상초계가 가능한 링스헬기 대 등을 투입하는 등 주변에 있던 전 해군 병력을 동원해 긴급 구조 작업에 나섰다 
32, 수학여행에 나선 학생들 여명이 타고 있는 여객선이 조난 신고를 보내 해경이 구조에 나섰다 목포해양경찰서는 일 오전 시쯤 전남 진도군 관매도 남서쪽  해상에서 제주로 향하던 급 여객선 세월호가 조난신고를 보내 구조 작업을 진행 중이라고 밝혔다 인천에서 출발해 제주로 향하던 세월호에는 수학여행에 나선 경기 안산 단원고등학교 학생 등 여명이 탑승하고 있는 것으로 알려졌다 현재 선박 내부가 침수돼 선체가 좌현으로 도 가량 기울어 있는 상황이다 해경은 선체  정도가 기울었고 침몰 우려가 있어 경비정과 헬기 등을 급파해 승객들을 구조하고 있다고 말했다 오전 시 분 현재 명이 구조된 상태다 오전 시 분쯤 속보에 의하면 침몰 중인 함내에서는 바다로 뛰어내리라는 공지가 전달됐다 탑승객들이 구명정에 모두 탑승하지 못한 것으로 추정된다 한편 안전행정부에 따르면 사고 현장에는 해군 함정 척 해군 링스헬기 대 소방당국 헬기 대 민간 상선 등이 승객들을 구조하는 작업을 진행 중이다 
33, 수학여행에 나선 학생 등 여명이 타고 있는 여객선이 조난 신고를 보내 해경이 구조에 나섰다 학생등 여명이 구조된 것으로 알려졌다 목포해양경찰서는 일 오전 시쯤 전남 진도군 관매도 남서쪽  해상에서 제주로 향하던 급 여객선 세월호가 조난신고를 보내 구조 작업을 진행 중이라고 밝혔다 현재까지 여명이 구조된 것으로 알려졌다 인천에서 출발해 제주로 향하던 세월호에는 수학여행에 나선 경기 안산 단원고등학교 학생 등 명이 탑승하고 있었으나 이들은 학생과 교사 등 명은 모두 구조된 것으로 전해졌다 오전 시 분쯤 속보에 의하면 침몰 중인 함내에서는 바다로 뛰어내리라는 공지가 전달됐다 탑승객들이 구명정에 모두 탑승하지 못한 것으로 추정된다 한편 안전행정부에 따르면 사고 현장에는 해군 함정 척 해군 링스헬기 대 소방당국 헬기 대 민간 상선 등이 승객들을 구조하는 작업을 진행 중이다 해군은 조난 신호를 보낸 여객선 구조를 위해 유도탄고속함 척과 고속정 척 해상초계가 가능한 링스헬기 대 등을 투입하는 등 주변에 있던 전 해군 병력을 동원해 긴급 구조 작업에 나섰다 
34, 수학여행에 나선 학생 등 여명이 타고 있는 여객선이 조난 신고를 보내 해경이 구조에 나섰다 수학여행길에 올랐던 고교생들은 전원 구조된 것으로 알려졌다 목포해양경찰서는 일 오전 시쯤 전남 진도군 관매도 남서쪽  해상에서 제주로 향하던 급 여객선 세월호가 조난신고를 보내 구조 작업을 진행 중이라고 밝혔다 현재까지 여명이 구조된 것으로 알려졌다 인천에서 출발해 제주로 향하던 세월호에는 수학여행에 나선 경기 안산 단원고등학교 학생 등 명이 탑승하고 있었으나 이들은 학생과 교사 등 명은 전원 구조된 것으로 전해졌다 오전 시 분쯤 속보에 의하면 침몰 중인 함내에서는 바다로 뛰어내리라는 공지가 전달됐다 사고 선박은 함수 부분 일부를 제외하고 물 속으로 잠겨 있는 상태다 안전행정부에 따르면 사고 현장에는 해군 함정 척 해군 링스헬기 대 소방당국 헬기 대 민간 상선 등이 승객들을 구조하는 작업을 진행 중이다 해군은 조난 신호를 보낸 여객선 구조를 위해 유도탄고속함 척과 고속정 척 해상초계가 가능한 링스헬기 대 등을 투입하는 등 주변에 있던 전 해군 병력을 동원해 긴급 구조 작업에 나섰다 
35, 일 오전 전남 진도군 관매도 인근 해상에서 조난 신고를 한 여객선 세월호에는 수학여행에 나선 안산 단원고등학교 학년 학생 명 등 명이 탑승했다 단원고에 따르면 명의 학생과 명의 교사는 일 오후 시 분쯤 인천항에서 출발해 박일 일정으로 제주도 수학여행을 가던 중이었다 배가 기울기 시작하자 학생들은 집에 전화를 걸어 사고 상황을 알린 것으로 전해졌다 단원고에는 사고가 난 배에 탑승한 학생들의 보호자 등이 찾아와 상황을 파악중이고 단원고는 학교에 남은 학년과 학년을 대상으로 이날 하루 휴교를 급히 결정한 상태다 
36, 제주도 수학여행을 나선 안산 단원고등학교 학생 등 승객과 승무원 명이 탑승한 대형 여객선이 일 오전 진도 해상에서 좌초해 침몰했다 이 사고로 오후 시 현재까지 최소 명이 숨지고 명의 생사가 확인되지 않아 대형 참사로 이어지는 것 아니냐는 우려가 나오고 있다 일 오전 시 분쯤 전남 진도군 조도면 병풍도 북쪽  해상에서 청해진해운 소속 급 여객선 세월호가 침몰 중이라는 신고가 접수됐다 세월호는 배 앞부분에서 쿵하는 충격음과 함께 왼쪽으로 기울기 시작해 침몰 시작 시간 여분 만인 오전 시 분쯤 완전 침몰했다 전날 오후 시 분쯤 인천을 출발해 제주로 향하던 이 여객선에는 제주도로 박 일간 수학여행을 가던 안산 단원고 학년생 명과 교사 명 등 총 명이 탑승하고 있었다 강병규 행정안전부 장관은 이날 오후 시 분 브리핑을 통해 이번 침몰사고로 남학생으로 추정되는 명이 추가로 사망한 것으로 확인돼 현재까지 명이 숨지고 명이 구조됐으며 명은 생사가 확인되지 않고 있다고 밝혔다 이후 오후 시쯤 중앙재난대책본부는 탑승자를 명으로 구조인원을 총 명으로 정정했다 또 오후 시쯤 목포 한국병원에서 권지연양의 생존이 뒤늦게 확인됐다 이에 따라 현재 구조자는 명 실종자는 명이다 사망자 명의 신원도 모두 파악됐다 선사 직원으로 선상 안내 방송을 맡았던 박지영여씨와 안산 단원고 학년 정차웅군 추가 발견된 남성 사망자 명은 단원고 학년 권오천군과 임경빈군이다 안산단원고 학생으로 확인된 구조자는 명으로 일단 확인됐다 부상자는 모두 명으로 집계됐다 구조자들은 진도 팽목항으로 옮겨 진도 실내체육관 진도한국병원 해남종합병원 목포 한국병원 등으로 분산 수용됐다 당초 중대본은 승객과 승무원 명이 탑승하고 있다고 밝혔지만 오후 들어 일부 중복 계산 인원을 파악해 탑승 인원을 명으로 수정했다 또 이날 오후 시 브리핑에서는 침몰 사고로 명이 사망했고 명이 구조됐으며 나머지 명의 생사는 확인되지 않고 있다고 공식발표했지만 집계 착오라며 구조자 숫자를 수정하는 등 오락가락하는 모습을 보였다 안전행정부 측은 어선이나 민간선박 등도 구조에 나서고 있어 구조자 집계에 착오가 있었다고 밝혔다 생존자들은 침몰한 배 선체에 최소 수십 명의 승객들이 갇혀 있었다고 진술함에 따라 해난구조대와 해군 특수전 전단이 현재 선체 진입을 시도하고 있다 하지만 침몰한 해역의 유속流速과 시야視野 등 구조 환경이 과거 천안함 침몰 해역보다도 더 좋지 않은 최악의 상황이라 구조 작업에 어려움이 겪고 있다 국방부 관계자는 과거 천안함 구조작업 당시 인근 해역의 유속이 였고 확보된 시야가  미만이라 큰 어려움을 겪었다며 그런데 이번 세월호 침몰 해역은 유속이 에 시야는 도 안 된다고 밝혔다 이어 수심은 여로 깊지는 않지만 환경이 워낙 좋지 않아 섣불리 수중 구조작업에 나섰다간 잠수부들의 안전도 장담할 수 없는 상황이라고 말했다 앞서 여객선 측은 오전 시 분쯤 선내방송을 통해 여객선 침몰이 임박했으니 탑승객은 바다로 뛰어내리는 상황에 대비하라고 방송한 것으로 전해졌다 하지만 상당수 승객은 침몰 당시 배안에 갇혀 있었던 것으로 알려졌다 구조된 승객 김성묵씨는 과의 인터뷰에서 여객선 홀 안에 있던 어림잡아 명이 남아 있었는데 배가 도로 기울어진 상태에서 물이 너무 빨리 차올라 빠져나오지 못했다며 당시 구조할 수 없는 상황이었다고 말했다 김씨는 회사 측에서 위험하니까 움직이지 말라고 방송으로 계속 얘기해 움직이는 사람들이 없었다며 하지만 마지막에 물이 차오르면서 사람들이 계속 위로 올라왔다고 말했다 배에 타고 있던 안산 단원고 학년 김모 양은 뉴스과 인터뷰에서 갑자기 쿵 하는 소리가 나더니 배가 기울기 시작했다며 배가 점점 기울었지만 시간 가량 아무런 구조 움직임이 없었다고 말했다 김양은 배가 기울기 시작했는데도 아무런 설명 없이 선내 방송으로 움직이지 말고 그대로 있으라고 했다며 계속 같은 선내 방송만 했다고 말했다 해경은 여객선이 암초에 부딪친 뒤 좌초한 것으로 보고 있으나 정확한 사고원인은 아직 확인되지 않고 있다 사고 현장에는 해경과 해군 함정 척 관공선 등 척 헬기 대가 긴급투입돼 구조작업을 벌이고있다 해군은 침몰 초기 사고 해역으로 유도탄고속함 척과 고속정 척 해상초계가 가능한 링스헬기 대 등을 투입했다 인근 해역을 지나던 화물선 등도 구조작업에 동참한 것으로 전해졌다 이어 경남 진해에서 정박 중이던 독도함도 사고 해역으로 출동했다 육군은 스쿠버 다이버 명을 포함한 특전사 장병 명을 해군은 해난구조대 명과 특수전 전단 명 등 구조대 명을 각각 현장에 투입했다 군은 또 서해안과 남해안에서 작전 중이던 평택함과 청해진함도 긴급 투입했다 청해진해운 소속인 세월호는 제주도로 향하는 대표적인 카페리여객과 자동차를 싣고 운항하는 배로 지난 년 운항을 시작해 매주 차례 인천과 제주도를 오가며 운항해왔다 정원 명 차량 대  트럭 대 컨테이너 개를 실을 수 있는 대형 선박이다 박근혜 대통령은 김장수 국가안보실장으로부터 즉각적인 보고를 받은 뒤 해군과 해경의 인력과 장비 그리고 동원이 가능한 인근의 모든 구조선박 등을 최대한 활용해 구조에 최선을 다하라 여객선 객실과 엔진실까지도 철저히 확인해서 단 한명의 인명 피해도 발생하지 않도록 하라고 지시했다고 민경욱 청와대 대변인이 전했다 이날 오후까지 실종자가 여명에 달하면서 지난 년 명의 사망자가 발생한 서해페리호 침몰사고 이후 최악의 대형참사가 발생하는 것 아니냐는 우려가 나오고 있다 서해페리호는  규모로 정원이 명이었지만 사고 당시 선원 명을 포함해 총 명이 승선한데다 기상 악화를 무시한 채 출항하는 등 대표적인 인재人災로 기록됐다 현재까지 기록된 국내 선박 사고 중 가장 많은 인명피해가 난 사고는 지난 년 월 일 발생한 남영호 침몰사고다 당시 남영호는 승객 명과 감귤 등을 싣고 제주 서귀포항을 출항해 부산으로 항해하던 중 침몰했으며 명이 사망했다 적재량을 넘어선 과적과 항해 부주의 대응 미숙 등이 원인이었다 ▲ 해경이 촬영한 진도 사고 현장 화면 
37, 안전행정부가 아직 승선자 명의 상황이 확인되지 않았다고 밝혔다 일 오전 시 분쯤 전남 진도군 조도면 병풍도 북쪽  해상에서 조난 신고를 한 여객선 세월호에는 제주도로 수학여행을 가는 안산 단원고등학교 학생 명과 교사 명을 포함한 승객 명이 타고 있었다 이중 현재까지 명이 구조됐고 명의 사망이 확인됐으며 명은 아직 상황이 확인되지 않은 것이다 사망자는 선사 직원으로 선상 안내 방송을 맡았던 박지영여씨와 신원이 확인되지 않은 대 남성이다 구조된 사람 중 부상자는 명이고 중상자도 명 있다 여객선은 침몰 시작 시간 여분만인 오전 시 분쯤 완전 침몰됐다 승객들은 구명조끼를 입고 바다에 뛰어들었고 구조 작업에 나선 해군과 해경 선박들에 의해 구조됐다 세월호에 탑승했다가 구조된 승객 김성묵씨는 과의 전화통화에서 처음 사고가 난 후에 위험하니까 자리에서 움직이지 말라는 안내를 받았다며 물이 차 오르니까 사람들이 하나둘씩 위로 올라가기 시작했다고 말했다 그는 내가 구조돼 나올 때도 뒤에 남은 사람이 최소 여명은 있었다며 구조되지 못한 사람이 꽤 있을 것으로 생각된다고 말했다 
38, 전남 진도 세월호 침몰 사고와 관련해 해경이 선장과 기관장 등의 신병을 확보했다 해경은 본격적인 사고원인에 조사에 착수했다 서해지방해양경찰청은 일 오후 박모 기관장 등 승무원 명을 목포해경으로 소환해 사고 원인 조사를 벌이고 있다 사고 선박의 이모 선장의 신병도 확보했지만 이 선장은 실종 승객 구조 지원을 위해 사고해역으로 돌아갔다 선장이 선박 구조를 가장 잘 알기 때문에 취해진 조치라고 설명했다 해경은 해상교통관제센터 데이터를 확인한 결과 여객선이 사고 분전 운항속도 노트에서 사고 시각으로 알려진 오전 시 분쯤 노트로 급속히 감소한 사실을 확인했다 해경은 승무원 조사와 별도로 선박에 파공 부위가 있는지 특공대원들을 해저에 투입 조사하고 있다 
39, 조선닷컴 일 오전 전남 진도군 해상에서 승객 명이 탄 여객선 세월호가 침몰된 가운데 미국 해군도 구조를 위해 현장에 투입됐다 김민석 국방부 대변인은 이날 오후 브리핑을 열고 한반도 서해상에서 정기 경계 임무를 수행하던 미 해군 본험리차드함 이 현재 여객선 침몰현장으로 향하고 있다며 또 미 함대는 한국 해군의 요청에 따라 필요한 지원을 할 계획이다고 밝혔다 본험리차트함은 미 해군 전방배치 강습 상륙함으로  한미연합 쌍용훈련에도 참가했다 미 함대는 일본 요코스카를 거점으로 하며 서태평양을 관할하는 미 해군 최대 해외 전력이다 한편 군 당국은 경남 진해에서 정박 중이던 독도함도 사고 해역으로 출동시켰다고 밝혔다 또 육군은 스쿠버 다이버 명을 포함한 특전사 장병 명을 해군은 해난구조대 명과 특수전 전단 명 등 구조대 명을 각각 현장에 투입했다고 전했다 
