,x
43, 새정치민주연합은 세월호 침몰 사고 현장에서 실종자 가족대표로 활동한 송정근 경기도의원 예비후보와 관련 일 긴급 윤리위원회를 소집해 제명을 추진키로 한 것으로 전해졌다 당 윤리위원장인 강창일 의원은 일 연합뉴스와 인터뷰에서 상황을 알아보니 송씨가 굉장히 비도덕적인 행동을 한 것으로 보여 위원장의 직권으로 윤리위를 소집한 것이라며 이후 복당을 하지 못하도록 하는 영구제명을 추진할 것이라고 밝혔다 강 의원은 그러나 최종 제재 수위는 위원들의 의견을 모두 수렴해 결정하겠다고 말했다 송씨는 세월호 침몰 사고 현장에서 실종자 가족 대표로 활동하다 지난 일 후보직을 사퇴했다 임시학부모대책위원회 대표였던 송씨는 지난 일 박근혜 대통령이 진도체육관을 찾아 실종자 가족들과 면담할 때 사회를 맡았지만 실종된 단원고 학생의 학부모 등 가족이 아닌 지방선거 경기도의원안산시 제선거구 새정치연합 예비 후보로 등록한 정치인이었다 송씨는 본지와 통화에서 정치를 시작한 지는 달밖에 안 됐고 평생 목사로 일해왔기 때문에 사고 현장에 가지 않을 수 없었다며 하지만 오해를 받을 수 있다는 생각에 자진해 후보직을 내려놨다 주위에서도 내가 실종자 직계 가족이 아닌 자원봉사자로 알고 있었다고 해명했다 
44, 변희재 미디어워치 대표가 세월호 침몰사고 보도 중 눈물을 흘린 손석희정관용 앵커에 대해 노회한 퇴물 앵커들의 눈물쇼라고 비난해 논란이 되고 있다 변 대표는 일 자신의 트위터에 국가 재난 사태일수록 방송 앵커는 더 냉정해야 합니다 젊은 앵커들이 감정을 못 이길 수는 있지만 표절석희 표절관용 같이 나잇살 먹은 노회한 자들이 앵커들의 눈물 감성을 선동한다는 건 직업 윤리상 파렴치한 작태입니다라는 글을 게재했다 이어 표절석희 표절관용 같은 노회한 퇴물 앵커들로부터 앞장서서 눈물 감성쇼하고 이걸 친노포털이 띄워주면 젊은 앵커들이 어떻게 되겠습니까 다들 쇼맨으로 전락하고 국민들은 방송의 쇼에 계속 선동당해야 합니다 방통심의위는 즉각 징계에 나서야 돼요라고 주장했다 또한 방송 앵커는 감정과 언어를 절제하는 훈련이 된 프로라는 전제로 마이크를 주는 겁니다 표절석희 표절관용처럼 눈물쇼 해대서 뜬다면 차라리 아무 일반인이나 앉혀서 소리지르고 울면 되는 거죠라고 덧붙였다 앞서 지난 일 뉴스 를 진행하던 손석희 앵커는 실종자들의 생존가능성이 희박하다는 전문가의 의견에 초간 말을 잇지 못하는 모습을 보였다 일 방송에서도 실종된 자녀를 기다리고 있는 가족의 인터뷰를 준비했는데 방금 따님의 시신을 찾았다는 소식을 들었다고 전하며 울컥하는 모습을 보였다 같은 날 정관용 라이브의 진행자로 나선 정관용 앵커 역시 세월호 참사 현장에서 오열하는 부모들의 모습을 전하며 눈물을 보였다 
45, 세월호 침몰사고 단원고 생존자 학부모 여명이 대국민 호소문을 발표하고 정부의 신속한 구조 작업을 요청했다 사고 일주일째를 맞은 일 오전 시 안산교육지원청 앞에서 기자회견을 연 단원고 생존자 학부모들은 정부의 늑장 대응을 온 국민이 규탄하고 있다며 지금 당장이라도 민관 역량을 총동원해 구조작업을 진행해야 한다 진상규명은 그 다음이라고 촉구했다 이어 정부는 갇혀 있는 아이들을 찾으러 직접 물 속으로 들어가겠다는 애타는 마음을 헤아려 신속한 구조작업을 진행해 달라고 요청했다 기자회견을 연 학부모들의 자녀들은 세월호에서 탈출 후 현재 안산고대병원에서 입원 치료 중인 단원고 학년 학생들이다 학부모들은 초기 대응만 제대로 했더라도 큰 피해는 없었을 것이라며 재난관리시스템이 이렇게 허술할 수 있느냐고 지적했다 이들은 구조작업은 더디고 지켜보는 부모의 가슴은 타들어간다고 호소했다 특히 살아남은 아이들의 학부모로서 마음이 무겁다 아직 구조되지 못한 아이들도 하늘로 간 아이들도 살아남은 아이들도 모두 우리가 책임지고 보살펴야 할 아이들이라면서 살아남은 아이들이 죄인이 된 심정이다 이들에 대한 지속적인 보살핌을 위해 정부와 모든 각계각층 시민사회가 애써달라고 당부했다 또한 언론 취재에 대해서는 아이들은 지금도 창문을 바라보다 물이 들어올까 덜컥 겁이 난다고 한다 아이들에게 지금 필요한 것은 절대적 안정이라며 자제를 당부했다 
46, 세월호 침몰 사고로 대한민국 전체가 슬픔에 빠진 가운데 북한 풍계리에 위치한 핵실험장에서 특이 징후가 포착됐다고 미국의 자유아시아방송이 일 보도했다 에 따르면 최근 북한 풍계리 핵실험장 인근에서 차량의 움직임이 증가했다 정부 소식통은 이에 대해 이전과는 다른 수준의 움직임이라고 말했다 한국과 미국의 정보 당국은 북한이 제 차 핵실험을 준비하는 과정일 수 있다고 판단하고 해당 지역을 주시하고 있다 특히 북한 문제 전문가들은 오는 일부터 박 일로 예정돼 있는 버락 오바마 미국 대통령의 방한을 앞두고 이같은 이상 징후가 발견된 점에 주목하고 있다 다만 일부 전문가들은 북한이 위장 전술을 구사하고 있을 가능성도 제기했다 국제사회의 이목을 끌기 위해 일부러 차량 운행을 늘렸다는 주장이다 실제 북한은 미국이 군사위성을 이용해 풍계리 일대를 주시하고 있음을 알고 있다 이를 알면서도 마치 보란듯이 차량 운행을 늘린 건 다른 의도가 있다는 것이다 한국의 국방부 관계자는 에 이같은 사실을 고려할 때 차량의 움직임은 위장 전술일 가능성이 있다며 아직은 북한의 핵실험이 임박한 단계는 아니다라고 말했다 또 세월호 침몰 사고로 전국적인 애도 분위기가 형성된 와중에 북한이 무모한 행동을 하지는 않을 것이란 전망도 나온다 여론을 악화시킬 수 있고 오히려 박근혜 정부를 도와주는 꼴이 될수도 있기 때문이다 박원곤 한동대 국제관계학전공 교수는 에 북측의 차 핵실험 가능성은 항상 열려있다 오바마 대통령이 방한하기 때문에 미국의 대북정책이 어떤 변화를 보이느냐가 가장 핵심적인 변수다 가장 최대의 효과가 이뤄질 수 있는 상황을 북한이 지금 기다리고 있는 것이라고 밝혔다 
47, 한가인 임신 소식이 전해졌다 지난 일 한가인의 소속사 엔터테인먼트에는 한가인이 현재 임신 중이다 세월호 침몰 사고로 나라가 애도하는 분위기라 조심스러워 하고 있는 상황이다 라며 한가인 임신을 알렸다 이어 연정훈과 한가인은 오래 기다려 온 첫 아이 소식에 기쁨을 감추지 못하고 있으며 한가인은 당분간 외부활동을 자제하고 세 태교에 전념할 계획이다라고 덧붙였다 한가인은 현재 임신 주차로 알려졌다 한가인 임신 소식에 누리꾼들은 한가인 임신 년만의 아이라니 정말 기쁘겠어요 한가인 임신 정말 축하드려요 한가인 임신 세가 정말 기대됩니다 등의 반응을 보였다 한편 한가인과 연정훈 부부는 지난 년 드라마 노란손수건에 동반 출연한 이후 연인으로 발전했으며 지난 년 결혼식을 올렸다 
48, 한가인 임신 소식을 알려 화제다 지난 일 한가인의 소속사 엔터테인먼트에는 한가인이 현재 임신 중이다 세월호 침몰 사고로 나라가 애도하는 분위기라 조심스러워 하고 있는 상황이다라며 한가인이 임신을 했다고 밝혔다 이어 연정훈과 한가인은 오래 기다려 온 첫 아이 소식에 기쁨을 감추지 못하고 있으며 한가인은 당분간 외부활동을 자제하고 세 태교에 전념할 계획이다라고 덧붙였다 한가인은 현재 임신 주차에 접어든 것으로 알려졌다 한가인 임신 소식을 접한 누리꾼들은 한가인 임신 년만의 아이라니 정말 기쁘겠어요 한가인 임신 정말 축하드려요 한가인 임신 세가 정말 기대됩니다 등의 반응을 보였다 한편 한가인과 연정훈 부부는 지난 년 드라마 노란손수건에 동반 출연한 이후 연인으로 발전했으며 지난 년 결혼식을 올렸다 
49, 한가인 임신 소식이 전해져 화제다 지난 일 배우 한가인의 소속사 엔터테인먼트에는 한가인이 현재 임신 중이다 세월호 침몰 사고로 나라가 애도하는 분위기라 조심스러워 하고 있는 상황이다라며 한가인 임신 소식을 전했다 이에 한가인의 시아버지이자 연정훈의 아버지인 연규진은 며칠 전 아들부부로부터 임신 소식을 전해 들었다 아직 임신 초기인 단계라 뭐라 말하기 어렵다 그러나 확실히 기쁜 일이다라며 기쁜 내색을 감추지 못했다 한가인 임신 소식을 접한 누리꾼들은 한가인 임신 시아버지가 기뻐하시는게 보이네요 한가인 임신 기대되는 세 비주얼 한가인 임신 년만에 임신이라니 축하드려요 등의 반응을 보였다 한편 한가인과 연정훈 부부는 지난 년 드라마 노란손수건에 동반 출연한 이후 연인으로 발전했으며 지난 년 결혼식을 올렸다 
50, 세월호 실종자가족대표단은 일 정확한 사인을 알고자 하는 가족들의 부검 신청을 받기로 했다고 밝혔다 가족대표단은 이날 전남 진도 팽목항에서 가진 브리핑에서 단순 익사라고 보기 힘든 희생자들이 나오고 있어 정확한 사망 원인을 파악할 필요가 있다며 실제 구조 가능성이 있었는지 부검을 통해 밝힐 것이라고 밝혔다 부검은 시신이 이송된 병원에서 진행되며 가족이나 가족이 지정한 의사나 부검의가 입회할 수 있다 가족대표단은 부검 결과에 따라 해당 주체에게 법적 책임을 묻는다는 방침이다 
51, 한가인 임신이 화제가 된 가운데 연정훈이 과거 세 계획 발언을 해 화제다 지난 일 한가인의 소속사 엔터테인먼트는 한가인이 현재 임신 중이다 세월호 침몰 사고로 나라가 애도하는 분위기라 조심스러워하고 있는 상황이다라며 한가인 임신 소식을 알렸다 이에 지난 년 월 연정훈이 채널 쇼킹에 출연해 한가인이 엄마가 되기 전 대표작을 만들고 싶어했다 드라마 해를 품은 달과 영화 건축학개론이 잘 돼 세 계획을 세웠다고 밝히며 나는 딸을 원하지만 아내는 아들을 낳고 싶어한다는 발언을 한 바 있다 한가인 임신 소식에 누리꾼들은 한가인 임신 년만의 아이라니 정말 기쁘겠어요 한가인 임신 정말 축하드려요 한가인 임신 세가 정말 기대됩니다 등의 반응을 보였다 한편 한가인과 연정훈 부부는 지난 년 드라마 노란손수건에 동반 출연한 이후 연인으로 발전했으며 지난 년 결혼식을 올렸다 
52, 한가인 임신 소식에 연정훈의 과거 세 발언이 화제다 지난 일 한가인의 소속사 엔터테인먼트는 한가인이 현재 임신 중이다 세월호 침몰 사고로 나라가 애도하는 분위기라 조심스러워하고 있는 상황이다라고 밝혔다 이에 지난 년 채널 김수미의 쇼킹에 출연한 연정훈의 과거 발언이 화제다 연정훈은 년에 아기를 만들어 년에 나와 같은 말띠 아이를 낳기로 했다 나는 딸을 원하지만 한가인은 아들을 원한다며 세 계획을 공개했다 현재 한가인은 임신 주차에 들어섰으며 당분간 외부 활동을 자제하고 세 태교에 전념할 계획인 것으로 알려졌다 한가인 임신에 누리꾼들은 한가인 임신 축하해요 한가인 임신 지금 전체적으로 무거운 분위기지만 그래도 결혼 년만에 소중한 아이라니 축하드려요 한가인 임신 딸이든 아들이든 얼마나 예쁠까 등의 반응을 보였다 한편 한가인과 연정훈 부부는 지난 년 드라마 노란손수건에 동반 출연한 이후 연인으로 발전했으며 지난 년 결혼식을 올렸다 
53, 레버쿠젠 손흥민 시즌 호 도움 손흥민레버쿠젠이 일 뉘른베르크와 벌인 독일 분데스리가 라운드 원정 경기에서 시즌 번째 도움을 기록하며 대 승리에 힘을 보탰다 이날 손흥민은 오른쪽 팔에 검은 띠를 두르고 출전해 세월호 침몰 사고에 대한 애도의 뜻을 표했다 미국 쿠차 통산 승 매트 쿠차미국가 일 미국 사우스캐롤라이나주 힐튼헤드 하버타운 골프 링크스파야드에서 막을 내린 미국프로골프 투어 헤리티지에서 통산 번째 우승을 차지했다 라운드 번홀파에서 벙커샷으로 버디를 잡은 쿠차는 이날 타를 줄이며 합계 언더파 타를 기록 위 루크 도널드언더파를 타 차로 제쳤다 우승 상금은 만달러약억만원였다 
54, 한가인 임신 소식에 연정훈의 과거 세 발언이 화제다 지난 일 한가인의 소속사 엔터테인먼트는 한가인이 현재 임신 중이다 세월호 침몰 사고로 나라가 애도하는 분위기라 조심스러워하고 있는 상황이다라고 밝혔다 이에 지난 년 채널 김수미의 쇼킹에 출연한 연정훈의 과거 발언이 화제다 연정훈은 년에 아기를 만들어 년에 나와 같은 말띠 아이를 낳기로 했다 나는 딸을 원하지만 한가인은 아들을 원한다며 세 계획을 공개했다 현재 한가인은 임신 주차에 들어섰으며 당분간 외부 활동을 자제하고 세 태교에 전념할 계획인 것으로 알려졌다 한가인 임신 소식에 누리꾼들은 한가인 임신 거의 년만의 아이라니 정말 기쁘겠어요 한가인 임신 정말 축하드려요 한가인 임신 세가 정말 기대됩니다 한가인 임신 좀만 빨리 했으면 말띠 가능했을 듯 등의 반응을 보였다 한편 한가인과 연정훈 부부는 지난 년 드라마 노란손수건에 동반 출연한 이후 연인으로 발전했으며 지난 년 결혼식을 올렸다 
55, 한가인 임신 소식에 연정훈 과거 발언이 화제다 지난 일 한가인의 소속사 엔터테인먼트는 한가인이 현재 임신 중이다 세월호 침몰 사고로 나라가 애도하는 분위기라 조심스러워하고 있는 상황이다라며 한가인 임신 소식을 알렸다 이에 지난 년 채널 김수미의 쇼킹에 출연한 연정훈의 과거 발언이 화제다 연정훈은 년에 아기를 만들어 년에 나와 같은 말띠 아이를 낳기로 했다 나는 딸을 원하지만 한가인은 아들을 원한다며 세 계획에 대해 밝혔다 현재 한가인은 임신 주차로 알려졌다 한가인은 당분간 외부 활동을 자제하고 세 태교에 전념할 계획인 것으로 알려졌다 한가인 임신 소식에 누리꾼들은 한가인 임신 거의 년만의 아이라니 정말 기쁘겠어요 한가인 임신 정말 축하드려요 한가인 임신 세가 정말 기대됩니다 한가인 임신 좀만 빨리 했으면 말띠 가능했을 듯 등의 반응을 보였다 한편 한가인과 연정훈 부부는 지난 년 드라마 노란손수건에 동반 출연한 이후 연인으로 발전했으며 지난 년 결혼식을 올렸다 
56, 새정치민주연합 소속 경기도의회 의원 예비 후보가 세월호 침몰 사고 현장에서 실종자 가족 대표로 활동하다 지난 일 후보직을 사퇴한 것으로 나타났다 임시학부모대책위원회 대표였던 송정근씨는 지난 일 박근혜 대통령이 진도체육관을 찾아 실종자 가족들과 면담할 때 사회를 맡았었다 하지만 송씨는 실종된 단원고 학생의 학부모 등 가족이 아닌 지방선거 경기도의원안산시 제선거구 새정치연합 예비 후보로 등록한 정치인이었다 새정치연합 경기도당 발기인에도 이름을 올렸다 이 같은 사실이 알려지자 네티즌들은 실종자 가족도 아닌데 실종자 가족 대표가 돼 대통령도 속이고 국민도 속였다 사고를 정치적으로 이용하고 있다 등의 반응을 보였다 송씨는 일 본지와 통화에서 정치를 시작한 지는 달밖에 안 됐고 평생 목사로 일해왔기 때문에 사고 현장에 가지 않을 수 없었다며 하지만 오해를 받을 수 있다는 생각에 자진해 후보직을 내려놨다 주위에서도 내가 실종자 직계 가족이 아닌 자원봉사자로 알고 있었다고 해명했다 송씨는 일 후보직을 사퇴했고 송씨가 임시로 맡았던 학부모대책위원회 대표는 다시 선출됐다 
57, 세월호 침몰 참사 아픔에 스타들이 함께하고 있다 온국민이 가슴이 찢어지는 심정으로 하루하루를 살아가고 있는 가운데 드라마 밀화의 김희애 심혜진 김혜은이 따뜻한 소식을 전했다 밀회에서 열연을 펼치고 있는 김희애 심혜진 김혜은이 국내복지사각지대 아동후원캠페인에 참여했다 기아대책에서는 복지 사각지대의 아동들을 위한 사회 안전망 구축의 일환으로 라디오  와 함께 복지사각지대 아동후원 캠페인을 펼치고 있다 세 사람이 참여한 부분은 라디오의 복지사각지대 아동후원 캠페인 스팟 광고 출연진들은 바쁜 드라마 촬영 일정에도 잠시 짬을 내어 라디오 스팟 광고에 참여했다 기아대책 홍보대사로 활동 중인 김혜은의 부탁을 받고 김희애와 심혜진이 흔쾌히 수락해 진행하게 됐다는 후문 복지사각지대 아동후원 캠페인은 기업에서는 후원금이나 물품을 청취자들은 로 천원씩 기부할 수 있으며 기부한 물품과 금액으로 결연아동들에게 물품을 전달하고 저소득층 어린이와 대 결연을 추진할 예정이다 한편 밀회 이번 주 방송 분인 회 회는 결방되며 월 일 월요일부터 정상 방송될 예정이다 
58, 세월호 참사가 터진 다음 날인 일 다음 아고라에는 초중고 수학여행 수련회 없애주세요라는 청원이 올라왔습니다 하루 만에 만명이 넘게 서명했습니다 청원 제안자는 이렇게 써놓았습니다 년대처럼 경제가 어려워 가족 여행이나 캠핑 등이 드문 것도 아닌데 왜 굳이 수학여행과 수련회 등 단체 이동으로 인한 사고 위험 노출과 행사 이후 후유증요즘 초딩들도 수학여행 후 왕따 폭력 등에 시달린다고 합니다이 있는 관행적인 행사를 수십년째 없애지 못하고 있는 걸까요 우리 주위에는 이런 관행이 참 많습니다 외국인들의 눈에는 좀 이상하게 보이는 것입니다 한 사무국장은 저에게 이런 이야기를 했습니다 외국계 기업 에게 이메일을 보내면 대부분 피드백을 하지만 국내 기업 는 절대 피드백을 하지 않는다 외국계 기업 사회공헌 담당 임원은 협의할 일이 있으면 아무 거리낌 없이 우리 사무실로 찾아오지만 국내 기업 임원은 바로 코앞에 사무실이 있어도 반드시 우리가 그 사무실을 찾아가야 한다 기업뿐 아니라 정부도 비슷합니다 아동 학대 문제를 애초에 정부에서 주도권을 쥐고 담당했더라면 지금쯤 어떤 모습일까요 다문화가족지원센터나 드림스타트센터와 같이 개가 넘는 센터를 지정하고 담당 인력과 인프라 예산을 확보했을 것입니다 민간단체가 아동 학대 사업을 해왔다는 이유로 정부는 이 사업의 우선순위를 낮게 책정해왔습니다 이번 더나은미래 인터뷰에서 유명 석학인 기 소르망도 말하듯 이제 정부와 시장기업이 모든 걸 할 수 있는 시대는 갔습니다 이 흐름은 앞으로 더 강화될 겁니다 우리는 과연 준비가 돼 있는지 모르겠습니다 
59, 여야與野가 세월호 실종자 구조 작업의 장기화에 따라 지방선거 후보 경선 일정을 잡지 못하고 있다 홍문종 새누리당 사무총장은 일 최고위원회의에서 새누리당은 생존자의 귀환을 바라며 사고가 수습될 때까지 경선 일정 및 선거운동을 무기한 연기키로 했다고 말했다 새누리당은 시도지사 후보 경선 일정을 이미 한 차례 연기해 일부터 재개할 예정이었지만 실종자 구조 작업이 장기화하자 이마저도 지키기 어렵다고 판단한 것이다 당의 한 관계자는 경선을 하려면 전화 여론조사를 실시해야 하는데 지금 같은 분위기에서는 불가능하다며 하지만 후보 등록일월 일을 감안하면 월 일까지는 경선을 끝내야 한다고 했다 당내 일각에서는 경선 재개에 따른 잡음 등을 최소화하기 위해 각 시도지사 후보 경선을 등록일을 앞두고 한꺼번에 치러야 한다는 주장도 나온다 새정치민주연합도 경선 일정을 확정하지 못하고 있다 한 핵심 관계자는 당내 경선 시기나 룰 등에 대해 공식 회의 석상에서 논의를 아직 못했지만 대체로 월 중 경선은 어렵다는 데 공감대를 이루고 있다며 당 통합 과정과 기초선거 불不공천 방침 논란 등으로 새누리당보다 후보 확정이 늦어진 상태라 걱정이라고 했다 새정치연합은 당초 일로 예정됐던 경기지사 경선을 주일가량 연기하기로 내부 방침을 정한 것으로 알려졌다 호남 지역 시도지사 경선은 기약 없이 미뤄져 다음 달 초 연휴가 끝난 뒤에나 치러질 전망이다 다만 기초 후보자 자격심사위원회는 활동 중이며 일부 지역은 탈락자도 가려놓은 상태지만 발표는 미루고 있다 한편 중앙선거관리위원회는 이날 새누리당과 새정치민주연합의 당내 경선 국가 부담 위탁 기한을 오는 일에서 일로 조정했다고 밝혔다 양당이 당내 경선을 국고 도움을 받아 치르기 위해서는 일까지 일정을 마무리해야 한다 
60, 해외 동포와 언론이 통일에 기여할 수 있는 방안을 모색하겠습니다 이종국 사단법인 재외동포언론인협회장은 일 개막한  재외동포언론인대회에 앞서 본지 인터뷰에서 이렇게 말했다 통일을 화두로 한 올해 대회에는 여개국 개 도시에서 조선족고려인을 비롯한 재외 동포 언론사 간부기자 여명이 참가한다 이 회장은 통일 과정에 재외 언론의 역할을 강조했다 위안부 결의안이 미국 하원을 통과한 것이나 교과서 동해병기 법안이 버지니아 주지사 서명을 받은 배경에는 재미 한인 동포와 언론의 활약이 분명히 있습니다 교포들이 언론을 통해 고국의 이슈를 알고 미국 정부를 압박해 쾌거를 이룬 거죠 통일도 마찬가지입니다 재외 언론을 통해 교포들이 본국과 소통하며 주변 강대국들 여론을 통일에 호의적인 방향으로 끌어가야 합니다 이 회장은 재외 언론은 만 해외 동포가 모국과 소통하는 소중한 통로인데도 세계적 불황과 소셜네트워킹서비스 발달로 구독자가 줄어 재정난이 심각하다며 본국과 소통 창구 유지를 위해 독립운동하는 심정으로 버티는 언론인이 태반이다고 했다 그는 최근 해외한인언론지원법이 국회를 통과해 법적 지원 근거가 마련된 만큼 정부가 재외 언론의 중요성을 좀 더 깊이 인식해 지원해주길 바란다고 했다 재외동포언론인대회는 한국과 재외 동포 사회의 원활한 교류를 위해 열린다 년부터 시작돼 올해로 회째다 사단법인 재외동포언론인협회와 대한언론인회회장 김은구가 공동주최하고 한국언론진흥재단이사장 김병호재외동포재단이사장 조규형한국신문방송편집인협회회장 송희영가 후원한다 참가자들은 일부터 박 일간 서울과 경기도 고양시 대구광역시 등에서 한국의 발전상과 분단 현실을 둘러본다 이 회장은 세월호 침몰 참사에 대해 협회를 대변해 안타까움을 전했다 만 해외 동포들도 한마음으로 실종자 귀환을 간절히 바라고 있습니다 개막 예정일 닷새 전에 비극이 발생해 모국이 슬픔에 잠겨 있는 시기에 행사를 진행하게 돼 대회 기간 내내 추모와 묵념의 시간을 가질 예정입니다 
