,x
1,일부 언론들이 제기하는 세월호 침몰 참사 실종자들에 대한 외부세력론의 발화점은 실종자 가족 대표를 맡았던 송정근 씨다 자신의 신분을 안산에서 활동하는 목사라고 한 송씨는 사고 당일인  일부터 실종자 가족들이 모인 전남 진도체육관에서 경황이 없는 가족들을 대신해 정부기관이나 언론 등에 가족들의 뜻을 전달해왔다  일 박근혜 대통령이 체육관을 방문했을 때는 사회를 맡기도 했다 하지만 송씨는 새정치민주연합 소속으로   지방선거에서 경기도의원으로 출마하려던 정치인이라는 사실이 드러나면서 일부 언론들에 의해 피해자 가족들을 선동하는 외부세력으로 지목됐다 송씨의 지역구는 실종자 가족들이 많이 사는 안산시 제 선거구다 송씨는  년부터 안산에서 가출 청소년을 위한 쉼터를 운영하면서 청소년 지원 활동을 해왔고 사고를 당한 단원고 학생들 중에도 아는 이가 많다고 한다 논란이 일자 새정치연합은  일 윤리위원회를 소집해 송씨를 제명할 예정이었으나 송씨는 윤리위가 소집되기 전 탈당계를 제출했다 앞서 송씨는  일 경기도의원 예비후보직도 사퇴했다 일부 언론들은 송씨가 자신의 신분이 드러나자 사퇴했다고 보도했다 송씨는 이와 관련해  일 와의 통화에서 지역아동센터의 학생들이 연락이 안 된다고 해 걱정이 돼서 사고 첫날 진도로 내려갔다 처음부터 가족이 아니라는 얘기를 했고 가족들이 망연자실해 있는 상황이니 일을 좀 맡아달라고 해서 대표를 했던 것이라며 진정성을 의심받을까 봐 며칠 뒤 예비후보직을 사퇴하고  일까지 현장에서 활동했다고 말했다 송씨는 가족들을 선동해 정부를 비판한 적도 없다며 가족들에게 본의 아니게 상처를 준 것은 잘못했으나 다시 내려가 가족들을 돕겠다고 덧붙였다조혜정 기자  미안하다 얘들아 안산 세월호 촛불 현장 한겨레포커스 
2,새정치민주연합 제주지사 후보로 신구범  전 제주지사가 합의추대됐다 새정치민주연합 제주도당은  일 오후  시 당사에서 긴급 기자회견을 열어 각고의 논의 끝에 세 후보가 아름다운 추대를 이뤄냈다 신구범 예비후보를 새정치민주연합의 제주도지사 후보로 추대하기로 결정했다고 발표했다 이날 회견에서 김재윤 도당 공동위원장은 신 예비후보에 대해 관선과 민선 지사를 두루 역임한 경륜과 능력을 갖춘 분으로 세 후보 간에 합의를 통한 아름다운 추대를 했다고 밝혔다 지지율에서 가장 앞선 김우남 의원을 배제한 것에 대해선 세월호 침몰 사고 이후 이 문제를 따지고 대책을 세워야 할 주요 상임위가 농림축산식품해양수산위원회다 국가 위기 사태에서 원인을 규명하고 대책을 수립하는 등 소관 상임위 위원으로서 책무를 다해야 한다는 역할 분담론이 자연스럽게 제기됐다고 설명했다 김 위원장은 이어 후보 선정에 고민했던 부분은 고희범신구범 예비후보였다 여러가지 고민을 하다가 안철수신당과 민주당의 신당 창당 정신을 살리기 위해 위기 관리 능력이 뛰어나고 제주도정의 성과를 낸 신구범 예비후보로 결정했다고 말했다 그러나 이날 기자회견에는 김 위원장 혼자 참석해 세 후보 사이에 불협화음이 있는 것 아니냐는 지적이 나오고 있다 후보들이 자신들의 입장도 내지 않고 있다 새정치민주연합 일부 당원들은 최근 조사에서 당내 지지도가 김우남 고희범 신구범 예비후보 차례로 나오는데도 신 예비후보로 합의추대한 것에 의문을 제기하고 있다 제주허호준 기자  
3,여객선 세월호 침몰 사고의 실종자 무사귀환을 기원하고 희생자를 추모하기 위한 시민사회단체들의 움직임이 확산되고 있다 부산여성회와 부산학부모연대는 지난  일부터 매일 저녁  시 부산역 광장에서 세월호 참사로 희생된 이들을 추모하고 실종자들의 무사귀환을 기원하는 촛불행사를 열고 있다 부산여성회는 참석자들이 직접 쓴 추도시를 낭독하거나 자유발언을 하며 희생자들을 애도하고 아직 생사가 확인되지 않은 세월호 승객들의 신속한 구조를 기원하고 있다고 밝혔다 대구지역 시민단체들도 지난  일에 이어  일 저녁  시 대구 중구 동성로 대구백화점 앞에서 촛불문화제를 열었다 촛불문화제 현장에는 기적이 일어나기를 기다릴게요 조금만 더 참고 기다려라 등 실종자 무사귀환을 바라는 글귀 수백장이 나붙었다 참석자들은 실종자 무사귀환을 염원하는 종이학  마리를 접어 경기 안산 단원고등학교로 보내기로 했다  일 저녁  시 촛불문화제 현장에서  여ｍ 떨어진 대구 중앙파출소 앞에서는 학부모  여명이 촛불을 켜고 실종자 무사귀환을 빌었다 딸과 함께 촛불문화제에 참가한 김나영 씨는 아이를 키우는 엄마로서 너무도 가슴이 아프고 답답하다 하지만 실종자들이 꼭 살아서 돌아올 것으로 믿는다고 말했다 울산에서는 지난  일부터 매일 저녁 울산대공원 동문 매곡천 남목삼거리 등  여곳에서 촛불행사가 열리고 있다 울산여성회는  일 촛불행사 참가자와 학부모들의 의견을 모아 사고 희생자 및 실종자 가족을 지원하기 위한 방안을 마련하기로 했다 김주영 울산여성회장은 대개 엄마들이 남의 일 같지 않다 뭐라도 해야 하는 것 아니냐며 안타까운 마음으로 아이들과 함께 촛불을 들고나온다 곳에 따라 적게는  여명 많게는  여명이 모여 한마음으로 실종자들의 무사귀환을 기원하고 있다고 말했다 전북 전주지역 시민사회단체들은 지난  일에 이어  일 저녁  시 전북 전주시 한옥마을 경기전 앞에서 세월호 탑승자 무사생환 기원과 희생자 애도를 위한  차 시민 촛불행사를 연다 이날 시민들은 실종자 무사생환을 기원하며 나무에 초록 리본을 달고 나무로 만든 배의 돛에 희망을 담은 글을 남긴다 또 부모들의 간절한 소망을 담아 아이들에게 보내는 편지도 낭송할 예정이다 이정현 전북환경운동연합 사무처장은 국정원장 사퇴 등을 촉구했던 시국회의와는 별도로 세월호 침몰 사고를 안타까워하는 시민들이 자발적으로 재능을 기부하고 참여해 촛불행사를 열고 있다고 말했다 경남에서는 지난  일부터 세월호 실종자 무사귀환 촛불기도회가 지역별로 열리기 시작해  일 저녁에는 창원김해진주양산거제함안산청 등  곳에서 열렸다 촛불기도회는 정해진 식순도 준비된 연설도 없이 지역 진보연합교육연대 등 시민사회단체가 준비한 촛불을 시민들이 하나씩 들고 기도하는 방식으로 진행된다 참가자들은 또 노란색 리본에 실종자 무사귀환을 기원하고 희생자를 추모하는 글을 써서 내걸었다 박유호 창원진보연합 대표는 세월호 실종자 수색작업이 끝날 때까지 매일 촛불기도회를 열 계획이며 희생자들을 추모하기 위한 시민분향소 설치도 검토하고 있다고 말했다 영호남 종합  관련영상 한겨레 포커스촛불 시민 아직 끝난 게 아니다 한 아이라도 돌아오길 관련영상 한겨레포커스미안하다 얘들아 안산 세월호 촛불 현장 
4,지역 기업대학단체들이 여객선 세월호 침몰 사고의 실종자희생자 가족을 돕기 위해 발 벗고 나섰다 부산 향토기업 세정은 세월호 실종자 가족들이 대기하고 있는 전남 진도체육관 임시보호소에 라면  개와 생수  개를 전달했다 전북대병원은 정태오 응급의학과 교수와 간호사  명 응급구조사  명 행정지원  명 등  명으로 꾸려진 재난의료지원팀을 진도로 보냈다 재난구조협회 익산지회는 특전사 출신 구조대원  명을 진도로 급파했다 전라북도자원봉사센터도   이동빨래방 차와   밥차를 자원봉사자와 함께 진도에 보냈다 울산공수특전동지회 회원  명과 울산 동부 수난의용소방대원  명은 각각 지난  일과  일 진도 맹골수도 해역과 팽목항에서 수색구조활동을 지원하고 돌아왔다 주류 제조업체인 무학은 애도 분위기에 동참하기 위해 모든 광고판촉 활동을 중단했다 부산경남경마공원은 지난  일에 이어  일 경마를 시행하지 않기로 했다 대구은행은  일 예정된 봄테마여행과 다음달  일 어린이날 행사를 취소하고 세월호 침몰 사고 희생자와 실종자 가족을 돕기 위한 모금운동을 준비하고 있다 전북도는 전북도청 농협지점 전북은행 도청지점 대한건설협회 전북도회의 협찬을 받아 빵  상자 음료수  상자 우유  개 햇반  상자 컵라면  상자 등  만원어치의 각종 생필품을 진도체육관 임시보호소에 전달했다 울산시는 구조 요청에 대비해 잠수인력  명 구급대원  명 구급차  대 등을 대기시켜 놓았다 부산대 총학생회는  일 실종자 무사귀환을 기원하는 뜻을 담아 학교 본관 건물 옆에 가로  ｍ 세로  ｍ 크기의 펼침막으로 염원의 벽을 설치했다 계명대 총학생회는 봄 축제를 취소하고 축제 대신 봉사활동을 펼치기로 했다 또 현재 진행되고 있는 중간고사가 끝나는 대로 총학생회 차원에서 모금운동도 펼칠 예정이다 경일대 총학생회도 봄 축제를 취소하고 모금운동에 나서기로 했으며 진도 현지에 찾아가 봉사활동을 펼치는 방안도 논의하고 있다 울산대 총학생회는  일부터 세월호 사고 희생자 및 실종자 가족을 돕기 위한 성금 모금운동을 펼치고 있다 영호남 종합 관련영상 한겨레 포커스촛불 시민 아직 끝난 게 아니다 한 아이라도 돌아오길 관련영상 한겨레포커스미안하다 얘들아 안산 세월호 촛불 현장 
5,세월호 침몰 참사가 커진 데는 선장의 오판 외에도 부실 대응으로 일관한 해양경찰청의 책임이 크다는 지적이 일고 있다 해경은 세월호의 운행 상황을 제대로 모니터링하지 않은 것은 물론  상황실을 통해 배가 침몰한다는 신고를 받고도 신고자에게 배의 위치를 묻는 등 허둥대며 골든타임을 허비했다 이어 현장에 가장 먼저 출동하고도 선내 승객 구조를 적극 시도하지 않았다 그런데도 검경합동수사본부는 해경을 수사 대상에서 사실상 제외해 해경 봐주기라는 비판을 자초하고 있다 반면 사고를 낸 선사와 실소유주에 대해서는 여론을 등에 업고 먼지털기식 수사에 들어갔다 수사 총괄책임자인 안상돈 광주고검 차장검사는  일 해경을 수사하고 있느냐는 기자들의 질문에 해경하고 같이 수사하고 있는데 해경을 수사하는 것은이라며 말을 흐렸다 수사 대상이 아니라는 취지다 하지만 진도 관제센터의 부실한 대응은 피해가 확대된 중요 원인의 하나로 꼽힌다 진도 관제센터는 사고 당일인  일 오전  시 분 세월호가 자신들의 관제 해역에 들어왔는데도 규정을 어긴 채 진입 신고를 하지 않은 세월호를 계속 묵인방치했다 이 때문에 세월호가 침몰 중이라는 사실은 제주 관제센터의 연락을 받고 나서야 알게 된다 해상 사고 위험을 관찰하고 정보를 제공하라는 연안 해상교통관제 운영관리규칙을 정면으로 위반한 것이다 또 해경 구조대는 신고 접수  여분 뒤인  시 분께 현장에 도착하고도 배가 전복될 때까지 배 밖으로 나오는 선원과 승객들만 구조하고 선내 진입은 하지 않았다 사고 발생과 대처 과정에서 해경 쪽 책임이 만만찮은 것이다 그런데도 검찰 관계자는 선원과 선박회사 쪽 수사가 먼저다 해경은 기록이 남아 있으니 천천히 해도 된다고 밝혔다 수사본부는 해경이 임의로 제출한 자료만 받아놓은 상태다 공개된 것 외에 다른 교신기록이나 상황보고 등이 있을 것이라는 의혹이 계속해서 제기되는데도 강제수사는 불필요하다는 입장을 고수하고 있다 세월호가 제주 관제센터로 신고했다가 다시 진도 관제센터로 연결돼 교신하는 사이  분의 골든타임을 허비한 데 대해서도 검찰 관계자는 교신 관련 문제는 없는 것으로 본다고 말했다 해경이 수사본부를 구성하는 한 축이어서 수사를 부담스러워하는 게 아니냐는 의구심이 제기되는 대목이다 제주 관제센터해양수산부 소속는 사고 당일인  일 세월호와의 교신기록을 곧바로 공개한 반면 진도 관제센터는 교신기록을 공개하지 않다가 가 의혹을 제기한 뒤인  일에야 내놓았다 사고 발생 나흘 만이다 박근혜 대통령이  일 책임자 엄벌 방침을 밝힌 뒤 수사본부는 선원들에게 적용할 수 있는 모든 혐의를 씌워 구속하고 있다 인천지검도 사고와 직접 관련이 없는 세월호 선사와 실소유주의 탈세 혐의까지 들추는 전방위 수사에 나섰다 민간업자의 책임은 엄하게 물으면서 정부 기관에는 다른 기준을 적용하려는 것으로 비칠 수 있다 한 검찰 출신 변호사는 전국민적 관심사인 만큼 참사 원인과 책임 소재를 명확히 하기 위해 조사 대상을 폭넓게 할 필요가 있다 여러 의혹이 제기되는 상황이라면 관련 기관이 제출하는 자료를 받는 데 그치지 않고 압수수색으로 자료를 확보하는 등 투명한 절차를 통해 의혹을 해소해야 한다고 말했다 한 검찰 관계자는  차로 선원과 선박회사의 수사 과정에서 연결고리를 찾으면 해경 등 다음 수사로 나아갈 수도 있다고 말했다 이경미 목포노현웅 기자  관련영상 한겨레 포커스촛불 시민 아직 끝난 게 아니다 한 아이라도 돌아오길 
6,세월호 침몰 과정에서 해양경찰청이 저지른 총체적인 직무유기대응 부실이 잇따라 드러나고 있다 해경 소속인 진도 해상교통관제센터는 사고 예방은 물론 상황 파악도 제때 하지 못했고 해경 구조대는 초기 대응에 우왕좌왕해 인명 손실을 키웠다 ■ 해경 구조대의 우왕좌왕 해경은 최초 신고 접수 시간을  일 오전  시 분이라고 밝혔다 하지만 배에 탄 안산 단원고 학생이 이보다  분 빠른  시 분에  에 침몰 신고를 했다 신고를 받은 전남소방본부는 목포해경 상황실을 연결했다  일 공개된 신고 학생과 전남소방본부 목포해경 상황실의  자통화 녹취록을 보면 해경은 바다 한가운데 떠 있는 학생에게 위도와 경도가 뭐냐고 묻는 등 허둥댔다 학생이  로 배가 침몰하는 것 같다고 말하자  대원은 신고자가 타고 있는 배냐 배 이름은 뭐냐 등을 묻다가 해경에 연락했다 해경은 학생에게 위치 경위경도와 위도도 말해주세요라고 물었다 학생이 당황한 듯 위치를 잘 모르겠다고 하자 다시 지피에스 경위도 안 나오나요 경도하고 위도라고 했다 학생이 대답을 못하자 해경은 배가 언제 어디서 출항했는지 배 이름이 뭔지 여객선인지 어선인지 등을 묻느라  분을 낭비했다 해경은 진도 관제센터에 배 이름만 알려주면 사고 위치를 알 수 있었지만 진도 관제센터에 연락조차 하지 않았다 진도 관제센터는 세월호 항해사의 신고를 받은 제주 관제센터로부터 신고 사실을 들었다 해경이 신고 접수를 했다는  시 분보다  분 늦은  시 분의 일이다해경구조대 우왕좌왕 초동대처 배 이름만 알려주면 위치 아는데 진도 관제센터에 연락조차 안해 경비정은 공용채널  번 사용 안해진도 관제센터 직무 소홀 관심선박이라 지켜봤다면서 채널 끈채 운항했는데도 지도 안해 제주서 연락받기까지 이상징후 몰라 이뿐만이 아니다 사고 지점에 처음 출동한 해경 경비정은 공용채널인 초단파무선통신  번이 아닌 진도관제센터의 고유 채널인  번으로 세월호와 교신을 시도했다 하지만 세월호는 공용채널인  번으로 진도 관제센터와 교신하고 있었다 결국 경비정은 선박 내부 상황을 모른 채 구조에 나섰다 하지만 구조 태도는 소극적이었다 해경은 선박 안으로 진입하지 않고 배 주변에 머물며 배 밖으로 나오는 사람들만 구조하는 데 그쳤다 해상 사고 구조의 현장 지휘를 맡아야 할 해경이 초기에 정확한 상황을 파악하지 못하면서 갈팡질팡한 것이다 ■ 진도 관제센터의 무책임 해상사고를 예방할 의무가 있는 진도 해상교통관제센터도 책무를 소홀히 했다 해경은  일 오전  시 분에 진도 관제센터 당직자가 세월호가 관제구역에 진입한 사실을 레이더와 선박자동식별시스템을 통해 확인했다고 밝혔다 하지만 세월호는 진입신고를 하지 않았다 선박이 진입신고를 하지 않으면 최대 벌금  만원을 내야 한다 그런데도 세월호가 신고하지 않은 것은 평소 진도 관제센터가 이를 묵인한 것 아니냐는 의혹으로 이어진다 해경의 해명자료에는 당직자는 세월호가 인천과 제주도를 정기적으로 운항하는 여객선임을 알고 있었다고 나온다 평소 하던 대로 했다는 취지다 해경은 진도 관제센터가 세월호 주변  ｍ에 선박 등 장애물이 접근하면 경보음이 울리도록 하는 도메인 워치 기능을 가동했다고 설명했다 해경 관계자는  일 세월호는 관심 선박이어서 도메인 워치 기능을 설정해 지켜봤다고 말했다 하지만 해경은 전날 관심 선박이라는 세월호가 진도 관제센터가 사용하는 채널  번과 공용채널인  번을 켜지 않은 채 운항했는데도 이를 바로잡지 않았다 나중에 문제가 발생하자 세월호가 위험을 알리는 경고신호나 무선교신을 해오지 않았다고 해명했다 세월호에 사고가 발생한 오전  시 분 분 사이 진도 관제센터는 해역에 있는 선박들과 교신하지 않았다 이때 레이더에 잡힌 세월호의 항적로를 봤다면 이상 징후를 간파했을 수도 있었다 해경 관계자는 이 해역은 통행하는 선박이 많아 한꺼번에 수백 척이 모니터에 나타난다 두 선박이 충돌한다면 몰라도 속도를 늦추거나 방향을 선회하는 것만으로 이상을 탐지하기는 어렵다고 설명했다 한 외항선 선장은 통신이 어려워도 안전사고를 탐지해 경보를 발령할 수 있도록 첨단장비를 들여놓는 것이다 해경의 관제 능력이 떨어지는지 근무 기강이 해이했는지 엄중하게 조사해 제 역할을 하도록 다그쳐야 한다고 강조했다 이경미 목포안관옥 기자  관련영상  의 생각  불신의 땅 대한민국 
7,방송통신심의위원회위원장 박만는  일 세월호 사고의 피해자와 유가족 등을 비하하는 내용의 온라인 게시물  건을 삭제하도록 인터넷 사업자에게 요구하기로 결정했다 방통심의위는 이날 통신심의소위원회를 열어 이와 같이 결정했으며 삭제 접속 차단 대상 게시글  건은 △사고 피해자유가족에 대한 무분별한 욕설비하 △합리적인 이유 없이 사고 지역 또는 지역민에 대한 비하편견 조장 △생존자 수 맞히기 등 불법도박 베팅의 수단으로 악용 △사건과 관련 없는 잔혹한 사진영상 등을 포함하고 있다 방통심의위는 해당 게시글이 올라온 일간베스트저장소일베와 디시인사이드와 같은 국내 누리집 사업자에게는 삭제를 요구하며 미국에 본사가 있는 트위터에 대해서는 케이티 등 국내 망 사업자에게 접속 차단을 요구한다 이날 열린 통신심의소위원회에서는 세월호 사고 현장을 연결하던 중 기자와 출연자가 웃는 모습이 노출돼 시청자들의 비판을 받은 에 대해 권고 결정을 내렸다 이는 세월호 보도 관련 심의에서 이뤄진 첫 제재 결정이다 또 시신 확인 오보를 내고 사고 현장에서 한 남성이 욕설을 하는 장면을  초 동안 방송한  사망보험금 보도를 한  이번 사고와 무관한 다른 사고의 시신 운구 장면을 내보낸  등의 프로그램  건에 대해서는 모두 제작진 의견 진술 청취 결정을 내렸다 의견 진술은 과징금 부과나 경고주의 등 중징계를 내리기 전에 방송사에 소명 기회를 주는 법적 절차다 이로써 전날 열린 회의에서 의견 진술 청취가 결정된   의 프로그램  건 등 모두  건의 세월호 관련 방송 보도가 중징계 절차를 밟게 됐다 김효실 기자  
8,검찰이 세월호 침몰 참사를 계기로 해운업계 전반의 구조적 비리에 대해 수사를 확대하기로 하고 부산지검 특수부를 중심으로 특별수사팀을 새로 꾸렸다 이에 따라 세월호 침몰 관련 수사팀은 기존 수사를 진행중인 검경합동수사본부목포지청 인천지검 등 세곳으로 늘었다 세월호 사고 일주일째를 맞아 확인된 사망자가  명을 넘어섰다 검찰 관계자는  일 세월호 침몰로 가시화된 연안해운의 문제점 전반에 대해 수사에 착수하기로 했다 김진태 검찰총장의 지시에 따라 부산지검에 특별수사팀을 꾸려 연안해운업계 구조적 비리 전반을 수사하고 인천지검 특별수사팀이 세월호 선주와 업계 전반을 맡는다고 말했다 사고 원인과 구조 과정에 대해서는 합동수사본부가 계속 집중한다 이번 수사의 총괄지휘는 대검 중앙수사부의 후신인 반부패부에서 맡게 될 가능성이 높다 사고 현지에서 세월호 침몰 사고를 수사하고 있는 수사본부는 전날 구속영장을 청구한 세월호  등항해사 신아무개 씨 등  명을 구속했다 이로써 세월호 사건 관련 구속자는 모두  명으로 늘어났다 수사본부는 이날 세월호 증축 공사와 관련해 한국선급 본사와 목포지사 한국해양안전설비 등  곳을 압수수색하고 관련자들을 소환 조사했다 수사본부는 자살 소동을 벌인  등기관사 손아무개 씨 등  명도 피의자 신분으로 전환했다고 밝혀 추가 신병처리가 임박했음을 내비쳤다 세월호 운영 업체인 청해진해운과 선주 쪽을 수사하고 있는 인천지검 특별수사팀팀장 김회종은 이날 이 업체의 지주회사와 계열사 임원 등  명을 추가로 출국금지했다 검찰은 청해진해운의 실질적인 소유주로 알려진 유병언  전 세모그룹 회장 일가를 상대로 재산 은닉과 탈세 횡령 재산 국외유출 등의 의혹에 대해 전방위 수사에 나섰다 검찰은 유 전 회장 등의 재산관계 확인을 위해 금융정보분석원에도 관련 자료를 요청했다 한편 침몰 사고  주일을 맞은 이날 밤  시 현재 확인된 사망자는  명으로 집계됐다 민관군 합동구조팀은 이날만  구의 주검을 추가로 수습했다 주검 대부분은 배 뒤쪽  층 객실과  층에 있는 휴식공간에서 발견됐다  층 객실은 단원고 학생들이 머물고 있었던 곳이고  층 휴게공간도 식사를 마친 뒤 휴식을 취하던 학생들이 많이 모였던 장소다 목포노현웅 인천박수혁 진도박승헌 기자  관련영상 한겨레 포커스촛불 시민 아직 끝난 게 아니다 한 아이라도 돌아오길 
