,x
13,한국작가회의 애도 시 릴레이한국작가회의와 는 세월호 참사 피해자와 가족뿐 아니라 지켜보는 모든 이의 슬픔을 달래고 보듬기 위한 노력의 하나로 작가회의 회원들의 시를 연속으로 싣는다이름짓지 못한 시고 은지금 나라초상입니다 얼굴도 모르는 상감마마 승하가 아닙니다 두 눈에 넣어둔 내 새끼들의 꽃 생명이 초록생명이 어이없이 몰살된 바다 밑창에 모두 머리 박고 있어야 할 국민상 중입니다세월호 실종자들의 무사 귀환을 염원하는 노란 리본이 나부끼는 전남 진도군 팽목항 부두에서  일 오후 한 실종자 가족이 빗속에서 흐느끼고 있다 진도김봉규 선임기자  세상에 세상에 이 찬란한 아이들 생때같은 새끼들을 앞세우고 살아갈 세상이 얼마나 몹쓸 살 판입니까 지난 열흘 내내 지난 열며칠 내내 엄마는 넋 놓아 내 새끼 이름을 불러댔습니다 제발 살아있으라고 살아서 연꽃봉오리 심청으로 떠오르라고 아빠는 안절부절 섰다 앉았다 할 따름 저 맹골수도 밤바다에 외쳤습니다 나라의 방방곡곡 슬픔의 한사리로 차올랐습니다 너도나도 쌍주먹 쥔 분노가 치밀었습니다 분노도 아닌 슬픔도 아닌 뒤범벅의 시꺼먼 핏덩어리가 이내 가슴속을 굴렀습니다 나라라니오 이런 나라에서 인간이라는 것 정의라는 것이 얼마나 허약한 것인지 새삼 깨달았습니다 무슨무슨 세계 위는 자살  위의 겉이었습니다 무슨무슨 세계  위는 절망  위의 앞장이었습니다 사회라니오 그 어디에도 함께 사는 골목이 남아있지 않습니다 신뢰라니오 그 어느 비탈에도 서로 믿어 마지않는 오랜 우애가 자취 없어지고 말았습니다흔히 공이 없고 사만 있다 합니다 아닙니다 사도 없습니다 제대로 선 사만이 공을 낳습니다 신성한 사들이 다 썩어문드러진 것입니다 이런 사로 권세를 틀어쥐고 부귀를 꽉 움켜잡고 있는 죽음의 세월입니다 오늘도 저 남녘 앞바다 화면 앞에 있습니다 아무리 땅을 친들 땅을 쳐 피멍들 손바닥뿐인들 내 새끼의 환한 얼굴이 달려올 리 없건만 밤 지새울 멍한 아침바다를 바라봅니다어찌 엄마아빠뿐이겠습니까 이 나라 풀 같은 나무 같은 백성 남녀노소라면 저 과체중의 선체가 기울었을 때부터 하루 내내 실시간의 눈길이 꽂혀왔습니다 그 선체마저 잠겨 겨우 꼬리만 들린 채 나라와 세상살이 갖은 부실 갖은 비리 하나하나 드러내는 통탄의 날들을 보냈습니다이런 역적 같은 이런 강도 같은 참변 앞에서 과연 이 나라가 나라 꼬라지인가 물었습니다 이런 무자비한 야만이 저지른 희생 앞에서 이 사회가 언제나 청정한 하루하루일 것인가를 따졌습니다 인간이 인간에 대하여 얼마나 인간이었던가를 뉘우쳤습니다 영혼이라는 말 양심이라는 말이 왜 있는지 몰라야 했습니다 알아야 했습니다내 새끼야 내 새끼야 내 새끼야 꽃들아 초록들아 이토록 외치는 이 내 심신 차라리 풍덩 내던져 우리 모두 빵영으로 돌아가 다시 하나둘 시작해야 하겠습니다 나도 너도 나라도 무엇도 다시 첫걸음 내디뎌야 하겠습니다 그리하여 이른바 고도성장의 탐욕으로 마비된 것 이른바 무한경쟁으로 미쳐버린 것 이른바 역대권력에 취해버린 것 하나하나 각고로 육탈로 떨쳐내야 하겠습니다 그리하여  인과  인의 향연이 아닌 만인의 영광을 누려야 하겠습니다못 박아야 하겠습니다 이 사태는 올가을이면 내년 봄이면 파묻어버릴 사태가 아닙니다  백년 내내 애도해야 합니다 죽은 꽃들을 그 앳된 초록들을 이 내 피눈물의 새끼들을 망각을 물리치고 불러내야 하겠습니다 허나 지금 아 이 나라는 울음 복 울부짖음 복이 터진 나라입니다 이 나라는 분노의 복이 터진 나라입니다내 새끼야 내 새끼야 내 새끼들아 여객선 세월호 침몰 사고  일째인  일 오후 경기도 안산시 단원구 고잔동 문화광장에서 실종자들의 무사귀환을 바라는 기원문 사이로 촛불이 타오르고 있다   연합뉴스 
14, 세월호 선사인 청해진해운의 실소유주로 알려진 유병언  전 세모그룹 회장 일가의 비리 의혹을 수사하는 인천지검 특별수사팀팀장 김회종은 유 전 회장 자녀와 측근들이 주주로 있는 계열사 사이의 부당거래로 빼돌려진 돈 일부가 유 전 회장 일가 쪽으로 흘러간 정황을 포착한 것으로  일 알려졌다 검찰은 유 전 회장 일가의 자금 상황을 잘 알고 있는 회계사 김아무개씨의 사무실 등을 압수수색한 데 이어 김씨를 조만간 불러 조사할 방침이다 검찰은 유 전 회장의 두 아들이 대주주로 있는 지주회사 아이원아이홀딩스를 정점으로 지분관계가 거미줄처럼 얽혀 있는 계열사들이 회계상 각종 명목으로 거래를 하며 실제보다 금액을 축소해 기재하는 등의 방법으로 돈을 빼돌린 정황을 파악한 것으로 전해졌다 검찰은 이 돈이 복잡하게 세탁돼 유 전 회장 측근들한테 흘러간 것으로 의심하고 유 전 회장 주변에 대한 광범위한 자금추적을 벌이고 있다 검찰은 유 전 회장의 직간접 개입 여부를 입증하는 데 수사력을 모으고 있다 검찰은 지난  일 유 전 회장의 핵심 측근인 고아무개  세모 대표를 불러 유 전 회장이 부당한 내부거래나 비자금 조성을 지시했는지 등을 조사했다 고 대표는 유 전 회장은 일절 관여한 바 없다며 각종 혐의를 전면 부인한 것으로 전해졌다 검찰은 지난  일 청해진해운과 관계사의 회계업무를 담당한 회계사 김씨의 서울 강남 사무실과 자택 등  곳에 대한 압수수색에 나서 회계장부와 금전거래 내역 등을 확보했다 김씨는  년 이상 청해진해운의 회계감사를 맡고 청해진해운의 최대주주인 천해지의 임원을 지내는 등 유 전 회장 일가의 재무관리를 맡아온 인물로 알려졌다 검찰 관계자는 회사 실무진이나 내부 사정을 잘 아는 퇴직자 등을 상대로 조사를 진행하고 있는데 일부 조사 대상자들은 보복 우려 등을 이유로 가명 조사를 원하거나 조사 사실을 비밀로 해달라고 요청하고 있는 상황이라며 조사 대상자 등에 대한 보복이나 위해가 있을 경우 공권력에 대한 정면도전으로 간주하고 끝까지 추적해 엄벌하겠다고 말했다 검찰은 이번주부터 국외에 머물고 있는 주요 계열사 대표와 유 전 회장 자녀 등을 불러 조사할 방침이다 인천김정필 박수혁 기자  
15,주성호 전 국토해양부  차관은 지난해  월 한국해운조합 이사장에 취임했다  차관에서 퇴임한 지 여섯달 만이었다 통상 고위공직자가 퇴임 뒤  년 안에 재취업하려면 퇴직 전  년 동안 맡았던 업무와 관련성이 있는지 공직자윤리위원회의 심사를 받아야 한다 주 차관은 국토해양부에서 중앙해양안전심판원장과 물류항만실장 등 해양 관련 업무를 맡았지만 심사를 받지 않았다 그에 앞서 해운조합의 이사장을 지낸 이인수전 중앙해양안전심판원장 정유섭전 인천지방해양수산청장씨도 마찬가지였다 주 이사장은 최근 사임 의사를 밝혔다 이들은 공직자윤리위 심사의 사각지대에 있었다 정씨만이 퇴직시 공직자윤리위 심사를 받았지만 해운조합 취업이 아닌 주식회사 엠코란 곳에 전무로 취업하면서 심사를 거쳤을 뿐이다 해수부 출신 고위공직자들이 여객선의 안전 운항을 지도 및 감독하는 해운조합에 낙하산을 타고 내려가면서도 심사를 받지 않은 이유는 이 조합이 정부 위탁업무를 수행하고 있어서다 공직자윤리법 시행령엔 정부 위탁사업을 하는 곳에 재취업할 때는 심사를 받지 않아도 된다는 예외조항을 두고 있다 해수부 출신들이 정부를 대행해 선박 검사 등을 하는 비영리법인인 한국선급에 손쉽게 재취업할 때도 마찬가지로 이런 빈틈이 작용했다 이에 따라 정부 위탁 업무를 맡는 비영리 조합이나 협회라 하더라도 이곳에 재취업하려는 퇴직 공무원들은 심사를 받도록 해야 한다는 목소리가 나오고 있다 새누리당 의원들은 사고가 발생한 뒤 지난  일 이런 내용을 담은 공직자윤리법 개정안을 국회에 제출했다 원래 비영리조합이나 협회 재취업이라도 그 업무가 사기업체에 큰 영향을 미치는 경우에는 심사대상이 된다 즉 그 회원이 자본금  억원 이상 등의 요건을 충족한 사기업으로 안전행정부가 관보에 올린  개 년 기준 기업에 해당하면 심사 대상에 해당한다 세월호를 소유한 청해진해운은 퇴직공직자 취업제한 대상 기업이면서 해운조합에 가입돼 있다 따라서 퇴직 공직자가 해운조합에 취업하려면 심사를 받아야 하지만 해운조합이 정부 등으로부터 위탁을 받아 여객선터미널의 관리 및 운영사업을 하면서 공직자윤리위 심사 대상에서 빠져버린 것이다 역대  명의 이사장 가운데  명이 해수부 고위공무원 출신이었지만 아무런 견제 없이 낙하산을 타고 내려온 배경에 이런 공직자 윤리법의 구멍이 존재했다 류이근 기자  
16,세월호 선체 내부 수색이 점점 어려워지고 있다  일에는 수색작업 시작 뒤 처음으로 단  구의 주검도 수습하지 못했을 정도다 전문가들은 시신 유실과 부패 등을 막고 잠수요원들의 안전 확보를 위해 선체를 바로 세우는 작업이 필요하다는 제안을 조심스럽게 내놓기 시작했다 그러나 구조팀은 수색의 어려움은 인정하면서도 선체 세우기는 인양 단계에서 논의할 사안이라고 했다 ■ 좌현 수색 난항  일 범정부 사고대책본부는 민관군 합동구조팀이 창문을 깨고 진입할 수 있는 선체 오른쪽우현 객실의 경우 수색과 주검 수습을 마쳤다고 했다 반면 해저 바닥면에 붙은 좌현 쪽은 사실상 손을 못 대고 있는 실정이다 좌현 쪽 객실에 진입하려면 우현 창문을 통해 선체 내부로 들어간 뒤 매트리스 칸막이 자판기 전선 등 온갖 부유물이 얽힌 통로를 지나가야 한다 선체 폭은   정도지만 구불구불하게 꺾인 통로를 따라가느라 이동 거리는 훨씬 길어진다 게다가 좌현 쪽으로 밀어서 열어야 하는 철문의 경우 장애물 등이 있으면 우현 쪽에서 진입한 잠수요원이 열 수 없는 한계가 있다 이런 가운데 이미 숨진 실종자들의 주검이 유실됐거나 유실될 우려가 커지고 있다  일 기준으로 합동구조팀이 수습한 주검  구 가운데  구가 선체 내부가 아닌 물속에서 발견됐다 선체에서   떠내려간 주검  구를 합동구조팀이 수습하기도 했다 실제  년 서해훼리호 침몰사고 때는 사고 해역에서  ㎞나 떨어진 곳에서도 주검이 발견됐다 해군 관계자는 서해훼리호 사고 때는 사망자  구의 시신을 모두 회수했지만 그때는 천운이 따랐었다 이번에도 시신 유실이 없을 것이라고 단정하기 어렵다고 말했다 ■ 잠수요원 안전 위협 합동구조팀 잠수요원들의 안전 확보도 어려운 상황이다 해저면에 닿아 있는 좌현 쪽은 수심이  에 이른다 사고 초기 수심  에서 작업할 때는 잠수요원들이  분 수중수색을 할 수 있었지만 수심  일 경우 실제 작업 시간은  분 정도밖에 확보할 수 없다고 한다 선체 내부로 진입하는 잠수요원들은 공기통이 아니라 수면 밖에서 공기를 공급하는 머구리 방식을 사용한다 복잡한 선체 내부를 지나다 공기 호스가 꼬이거나 끊길 경우 인명 사고로 이어질 가능성이 높다 이제까지 잠수요원  명이 머리가 찢어지는 등 크고 작은 부상을 당했다고 대책본부는 밝혔다 수심이 깊어지면서 작업 시간을 늘리느라 감압 시간을 확보하지 못한 잠수요원들의 잠수병 증상도 늘고 있다  일은 사리 때로 사고 해역 조류 속도가 최고조에 이를 전망이다 이 때문에 선체 역시 해저면으로 더 내려갈 가능성이 높다 수천의 선체 주변으로 빠른 조류가 형성돼 뻘과 자갈을 쓸고 나가는 세굴 현상이 나타나기 때문이다 ■ 선체 돌려놓기라도 전문가들은 생존자 존재 가능성을 염두에 둔 수색 방식을 일부 변경해야 한다는 제안을 조심스럽게 내놓고 있다 한국해양대 김세원 교수는 선체 구조상 실종자들이 의지할 선내 공기층에어포켓이 남아 있기 어려운 상황이 됐다고 진단했다  년 천안함을 인양했던 정성철  수중개발 대표는 사고 당시 실종자들이 수심  라는 깊은 수심으로 급속히 내려갔다면 생명을 유지하기가 어려웠을 것으로 본다고 했다 이 때문에 좌현 창문으로 진입할 통로 확보를 위한 선체 바로 세우기나 선체 전체를 낮은 수심까지 들어올리는 선체 일부 인양 등의 제안이 나오고 있다 김세원 교수는 수심  까지만이라도 선체를 들어올리면 수색에 큰 도움이 될 것이다 최소한 옆으로 누워 있는 선체를 바로 세우면 좌현 쪽을 수색할 길을 열어줄 수 있다고 했다 정성철 대표도 뻘에 묻혀 있을 좌현 쪽 선체와 주검은 잠수요원들이 꺼내기 어렵다 배가 더 가라앉기 전에 인양으로 전환해야 한다 냉정하게 볼 필요도 있다고 말했다 대책본부 쪽은 조심스럽다 합동구조팀은  일 저녁 브리핑에서 선체를 바로 세우는 것은 현실적으로 어렵고 오히려 시신 훼손의 우려가 있다 선체 세우기는 인양 단계에서나 고려하는 게 적절하다 일단은 모든 방법을 열어두고 수색에 집중하겠다고 했다 한 실종자 가족은 잠수요원들이 구조를 못하는 상황에서 어떤 결정을 해야 할지 모르겠다 인양을 해서라도 하루라도 빨리 주검을 찾아서 돌아가고 싶다고 했다 하지만 사망을 기정사실화하는 선체 인양에 선뜻 동의하기 어려운 게 현실이다 고명석 대책본부 대변인은 선체 인양은 가족과 정부가 협의를 거쳐 결정할 문제다 현재로서는 인양에 대비해 제반 사항을 준비하고 있는 단계라고 말했다 김지훈 기자 진도최우리 서영지 기자  
17,세월호는 청해진해운이 일본에서 수입한 직후인  년  월 전남 영암 ㅆ조선에서 객실 등을 늘리는 증축 공사를 받았다 이 과정에서 애초  명이던 승객 정원은  명으로 늘어났고  이던 선박 무게는  으로 무거워졌다 또 배의 높이가 올라가면서 세월호의 무게중심은 구조 변경 전에 견주어  ㎝가 높아졌다 기울어진 배가 다시 중심을 회복하는 복원력이 떨어진 원인으로 지목된다 당시 세월호의 증축을 맡았던 ㅆ조선은  일 우리는 설계도면에 따라 세월호를 수리개조만 했다 안전성 여부는 한국선급에서 판단한다고 밝혔다 자신들은 한국선급의 심사를 통과한 도면대로 단순 공사만 진행했을 뿐 안전성 여부를 판단할 위치에 있지 않았다는 것이다 회사 자료를 보면 세월호는  년  월 일 ㅆ조선의 플로팅도크에 올려진 뒤  개월 남짓이 지난 이듬해  월 일 수리를 마쳤다 이 회사는 세월호 증축 작업을 맡기 전까지는 이런 대형 여객선을 증축개조한 경험이 없는 것으로 알려졌다  년 설립된 ㅆ조선은 선박 수리와 선박 해체를 전문으로 한다 ㅆ조선 총무관리부 관계자는 세월호의 길이가  에 달해 그만한 대형 선박을 띄울 수 있는 플로팅도크를 보유하고 있는 회사가 당시 국내에 몇 군데 안 됐다 그래서 그 공사를 우리가 맡은 것이라고 말했다 이 업체는 세월호의 쌍둥이배로 알려진 청해진해운의 오하마나호의 수리도 담당했다 오하마나호는 ㅆ조선 플로팅도크에서  년  월 일에서  월 일까지 수리를 받았다 ㅆ조선은 세월호의 침몰 원인으로 지적되는 무리한 증축을 사전에 전혀 몰랐다고 주장했다 선사가 가져오는 증축수리 설계도면은 한국선급에서 이미 승인을 받은 것이기 때문에 안전성에 대해서는 의심할 여지가 없다는 것이다 ㅆ조선 쪽은 선박 복원성 검사 등 전문적인 분야는 우리가 자체적으로 할 여력이 없다 선박설계가 워낙 전문적이고 복잡한 분야라 도면을 보고 안전성 여부를 판단하기는 어렵다고 했다 업체 관계자는 다만 우리 회사 플로팅도크에서 한국선급의 안전 검사가 이뤄졌을 뿐이라고 했다 선박의 안전 상태를 확인하고 검사하는 업무는 해양수산부 장관의 위임을 받아 한국선급에서 맡고 있다 세월호가 증축 공사를 받은 뒤 한국선급은 복원성 데이터 등에 이상이 없다며 합격 판정을 내린 바 있다 목포이재욱 기자  
18,해양수산부가 세월호 사고와 관련해 뒷북 정책을 잇따라 내놓고 있다 해수부는 이번 사고가 제도 미비보다는 주무부처의 책임인 관리감독 부실과 관련이 있는 것으로 드러나는데도 자신들의 책임과 관련된 부분은 건너뛰는 행태를 보이고 있다 해수부는  일 연안여객선에도 블랙박스 탑재를 의무화하겠다고 밝혔다 그동안 국제선 여객선과   이상 화물선에만 비행기의 블랙박스와 비슷한 항해자료기록장치를 탑재하도록 했는데 앞으로는 연안여객선에도 적용하겠다는 것이다 세월호는  의 여객선이지만 이런 장치가 없어 사고 원인 규명에 한계가 있다는 지적이 일었다 해수부는 또 여객선 정원을 늘리기 위한 구조 변경 금지를 추진할 계획이라고 발표했다 아울러 개조 시 지방해양항만청의 허가를 받아야 하는 사항도 인테리어 공사 등 일부만 빼고 일체의 선체 부속시설까지로 확대하기로 했다 지금은 본체 길이너비깊이 및 선박 용도 변경에 관해서만 허가받도록 돼 있다 여객선 안전 관리 업무도 한국해운조합에서 떼내기로 했다 운항 안전 관리 책임을 지는 운항관리자를 여객선사들의 이익단체인 해운조합이 채용하기 때문에 제구실을 하지 못한다는 지적에 따른 것이다 해수부는 아울러 여객선 승선 절차도 항공 수준으로 확 바꾸기로 했다고 밝혔다  월 일부터 선원을 제외한 모든 탑승자에 대해 전산발권성명성별생년월일연락처 등 입력을 실시하고 탑승자의 신원을 철저히 확인하겠다는 것이다  월 일부터는 차량과 화물에 대한 전산발권도 도입하기로 했다 또 운항관리자가 출항 전 선장 등과 과적 화물 고정 상태 무단 승선자 확인을 집중적으로 하게 만들겠다고 밝혔다 해수부 관계자는 해수부 마피아 책임론이 거론되는 마당에 인적 조치도 고려는 하고 있으나 이는 사태 수습 뒤 이뤄질 일이라고 말했다 김경무 선임기자   
19,전국  개 광역 시도에 세월호 참사 희생자들을 기리는 합동분향소가 설치된다 안전행정부안행부는 경기 안산인천 이외의 지역에도  일부터 분향소를 설치할 수 있도록 하는 내용의 지침을  일 오후 전국 광역자치단체에 보냈다고  일 밝혔다 앞서 안행부는 합동분향소를 설치해달라는 시민들의 요구가 전국적으로 확산되자 지난  일 정홍원 국무총리가 전국에 합동분향소를 차려 희생자들을 추모하도록 지시했는데도 아직은 때가 아니다라는 주장만 반복해왔다 안행부의 지침 내용을 보면  일부터 합동영결식 당일까지  개 시도청 청사 안에 합동분향소를 운영하고 불가피할 경우에는 인근 공공기관의 실내 공간을 활용하라고 돼 있다 서울시 관계자는 지침은 지자체별 혼란을 막기 위한 가이드라인일 뿐이지 반드시 지켜야 하는 법적 근거가 있는 것은 아니다라고 설명했다 서울시는  일 오후  시부터 서울광장 서울도서관옛 서울시청사 앞에 합동분향소를 운영 중이다 경기도 수원부천남양주시 울산 북동구 전남 목포시 등 일부 지역에서는 안행부 지침이 나오기 전부터 분향소를 설치해 운영하고 있다 음성원 기자  
