,x
35,서울엔 박주영과 쌍용 기성용 이청용이 있었다 수원 삼성엔 안정환과 김남일 송종국이 있었다 양팀 골문은 김병지서울와 이운재삼성가 지켰다 불과  년 전의 일이다 사람들은 두 팀의 맞대결을 슈퍼매치라 불렀다  년 국제축구연맹은 반드시 봐야 할 세계  대 더비 중 두 팀의 대결을 일곱번째로 꼽았다 슈퍼매치의 또다른 주인공은 축구팬이었다 프로야구의 인기와  년대 말 경제 위기로 리그는 부침을 거듭했으나 슈퍼매치는 건재했다 경기 내용도 흥미로웠지만 관중수는 또다른 관심거리였다  년  월 일 그해 두번째 슈퍼매치가 열린 서울월드컵경기장엔  만 명의 관중이 몰렸다 이후 관중은 조금씩 줄었지만  년까지 평균 관중은  만명을 거뜬히 넘었다 지난해부터 슈퍼매치의 명성도 시들기 시작했다 서울과 수원의 전력이 약해진 게 가장 큰 원인이다 과거처럼 라이벌 구도를 형성할 스타 선수들도 없다 지난해 네번의 맞대결에 찾아온 평균 관중은  만 명 올 시즌 첫 슈퍼매치가 열린  일 수원월드컵경기장엔  만 명의 팬이 찾았다 오전부터 비가 내렸고 세월호 참사 때문에 적극적인 홍보행사나 이벤트도 열 수 없었던 점을 고려하면 적지 않은 숫자였다 가장 최근인 지난해  월 맞대결을 찾은 관중은  만 명이었다  만명 가까운 관중이 몰렸지만 한 골밖에 터지지 않은 게 아쉬웠다 양쪽 선수들은 마치 리그 최종전처럼 몸을 날렸고 거친 태클도 나왔다 세밀함은 부족했다 특히 최근  경기 연속 무패로 기세가 오른 안방팀 수원의 공격이 아쉬웠다 최전방 정대세의 발에 걸리는 패스가 좀처럼 나오지 않았고 양쪽 측면에서 올리는 크로스의 정확성은 떨어졌다 중국 리그로 간 데얀과 하대성의 공백으로 해결사가 없는 서울의 공격도 답답하긴 매한가지였다 수원은 후반  분 역습으로 서울 에스쿠데로에게 골을 내준 뒤부터 공격수를 늘리며 만회를 노렸으나 끝내 서울의  백 라인을 뚫지 못했다 서울은 이날 승리로  년  월 이후 이어온 수원 경기 무승 악몽 무 패을 떨쳐냈다 포항 스틸러스는 안방에서 인천 유나이티드에   승리를 거뒀다  연승을 거둔 포항은 승점  가 돼 전북 현대승점  를 끌어내리고 다시 선두로 올라섰다 최하위 인천은 개막 뒤  경기째 승리를 거두지 못했고 연속 경기 무득점 기록을  경기로 늘렸다 수원박현철 기자  
36,사회적경제기본법 제정이 급물살을 타고 있다 연초부터 적극적인 의지를 보였던 새누리당 사회적 경제 특별위원회특위는 지난  일 법률안을 마련해 공청회를 열었다 특위가 꾸려진 지 석달여 만에 법률안이 세상에 나왔다 일찍이 사회적경제기업 구매촉진 및 판로지원에 관한 특별법을 발의해 놓은 새정치민주연합에서도 공동발의나 별도발의를 고려하고 있다 여야가 협력해 공동의 목표를 향해 같이 나아가는 새로운 이정표가 될 것으로 기대가 모아진다 그런데 정작 사회적 기업 협동조합 마을기업 자활기업 등 사회적 경제 조직 간에 사회적경제기본법안 내용이나 제정 시기와 속도에 대한 이견들이 적잖이 있다 사회적 경제가 지속 가능하게 커가기 위해 긴 안목으로 보고 뜻을 모았으면 한다 우선 정부의 역할에 대해 지나친 기대보다는 사회적 경제의 연대와 협력을 돕는 데 방점을 찍었으면 한다 흔히 주류 경제에 있는 사람들은 사회적 경제가 글로벌 시장경제에서 경쟁력이 있는지 의문을 던진다 사실 개별 사회적 경제 조직을 보면 이런 우려는 있을 법하다 하지만 이들이 가치와 비전을 공유하고 부족한 물적 인적 자원을 연대와 협력으로 보완하면 상당한 경쟁력을 갖출 수 있게 된다 이탈리아 프랑스 영국 등 유럽 사회적 경제 조직의 경우에도 이러한 사실을 확인할 수 있다 이들 나라에서는 기존의 전통적인 사회적 경제 조직인 농협 신협 등과 후발 사회적 경제 조직인 사회적 기업 협동조합 사이의 사업적 협력이 활발하게 이뤄지고 있다 따라서 사회적경제기본법에서는 사회적 경제 조직의 상호연대를 돕는 제도적 환경을 만드는 데 초점을 뒀으면 한다 사실 연대와 협력은 사회적 경제 조직에서도 가장 어려운 지점이다 당장 활발하게 실행으로 이어지지는 않을 것이다 하지만 적어도 안성 원주나 전북처럼 농협 신협 등과 협동조합 마을기업 사회적 기업이 서로 협력을 시도하고 있는 곳에서 성과를 내는 기반은 될 수 있다 여기서 성공의 경험이 쌓이면 앞으로 더 많은 협력과 연대의 사례가 이어질 수 있다 이런 연대와 협력이 사회적 경제 조직의 경쟁력이 될 수 있고 지속가능성의 근간이 될 것이다 정부 부처 통합 문제는 사회적 경제 조직이 성장 단계에서 다양한 경로를 선택할 수 있도록 총괄기관을 두는 데 의미가 있다 예컨대 마을기업으로 창업한 사회적 경제 조직이  년 뒤 예비 사회적 기업이나 협동조합으로 전환할 경우 현재의 부처간 칸막이는 이를 어렵게 하는 측면이 있다 현재 사회적 경제 조직 관련 업무는 고용노동부사회적 기업 안전행정부마을기업 기획재정부협동조합 보건복지부자활기업 농림축산식품부농어촌공동체회사로 나눠져 있다 또한 정부정책에서 사회적 경제 조직이 경제조직으로 인정받아 금융 조달 세제 연구개발 창업보육 등의 지원에서 차별받지 않도록 하는 것도 중요하다 이런 맥락에서 기획재정부가 정책조정총괄 업무를 맡는 것은 경과 조치로 접근했으면 한다 향후 별도의 처나 청 또는 상설자문위원회로 진화해야 할 것이다 사회적 경제는 기존 자유시장경제와 자본주의의 한계를 극복하는 대안이다 경쟁과 효율 중심의 경제가 어떤 괴물을 낳을 수 있는지 이번 세월호 참사에서 우리는 똑똑히 확인할 수 있었다 돈만 중시하는 경제로는 우리 사회의 안전과 행복을 담보할 수 없다 탐욕 대신 이타심 상호성 협동 사회적 목적 같은 동기가 지배하는 경제조직을 만들고 제도화해야 한다 이런 점에서 사회적경제기본법 제정은 의미 있는 출발이다 사회적경제기본법 제정을 늦추지 말아야 할 이유이기도 하다 이현숙 한겨레경제연구소장  
37,대학원 학생들과 낮은 출산율을 화제로 이야기를 나누다 깜짝 놀란 적이 있다 한 여학생이 자기도 아이를 낳지 않을 것이라고 선언하자 같이 있던 네 명의 여학생들도 모두 고개를 끄덕이며 동의하는 게 아닌가 끝없이 경쟁을 강요하는 이 교육지옥 속으로 아이들을 떠밀어 넣을 자신이 없다는 것이 한결같은 이유였다 십대 시절 행복했던 기억이 별로 없다는 말도 모두 같았다 세월호 사고로 희생된 학생들을 보면서 왜 이 대화가 맨 먼저 떠올랐을까 행복했던 기억이 없는 지옥 속에서 살다가 이제 차갑고 어두운 바닷속에서 죽어간 아이들이 너무도 안쓰럽다 이런 세상을 만들어놓은 우리 어른들의 죄는 도대체 어떻게 혜량할 것인가 세월호 참사로 숨져간 아이들을 진심으로 애도한다면 우리가 반드시 해야 할 일이 하나 있다 그 아이들이 소망했으나 한 번도 살아보지 못한 삶을 이제부터라도 우리 청소년들이 살도록 해주는 것이다 행복한 십대를 돌려주는 것이다 그러려면 우선 교육부터 바꿔야 한다 우리 십대들을 가장 불행하게 하는 것이 바로 우리나라의 잘못된 교육이기 때문이다 본래 교육이란 학생의 잠재력을 밖으로 끌어내는 것이다 사회적 요구를 일방적으로 쑤셔넣는 우리네 교육은 기실 반교육에 가깝다 게다가 그 교육의 결과가 사회적 차별의 근거가 된다는 점에서 반사회적이기까지 하다 이렇게 반교육적이고 반사회적인 교육풍토 속에서 우리 학생들은 세계에서 가장 불행하고 우울한 학창시절을 보내고 있다 획일화된 학습과 평가 시스템 속에서 개성과 창의성을 잃어가고 있고 우정과 사랑의 감성은 사라지고 경쟁과 대결의 논리만이 지배하는 살벌한 정글 같은 교실에서 절망과 불안을 내면화하고 있다 학생들은 오로지 공부만 하는 학습기계로 전락하였고 정규수업 이외에도 학원 과외 야자로 이어지는 엄청난 학습노동은 그 시간과 강도에서 인권유린의 수준을 넘어선 지 오래다 이제 우리 아이들을 모든 어른들이 공모하여 처박아 넣은 이 끔찍한 노예상태에서 해방시켜야 한다 이제 어른들은 노예감독관 노릇을 그만두어야 한다 이제 우리 아이들을 행복한 자유인으로 키워야 한다 우리 아이들도 행복할 권리가 있다 그들도 다른 나라 아이들처럼 자유롭게 연애도 하고 맘껏 독서도 하고 연극이나 영화도 보고 박물관이나 미술관에도 가고 방학 때는 여기저기 여행도 다니면서 그렇게 자신의 고유한 삶을 향유해야 한다 그렇게 인간적인 품성을 키우고 시민적인 자질을 높여야 한다 자신의 개성과 천재를 발견할 여유를 가져야 한다 미래가 아무리 장밋빛이라 해도 삶은 한순간도 유예될 수 없다 우리 아이들을 행복한 자유인으로 키우는 것은 결코 불가능한 꿈이 아니다 우리가 사는 이 유라시아 대륙의 반대편에서는 그것이 상식이요 일상이다 의지만 있으면 우리도 할 수 있다 저 침몰하는 배 안에서 가만히 있으라고 말하던 어른들이 우리 아이들을 죽음으로 내몰았듯이 이런 부조리한 교육 불합리한 세상을 묵인하는 우리들은 어쩌면 이 땅 위에서 매일매일 조금씩 우리 아이들을 죽여가고 있는지도 모른다 세월호의 아이들이 갈망했을 그런 세상을 이제 우리 어른들이 열어주어야 한다 이 시대착오적인 노예상태에서 아이들을 해방시켜 그들의 얼굴에 다시 행복한 미소가 피어나도록 해야 한다 더러운 대한민국 이렇게 부끄러운 적이 없었다 언니 오빠 두 번 다시 이런 나라에 태어나지 마세요라는 저 아이들의 분노와 저주의 외침을 또다시 들어선 안 된다 김누리 중앙대 교수 독문학 
38,세월호 사건을 보면서 안타까운 것이 하나둘이 아니다 선장과 선원이 자기 도생圖生을 위해 수많은 젊은이들을 희생시킨 것은 말할 것도 없고 정부가 운영하는 시설과 기구들은 왜 제대로 작동하지 않았는지 지지부진한 초기 대응은 어떤 변명으로도 곧이들리지 않는다 막대한 예산으로 군대를 유지하는 것이나 숱한 방재시설과 기구를 설치한 것도 한순간의 위난에 대처하기 위함인데 그게 작동하지 않았으니 국가시스템이 붕괴되고 있다는 우려의 소리가 예사롭게 들리지 않는다 모두 책임을 망각한 데서 나온 결과다 그런 속에서도  살의 선원 박지영과 단원고 강아무개 교감은 우리 사회의 상실된 책임의식을 일깨워준다 어린 승객들에게 퇴선명령을 내리면서 선원들은 맨 마지막이다 너희들 다 구하고 난 나중에 나갈게라는 말을 남기고 산화한 그녀는 진정 영웅이었다  명의 생사를 알 수 없는데 혼자 살기에 힘이 벅차다 내게 모든 책임을 지게 해 달라며 자신의 유해를 침몰지역에 뿌려달라고 한 그는 온갖 비난의 대상이 되고 있는 교육계에 책임지는 스승상을 보여주었다 두 분이 있었기에 타이타닉호 선장 에드워드 스미스 같은 영웅이 없어 부끄러워하는 대한민국이 겨우 체면을 세웠다 한나라새누리 정권에서 책임지는 모습을 본 지는 오래됐다 천안함 폭침이 있었을 때  여명의 꽃다운 젊은이들이 희생되었는데도 책임진 상관이 있었는가 폭침이 북한에 의한 것이라는 결론이라면 국방상 중대한 구멍이 뚫린 것이고 이는 일벌백계로 다스려야 하는 안보 문제다 그럼에도 군사상 책임을 묻지 못했다 아니 묻지 않았다 폭침 이외의 어떤 주장도 용납될 수 없다면 먼저 피침被侵에 대해 왜 책임을 묻지 않았는가 해명해야 한다 폭침 문제를 인사청문회장으로 끌고 와 사상검증용으로 활용하기 전에 서해안 방위 책임자를 청문회장에 세우는 것이 순서 아닌가 얼마 전의 무인기 사건도 마찬가지다 방공망이 뚫린 것이 사실이라면 호들갑을 떨기 전에 그 책임자의 목부터 치고 국민을 설득해야 한다 이 사건들의 책임 추궁이 몇년 전 동해안 노크 귀순 사건에서 줄줄이 옷을 벗게 한 것과는 판이한 대조를 이루었다 왜 그런가 간첩 증거 조작에 대한 국정원장의 무책임한  분 사과를 떠올리는 것은 창피스럽다 당일 오전과 오후 두 차례의 대국민 사과를 보면서 마치 동네 싸움에서 내몰린 애가 갑자기 나타난 엄마 뒤에 숨어서 호가호위하는 듯한 느낌을 받았다 순서로 봐서도 국정원장의 사과가 먼저 아닌가 바뀐 순서로 그 위계질서마저 모호하게 느꼈다면 그 책임은 누가 져야 하나 최근의 그는 한때 자랑스러운 군복에 때를 묻힐 수 없다며   쿠데타의 전두환을 강하게 비판했다가 진급심사에서 불이익을 당했다는 명예를 중시하는 인품을 가진 사람으로는 도저히 보이지 않는다 국정원의 명예를 위한다면서 정상회담 비망록을 공개해 국가를 망신시키고 그러고도 물러나지 않는 모습은 그가 명예를 생명같이 여기는 대한민국 육군을 책임졌던 분이라고 도저히 믿을 수 없다 세월호 참사와 관련해 공직자의 책임 문제도 크게 부각되고 있다  일 총리가 사의를 밝힌 것은 당연하다 외국 순방에서 돌아온 총리가 아예 현장으로 직행해 사태 수습을 진두지휘하는 모습은 상찬하고 싶지만 사태 발생 뒤 열흘이 넘은 시점이라는 점에서 아쉬움이 더 크다 공황에 빠진 국민에 대한 예의를 생각한다면 처음부터 사의를 표명해야 했고 다른 장관들도 함께 행동해야 했다 대한민국호의 선장이 물러나야 할 판에 선원들이 자리를 지키는 것은 또 무슨 희극인가 이만열 전 국사편찬위원회 위원장 
39,고은 시인의 시구대로 지금 온 나라가 상중이다 수백명의 어린 생명들을 눈앞에서 잃어버렸다 가슴을 치며 통곡해도 바다는 단 하나의 목숨도 돌려주지 않는다 나라가 어디로 갔는지 알 수 없을 정도로 세월호 침몰 이래 지금껏 정부는 허둥지둥 우왕좌왕 갈팡질팡이었다 희생자실종자 가족들의 고통은 몇 배로 커졌고 피가 말라붙는 그들의 아픔은 온 국민의 아픔이 됐다 시민들은 서로 모여 슬픔을 함께한다 전남 진도 팽목항과 경기 안산엔 자원봉사자들이 줄을 잇고 희생자 합동분향소엔 추모객의 발길이 끊이지 않는다 희생자실종자 가족들이 절망에 꺾이지 않도록 작은 힘이라도 모아 서로 돕는 모습에서 어둠 속 희망을 본다 인터넷과 트위터는 노란 리본으로 넘실거린다 시민들의 자발적 참여로 이루어진 노란 리본 달기에는 기적을 바라는 모든 이의 마음이 담겼다 노란 리본 캠페인은 전쟁터에 나간 사람의 무사귀환을 바라며 노란 리본을 나무에 매단 데서 유래했다고 한다 지금 노란 리본은 단 한 사람이라도 살아 돌아와 주기를 바라는 온 국민의 간절한 기도를 상징한다 돌아와주렴 돌아와주렴 제발 우리 품으로 돌아오렴 노란 리본 캠페인에 동참하여 남긴 인터넷 글들은 세월호 참사의 고통을 서로 감싸안으려는 시민들의 마음을 그대로 보여준다 많은 학생을 참사로 잃어버린 안산에는 임시 합동분향소가 설치된 뒤로 조문객이 밀려들고 있다 분향소 설치 사흘 만인  일 오후  만명을 넘었다고 한다 잠깐의 헌화와 묵념을 위해 수없이 많은 사람들이  ㎞가 넘는 긴 행렬을 이루어 몇 시간씩 기다린다 슬픔을 함께할 수 있다면 한두 시간씩 서서 기다리는 일쯤은 조금도 힘들지 않다는 마음들이다 시민들의 조문을 돕는 사람도 조문객과 같은 마음으로 찾아온 자원봉사자들이다 이웃의 깊은 슬픔을 위로하는 이 조문행렬 봉사행렬에서 성숙해져 가는 우리 사회 시민의식을 본다 슬픔을 안고만 있으면 병이 된다 시민들이 슬픔을 표출하고 서로를 위로할 수 있도록 돕는 것이 정부가 해야 할 일이다 정홍원 총리는 지난  일 전국에 합동분향소를 설치하라고 지시했다는데 안전행정부는  일에야 전국 지자체에 분향소 설치 지침을 내렸다고 한다 미리 서두른 서울시는  일 오후부터 서울광장에 분향소를 차렸지만 다른 광역 시도에는  일에야 분향소가 설치된다고 한다 정부가 시민의 추모 열기 확산을 막으려고 일부러 늑장을 부린다는 말까지 나오는 상황이다 정부는 이제라도 시민들의 마음을 잘 헤아려 불필요한 의구심을 씻어내기 바란다 
40,정홍원 국무총리가 세월호 침몰사고에 대한 책임을 지고 사의를 표명했다 정 총리가 사고예방과 초동대처 수습과정의 문제점 등에 대한 정부의 책임을 인정하고 사과한 것은 당연하다 하지만 수색구조 작업이 한창 진행중이다 아직 어둡고 차가운 바닷속에 남아 있을  명이 넘는 학생들의 생사조차 모르는 판이다 이런 상황에서 총리가 덜컥 사의 표명부터 한 것은 무책임하다는 지적을 피하기 어렵다 배 안에 갇힌 사람들을 눈앞에 두고서도 단  명도 구조하지 못한 정부이니 그 무능함에 대해선 더 언급할 필요조차 없을 것이다 그렇지만 총리와 장관들이 당장 사퇴하라는 게 여론의 핵심 요구는 아니었다 야당도 총리 등의 퇴진을 요구한 바 없다 정부의 책임이 없어서가 아니라 지금은 사고 수습에 최우선 순위를 둬야 할 상황이기 때문이다 청와대가 사퇴 수리 시기를 사고 수습 이후로 미룬 만큼 정 총리는 마지막  명의 생사가 확인될 때까지 수색과 구조에 전력투구하라는 국민의 명령을 실행해야 할 것이다 정 총리는 제가 자리를 지킴으로써 국정운영에 부담을 줄 수 없다는 생각에 사퇴할 것을 결심했다고 밝혔다 박근혜 대통령 손에 국면전환용 카드를 쥐여주기 위해 사퇴를 결행했다고 실토한 셈이다 이 상황에서도 사고 수습이나 국민 안위보다 대통령의 부담을 먼저 헤아리는 총리의 그 충정이 참으로 놀랍다 청와대와 조율한 기자회견이라고 하니 정 총리의 사퇴는 청와대의 사전 각본에 따른 것이라고 볼 수 있다 청와대가 대통령 쪽으로 향하는 비판 여론의 화살을 차단할 목적으로 총리 사퇴 카드를 기획한 게 아닌가 하는 의구심을 떨칠 수 없다 정 총리의 거취 표명이 박 대통령을 책임론의 불길에서 보호하기 위한 방탄용 사퇴가 돼선 안 된다 사실이라면 국민이 저급한 정치쇼를 용납하지 않을 것이다 남을 탓할 생각은 없습니다 그 까닭은 제가 최종 책임자이기 때문입니다 안전 시스템이 작동하지 않는다면 책임은 제게 있습니다 버락 오바마 미국 대통령은  년  월 일 성탄절 항공기 테러미수 사건 관련 대국민 연설에서 이렇게 말했다 박 대통령은 이와 너무도 대조적인 태도를 보이고 있다 우리 국민은 지금껏 대통령으로부터 그 흔한 책임 통감 한마디 듣지 못하고 있다 송구하다는 사과의 말도 부덕의 소치란 의례적 수사도 대통령의 입에선 흘러나오지 않고 있다 그 대신 선장을 살인자로 낙인찍고 관료들의 책임을 질책하는 목소리만이 준엄했을 뿐이다 책임회피 리더십이란 측면에서 박 대통령과 도마뱀 꼬리 자르듯  차장을 사퇴시키고 자리를 보전한 남재준 국정원장은 너무도 닮았다 국민의 마음에 깊은 상처를 남긴 이번 사건은 총리의 대리사과나 대리사퇴로 끝날 일이 아니다 헌법상 행정부 수반이자 국정의 최고 책임자인 대통령의 몫은 따로 있다 대통령이 끝내 책임을 외면한다면 세월호 선장과 박 대통령의 태도에 무슨 차이가 있느냐는 세간의 여론은 더욱 높아갈 것이다 
41,사람들이 자신의 편견에 아첨하지 않는 신문은 사서 보지도 않는다 따라서 그들이 얻는 지식이라고는 자신의 편견과 격정을 확증해주는 지식뿐이다 버트런드 러셀이 이렇게 혀를 찼던 건  년이었다 정보의 편식이 사안의 온당한 처리를 가로막는다는 경고였다 러셀은 이 문제를 민주주의의 난제 중 하나로 꼽았다 정보의 편식으로 치자면 요즘이 그때보다 훨씬 더할 거다 원하는 정보만 쏙쏙 골라주는 세상이니 말이다 페이스북과 구글 등은 개인의 취향과 관심사는 물론 정치 성향까지 꼼꼼히 분석해 맞춤형 정보를 제공한다 맞춤 정보 서비스에 개인의 생각이 제한되는 현상을 일라이 패리서는 필터버블 이라고 이름붙였다 필터버블에 의해 사람들은 점점 편협한 정보의 울타리에 갇히게 된다 필터버블 방지용 서비스도 있다 익명 검색엔진 덕덕고다 덕덕고는 개인의 검색 정보를 저장하지 않는다 생각을 거르는 필터가 없는 셈이다 에드워드 스노든이 미국 국가안보국의 정보수집과 감시 행태를 폭로한 이후 덕덕고 이용자가  배로 급증했다고 한다 일간베스트 저장소 디시인사이드 트위터 등에 올라온 세월호 관련 악성 게시글  건에 대해 방송통신심의위원회가 삭제 등 제재를 결정했다 그래도 디지털 공간에서 세월호 침몰사고를 비틀고 비방하는 글이 넘쳐난다 이런 글에 대한 수요가 있다는 얘기다 디지털 세상은 더는 자유로운 소통의 공간이 아니다 오히려 끼리끼리 뭉치는 인간의 습성을 더욱 자극한다 성향이 비슷한 사람을 추천해주는 데서 그치지 않는다 싫은 소리 하는 사람은 관계망에서 차단해버리면 그만이다 반대쪽 목소리 다른 생각들과 조우하는 불편함을 감수하지 않을 때 토론과 소통은 요원해진다 역지사지해볼 일이다 정보의 편식이 편견의 확대로 이어져 민주주의가 위협받는다는 러셀의 경고는 아직 유통기한이 지나지 않았나 보다 임석규 논설위원  
