,x
34, 통합진보당 이정희 대표가 일 진도 여객선 세월호 침몰 사고를 언급하며 박근혜 대통령은 직을 걸고 구조와 수습을 책임져야 한다고 밝혔다 이 대표는 이날 오전 국회에서 기자회견을 열고 이 사건을 실질적으로 책임질 사람이 이제 대통령밖에 남지 않았다면서 이같이 말했다 이어 청와대는 구조를 위한 특단의 대책은 내놓지 않고 총리 사의 표명이니 추후 수리니 국민의 용서도 받을 수 없고 신뢰도 얻을 수 없는 일만 되풀이하고 있다며 이 엄청난 일을 맞고도 국민의 울분에 공명하지 않고 절박한 요구도 무시한 채 그저 습관대로 움직이는 정치권의 행보가 다시금 놀랍다고 했다 또한 중앙재난대책본부도 장관도 어떤 실질적인 대책도 내지 못한다는 것을 우리 국민 모두가 다 보았다며 이것이 박근혜 정부의 실상이다 대통령이 직을 걸고 나서라 반드시 아이들을 찾아내 부모님들의 가슴에 안겨주기 바란다고 했다 이 대표는 이어 무능 내각은 총사퇴하고 거국중립내각을 구성해야 한다고 언급했다 또 침몰 후 이틀 동안 구조에 손도 안 댄 무능 정부를 만든 것은 공직사회가 오직 대통령 입만 바라보게 한 여왕통치 공포정치 때문이라며 여왕통치의 산실 청와대 비서진을 완전 개편해야 한다 공포정치의 본산 남재준 국정원장을 파면해야 한다고 주장했다 또한 국회는 이 사건의 철저한 진상규명을 위한 국정조사권을 발동해야 한다며 여야가 진상 규명 없이 선박 안전 관련 법안 몇 건 합의 통과시켜놓고 유야무야해서는 정치불신이 극에 달하게 될 것이라고 말했다 
35, 일 세월호 침몰 사고의 책임을 지고 사의를 표명한 정홍원 국무총리는 후임 총리가 임명될 때까지 이번 사건 수습 등 국정을 맡게 된다 그가 처음 사의를 밝힌 것은 세월호 침몰 다음 날인 지난 일이다 정 총리는 일 박 일간의 중국파키스탄 순방을 마치고 돌아오는 비행기 안에서 세월호 침몰 소식을 들었다 정 총리는 당초 서울로 향하던 기수機首를 전남 무안공항으로 돌려 실종자 가족들이 모여 있는 진도 실내체육관을 방문했다 그는 물병 세례를 받고 눈두덩과 팔목을 다쳤다 총리실 관계자는 실종자 가족들이 격앙돼 있는 만큼 불미스러운 일이 발생할 수 있다고 보고했지만 총리가 그래도 가야 한다고 했다고 전했다 정 총리는 일 새벽 시쯤 상경한 뒤 핵심 측근과 청와대에 내가 그만둘 수밖에 없다는 뜻을 밝힌 것으로 전해졌다 정 총리는 그 뒤 범정부 사고대책본부를 구성 진도군청에 머무르면서 사고 수습을 지휘했다 정부 관계자는 정 총리가 최근 두 번째로 내가 가급적 빨리 사퇴하는 것이 좋겠다는 뜻을 밝혔으나 청와대 측에서 우선 수습에 전념하는 게 필요하다는 입장을 보인 것으로 안다고 했다 청와대는 차 구조작업이 어느 정도 마무리된 일 정 총리가 사의 표명을 할 시기가 온 것으로 판단한 것으로 전해졌다 정 총리는 이날 기자회견에서 진작 책임을 지고 물러나고자 했으나 우선은 하루빨리 사고 수습과 함께 대책을 마련하는 것이 책임 있는 자세라고 생각했다면서 그러나 이제 더 이상 제가 자리를 지킴으로써 국정 운영에 부담을 줄 수 없다는 생각에 사퇴를 결심했다고 말했다 이어 이번 사고를 보면서 우리 사회 곳곳에 오랫동안 이어져 온 다양한 비리와 잘못된 관행들이 너무도 많다는 사실을 뼈저리게 느꼈다며 이번에는 반드시 그런 적폐들이 시정돼 더 이상 이런 사고가 발생하지 않길 바라는 마음이라고 말했다 정부 관계자는 정 총리가 책임 총리로서의 역할을 못 했다는 지적도 있지만 그 나름대로 성실하게 일해왔다면서 정 총리가 귀국하자마자 현장에 가서 실종자 가족들의 심기를 어느 정도 달랬기 때문에 박근혜 대통령도 일 유가족들과 만날 수 있었던 것 아니었겠는가라고 말했다 
36, 세월호 선사船社인 청해진해운의 실소유주 유병언 전 세모 회장 일가의 외환거래 내역을 검찰과 사정 당국이 집중적으로 파헤치고 있는 이유는 유 전 회장 일가가 외화 밀반출을 통해 재산을 해외로 빼돌리고 비자금을 조성했을 가능성이 크기 때문이다 ◇검찰 억원대 유병언 일가 외환거래 전방위 조사 유 전 회장 일가가 당국에 신고하지 않고 외화를 반출해 설립한 것으로 확인된 세모 캘리포니아아해 프레스 프랑스 외에 유병언유대균장남 부자와 관련 계열사 곳이 년 이후 해외로 송금한 금액은 억만달러약 억원에 이르는 것으로 검찰은 파악하고 있다 유 전 회장 일가는 송금 목적을 무역용역 거래 등의 명목으로 당국에 신고했지만 검찰은 송금 과정에서 불법이 개입됐을 가능성이 있다고 보고 국세청관세청금융 당국 등과 함께 자금 흐름을 쫓고 있다 검찰은 유 전 회장 일가가 해외로 송금한 억만달러 가운데 청해진해운의 최대 주주인 선박회사 천해지와 유 전 회장의 큰딸 섬나씨가 운영하는 모래알디자인이 아해프레스 등에 수입 대금으로 송금한 만달러약 억원가 포함된 점을 특히 주목하고 있다 이 자금이 유 전 회장이 촬영한 사진 여장 매입 대금 명목으로 지급되는 등 비자금 조성 통로로 활용됐을 가능성이 있기 때문이다 모래알디자인은 유 전 회장의 베르사유 궁전 사진전 등을 주관해온 아해 프레스 프랑스에도 투자했다 검찰은 유 전 회장과 그의 자금 관리인이란 의심을 받고 있는 김혜경씨 아들 대균혁기씨 등 명이 년 이후 해외로 송금한 만달러의 자금 흐름도 살펴보고 있는 것으로 알려졌다 ◇해외법인 설립부동산 불법 취득에 억원 검찰은 이와는 별도로 이미 유 전 회장이 오너인 ㈜세모가 년 월 미국의 부동산 취득을 위해 세모 캘리포니아를 설립하고 미국의 아해 프레스가 지난 년 만달러억여원를 투자해 아해 프레스 프랑스를 자회사로 세우면서 당국에 신고하지 않은 사실을 확인했다 외국환거래법은 해외 법인을 설립하거나 부동산을 매입할 경우 거래 목적과 내용을 당국에 신고하도록 하고 있다 유 전 회장의 차남 혁기씨가 대표이자 비자금 조성처로 의심받고 있는 아해 프레스 프랑스는 아해프레스와 ㈜아해 천해지 모래알디자인 유 전 회장의 장남 대균씨 등이 만달러약 억원를 투자해 설립했으나 최대 주주인 아해프레스는 당국에 신고하지 않았다 아해프레스는 유 전 회장이 만달러약 억원를 투자해 지분 를 갖고 있는 회사로 아해 프레스 프랑스의 지분 를 보유하고 있다 또 혁기씨 등이 보유한 해외 부동산 건억원 추정 중 미국 뉴욕 건년 월 년 월 년 월 각각 매입 캘리포니아 건년월 매입 등 건은 당국에 매입 사실을 신고하지 않았다 나머지 건은 미국 내 법인인 세모 캘리포니아가 년 월 만달러를 주고 매입한 것이지만 세모 캘리포니아가 불법 반출된 자금으로 설립된 사실이 드러나 검찰은 이 자금의 출처도 쫓고 있다 
37, 세월호의 실질적 선주船主인 유병언 전 세모그룹 회장 일가一家의 비리를 수사 중인 인천지검 특별수사팀은 유씨 일가가 해외에 법인을 세우고 부동산을 사는 과정에서 거액의 외화를 밀반출한 혐의외국환거래법 위반를 포착한 것으로 일 확인됐다 아해 프레스 프랑스 법인 설립을 위해 만달러를 불법 송금하는 등 모두 건의 법인 설립과 부동산 투자에 만달러약 억원를 당국에 신고하지 않고 반출했다는 것이다 검찰은 이와 별도로 유씨가 사실상 소유한 ㈜천해지와 ㈜모래알디자인이 유씨의 사진을 전시판매해온 미국의 아해 프레스 등에 만달러약 억원를 송금한 것을 비롯해 유 전 회장 일가가 소유한 개 사社가 년 이후 무역용역거래 등의 명목으로 모두 억만달러약 억원를 해외로 보낸 사실을 확인했다 개 사는 세모문진미디어천해지청해진해운모래알디자인온지구아해다판다 등이다 검찰은 이들 회사가 외환 거래 과정에서 불법 행위를 했는지 조사 중이다 검찰은 유씨와 아들 대균혁기씨 유씨의 자금 관리인으로 알려진 김혜경씨 등 명도 년 이후 외국에 만달러를 송금한 사실도 밝혀냈다 검찰은 세모홍콩세모 등 해외 현지 법인과 국내 계열사 간의 자금 흐름을 살펴보고 있다 검찰은 유씨가 해외에 만든 붉은머리오목눈이 유씨의 장남 대균씨의 차남 혁기씨의 키솔루션 등 법인들이 장부상에만 존재하는 페이퍼컴퍼니로 국내 계열사 돈을 가져간 정황을 포착하고 횡령배임 등 혐의를 적용할 방침이다 
38, 세월호 선주船主인 유병언 전 세모그룹 회장 일가一家의 비리를 수사 중인 인천지검 특별수사팀은 유씨의 측근인 고창환 세모 대표를 최근 조사한 데 이어 송국빈 다판다 대표 변기춘 천해지 대표 황호은 새무리 대표 등 유병언씨의 핵심 인방에 대한 본격 소환에 나섰다 검찰은 국내에 남아있는 유씨의 장남 유대균씨도 곧 소환할 방침이다 검찰은 이미 차남 혁기상나섬나 등 자녀들에 대해서도 일까지 검찰에 출석하도록 통보했다 검찰은 유씨가 직접 찍은 사진 여장을 만달러약 억원에 계열사에 강매하고 자신의 장남과 차남 등을 대표로 앉힌 컨설팅 회사 개에서 컨설팅 수수료 명목으로 약 억원을 챙기는 등 억원 이상의 배임을 저지른 혐의를 파악했다 검찰은 서울경기 경북 전남 제주 일대에서 무더기로 땅을 매입한 하나둘셋 영농조합과 몽중산다원 영농조합 등 조합 법인의 실질적 운영자로 유씨를 지목하고 탈세 혐의를 적용한다는 계획이다 유씨 측이 세금을 적게 내고 재산 증식을 위해 농업인 추종자들을 내세워 영농조합을 만들었다고 본 것이다 검찰은 유씨 일가 소유 계열사인 청해진해운이 선상船上에서 면세유免稅油를 빼돌려 시중에 유통한 부분과 관련 관련자들을 탈세 혐의로 처벌할 방침이다 검찰은 청해진해운의 전신인 세모가 년 부도를 내고 년 법정관리 결정을 받아 년 인천지법에서 채무 억원을 탕감받는 과정에서 재산 규모를 적게 신고해 법원을 속인 부분에 대해 회사정리법현 통합도산법 위반 혐의를 적용할 방침이다 한편 선박 안전 검사를 맡고 있는 한국선급의 비리를 수사 중인 부산지검 특별수사팀도 이날 한국선급이 해양수산부 직원들에게 금품과 향응을 제공한 단서를 잡고 수사 중이다 검찰은 년 월 한국선급 임직원들이 대전시 유성구의 한 음식점과 노래방 등에서 해양수산부당시 국토해양부 공무원들을 만나는 등 식사와 향응을 제공한 정황을 포착했다 검찰은 년 추석 때 한국선급이 해수부 공무원들에게 수십만원 상당 상품권을 전달한 사실도 확인했다 
39, 얼굴 없는 사진 작가 아해로 활동해온 유병언 전 세모그룹 회장이 사진 때문에 발목을 잡힐 처지에 놓였다 유씨는 자녀들과 측근들을 통해 수십개 계열사와 국내외 부동산을 간접 운영한 의혹을 받고 있지만 정작 본인 명의로 주식이나 부동산을 갖지 않고 어떤 서류에도 서명한 적이 없어 본인과 회사와는 무관하다는 입장이다 그러나 검찰은 유씨 일가가 소유한 계열사와 영농조합 등에 대한 압수 수색에서 유씨가 직접 찍은 사진 수백 점을 압수하고 이 사진들을 통해 유씨의 관련성을 입증한다는 계획이다 검찰 관계자는 유씨와 아무런 관련이 없다는 회사나 영농조합 등에 유씨가 찍은 사진이 수십 점씩 발견되는 것이 무엇을 말하겠느냐며 사진과 관련한 광범위한 수사가 진행되고 있다고 말했다 본지 취재에서도 유씨 일가의 계열사와 영농조합에는 아해가 찍은 것으로 추정되는 사진이 다수 걸려 있었다 일 유씨 일가 소유로 알려진 전남 보성 몽중산다원 영농조합을 방문했을 때 유씨가 찍은 것으로 보이는 대형 사진 여 점이 곳곳에 전시돼 있었다 안개 낀 차밭 눈 내린 차밭 사진 등 크고 작은 사진들도 벽면을 메웠다 사진들은 아해 홈페이지에 올라온 사진들과 비교해 촬영 기법이나 색감이 흡사했다 인천 부평구의 건강기능식품 제조업체 세모스쿠알렌의 한 직원도 회사에 유씨 사진이 여러 점 걸려 있다고 말했다 검찰은 유씨가 직접 찍은 사진으로 만든 달력을 개당 만원씩에 강매하고 자신의 사진 여장을 무려 만달러약 억원에 강매한 혐의에 대해서는 배임죄를 적용한다는 방침이다 
40, 승객과 선원 명을 태우고 북대서양 카나리아 제도 근해를 운항 중이던 스페인 여객선에서 일 선상 화재가 발생했으나 선장과 선원들의 침착한 대처로 전원이 무사히 구조됐다 대형 사고로 번질 수도 있는 상황이었지만 선장과 선원들 그리고 관제 당국은 당황하지 않고 훈련받은 대로 행동했다 특히 선장의 침착한 대처가 결정적인 역할을 했다고 외신들이 전했다 만급 정기 여객선 볼칸 데 타부리엔테호는 이날 승객 명 선원 명 차량 대를 싣고 오후 시분 테네리페 섬 로스크리스티아노항港을 출발해 라팔마로 향했다 시쯤 차고車庫 쪽에서 화재경보가 울렸다 차량 한 대의 엔진에 불이 붙은 것이다 불이 주변 차량으로 옮겨붙어 화재는 점점 커졌다 화재 경보와 동시에 차고 주변에 스프링클러가 작동하고 연기 차단막이 자동으로 내려왔다 선장은 항구까지 거리를 고려해 충분한 시간이 있다고 판단하고 회항을 결정했다 선장은 항만관제센터에 보고한 뒤 즉시 선원들에게 승객 대피를 준비시켰다 선원들은 배를 돌려야 하지만 큰 사고는 아니다며 승객들을 안심시킨 뒤 구명조끼를 입고 객실 밖 통로에 나와 일렬로 서도록 지시했다 무게가 한쪽으로 쏠리지 않도록 승객을 좌현과 우현에 절반씩 배치했다 수분 만에 탈출 대비 태세를 갖췄다 사고 보고를 받은 스페인 해경은 헬리콥터 대 구조보트 대를 출동시켜 여객선의 회항을 호위했다 또 최악의 사태에 대비 명을 태울 수 있는 급 고속페리를 보내 전원 탈출에 대비했다 항구에서는 소방차 대와 긴급 구조팀이 대기하고 있었다 배는 시 분 무사히 항구로 돌아왔다 스페인 해경은 차량 대가 전소됐고 명이 공황 증상을 보였지만 인명 피해는 없다고 밝혔다 
41, 검찰은 유병언유대균 부자와 관련 계열사 개사가 해외에 개 법인을 설립하면서 투자한 자금이 만달러억원에 이르는 것으로 파악했다 이 개 해외 법인은 당국에 신고됐다 이 중 개는 청산됐고 개는 투자금이 회수돼 현재는 개투자액 만달러억원 법인이 살아 있다 청산된 개 법인에 투자된 만달러억원는 회수되지 않은 것으로 당국에 신고됐다 
42, 검경 합동수사본부가 청해진해운이 세월호와 함께 인천제주 항로에 운항하던 여객선 오하마나호를 점검한 결과 구명벌救命筏 개는 발로 몇 번을 걷어차고 망치로 두들겨도 바닷물에 투하되지 않았다 승객들이 배에서 바다로 탈출하는 데 쓰는 미끄럼틀안전 수트도 작동하지 않았다 구명벌과 안전 수트는 배가 바닷물에 수심  정도 잠기면 수압에 의해 저절로 안전장치가 풀려 펼쳐져야 한다 청해진해운은 오하마나호도 세월호처럼 구조를 변경했다 년 일본에서 건조된 배를 년 사온 뒤 승객 정원을 명에서 명으로 컨테이너 화물 적재량은 개에서 개로 크게 늘렸다 오하마나호 화물 고정 장치는 아예 없거나 있어도 밧줄을 걸기가 어려울 정도로 부식된 상태였다 펴지지 않는 구명벌 엉터리 화물 고정 설비 무리한 여객선 증축 등 오하마나호와 세월호는 모든 게 똑같았다 청해진해운이 평소 돈벌이만 노리고 승객 목숨이 걸린 일에 얼마나 무관심했는지 보여주는 증거다 청해진해운은 지난 일 세월호가 침몰한 직후 인천제주 항로에 오하마나호를 계속 운항하겠다고 밝혔다 그러다가 여론의 비판이 거세져서야 운항을 중단하겠다고 물러섰다 해양수산부와 해경은 작년 월 전국적으로 대대적인 여객선 안전 점검을 했다 그러나 일부 지역에선 척 점검을 시간 분 만에 마치고선 특이점 없음이라고 결론 냈다 척당 평균 분에 뚝딱 조사하고 아무 문제 없다고 한 것이다 어떤 곳에선 점검 대상 척 가운데 척만 조사하고 끝냈다 해양수산부는 세월호 침몰 사고가 나자 일부터 일까지 전국 연안 여객선 척 전체의 안전을 긴급 점검하겠다고 다시 법석을 떨고 나섰다 공무원들의 이런 면피용 행정이 제 제의 세월호오하마나호를 만들어내는 공범共犯이다 사설 국면 전환용 改閣만으론 국민 마음 얻지 못할 것 사설 친구 살린 아들 세금 아껴 쓴 부모 
43, 세월호 침몰 당시 승객과 친구 제자를 구하려다 목숨을 잃은 의인義人을 의사자義死者로 지정하기 위한 움직임이 본격화하고 있다 일단 살신성인의 정신을 몸소 실천한 인의 영웅부터 시작된다 인은 객실 승무원이었던 박지영여씨 아르바이트 직원인 김기웅씨와 정현선여승무원씨 커플 안산 단원고 남윤철최혜정여교사 단원고 학생 정차웅최덕하군 등이다 다음은 조선 보도 원문 ☞ 해당 뉴스 조선 영상 보러가기 앵커 세월호 희생자 가운데 살신성인을 몸소 실천한 영웅들에 대해 의사자 지정이 추진되고 있습니다 일단 인의 영웅으로 시작합니다 함범호 기자입니다 리포트 선원들은 맨 마지막이다 승무원 박지영씨는 물이 가슴까지 차올라왔지만 이처럼 외치며 학생들의 탈출을 도왔습니다 단원고 학생 정차웅군은 구명조끼를 친구에게 벗어주고 본인은 끝내 숨진 채 돌아왔습니다 각 지방자치단체가 세월호 사고당시 이들처럼 자신의 몸을 던져 남을 구한 사람에 대해 의사자 지정을 추진하고 있습니다 인천시는 선상커플인 세월호 직원 정현선씨와 아르바이트생 김기웅씨가 승객들의 탈출을 도왔다며 의사자 인정 신청서를 제출했습니다 안산시도 정차웅 군과 최초 신고자 최덕하 군 그리고 학생들을 탈출시키기 위해 끝까지 애쓴 최혜정 교사에 대해 의사자 지정을 준비중입니다 승무원 박지영씨는 시흥시에서 남윤철 교사는 서울 서초구에서 의사자 지정을 추진하고 있습니다 인터뷰 박용덕 안산시 복지정책과장 목격자 진술 등 폭넓은 사실 확인을 하고 구조 재난기관에 객관적인 입증자료를 마련하도록 관할 지자체가 의사자 지정을 보건복지부에 신청하면 보건복지부는 일 안에 심사위원회를 열어 선정여부를 결정합니다 의사자로 지정되면 유족에게 보상금과 의료급여 등의 예우가 주어집니다 각 지방자치 단체는 명 외에도 자신을 희생해 다른 사람들을 구한 의인이 더 나타나면 추가로 의사자 지정을 추진할 계획입니다 조선 함범호입니다 
44, 정홍원 국무총리가 세월호가 침몰한 지 열이틀째 되는 일 사퇴 의사를 밝혔다 정 총리는 기자회견에서 사고 대처 과정에서 보인 정부의 무능에 대해 사죄했다 박근혜 대통령은 정 총리의 사의辭意를 받아들였지만 사표 수리는 세월호 사태가 어느 정도 수습된 이후에 하게 될 것이라고 청와대가 밝혔다 인재人災가 분명한 사건사고가 터지면 역대 정권들은 으레 민심 수습용이란 구실을 붙여 개각 카드를 꺼내들곤 했다 그러나 대형 사고가 났다고 해서 총리나 장관을 바꿔 국면局面 전환을 시도하는 것이야말로 대한민국의 후진성을 보여주는 것이란 지적이 적지 않다 역대 정권들은 이런 개각을 통해 국민의 분노를 덮으려고 해 왔다 그러면서 정작 대형 사고를 불러온 한국 사회의 고질痼疾들은 개각에 휩쓸려 곧 잊히곤 했다 그 결과 세계 위권의 경제 대국에서 세월호 사태와 같은 참극慘劇이 되풀이되고 있다 세월호 사태를 겪으면서 국민들은 정부의 무능과 무책임 공무원들의 일탈逸脫을 생생히 목격했다 사고 초기 대응에서 우왕좌왕하다가 제 힘으로 빠져나온 사람들 외에는 단 한 사람의 생명도 더 구해내지 못했다 일부 고위 공직자들은 서로 싸우고 책임을 떠넘기기에 급급했다 국민이 충격을 받은 것도 바로 이 대목이다 총리의 사의 표명 정도가 아니라 대통령을 비롯 내각 전체가 석고대죄를 해도 분이 안 풀릴 것 같다는 말이 나올 수밖에 없다 중요한 것은 개각 자체가 아니다 기왕 하기로 했으면 제대로 하는 것이다 국민들은 미봉책이 아니라 전면 쇄신을 요구하고 있다 세월호 관련 부처는 물론 경제팀과 외교안보정보 분야 부처들에 대한 그동안의 불신不信과 무능도 함께 털어낼 수 있기를 바라고 있는 것이다 만약 박 대통령이 개각 카드를 꺼내들겠다고 작심했다면 민심의 물길을 일시적으로 바꿔 상황을 모면하려는 차원이 아니라 완전히 새로 시작한다는 각오로 개각을 준비해야 할 것이다 지금까지 장차관급 인사를 통해 국민에게 참신한 감동을 준 적이 없기에 더더욱 그렇다 이번 기회에 국정 운영 방식도 근본부터 재검토할 필요가 있다 이 정부는 책임 총리 책임 장관제를 내걸고 출범했지만 지난 년 개월여 나타난 국정 운영 스타일은 정반대였다 각 부처와 관료 조직은 오직 대통령 입과 청와대 지시만 쳐다보면서 위에서 내려온 지침을 복창하며 따랐을 뿐이다 앞으로는 대통령 인 독주獨走가 아니라 총리와 장관들이 각자 권한과 책임에 따라 유기적으로 일하는 정부를 만들어 가야 한다 지금 국민은 과연 대한민국이 나의 생명을 지켜줄 수 있는 나라인가를 묻고 있다 이 나라가 과연 후손들에게 물려줄 수 있는 안전한 국가인가도 묻고 있다 박 대통령은 국민 마음속에서 불안하게 자라나고 있는 근원적인 의문에 답변을 해야 한다 사설 친구 살린 아들 세금 아껴 쓴 부모 사설 청해진해운 다른 여객선도 구명벌 개 작동 안 했다 
