,x
45, 세월호 침몰 사고를 수사중인 검경 합동수사본부가 사고 당시 휴대폰으로 신고를 한 학생에게 위도와 경도를 물어본 전남 목포해양경찰서 상황실과 전남 상황실을 일 압수수색했다 검경 합동수사본부는 이날 오전 시 분쯤 목포해경 상황실로 수사관 명을 보내 압수수색을 시작 최초 신고자가 신고를 했을 당시 신고접수 내용과 교신 녹취록 상황일지 등을 압수했다 목포해경은 지난 일 시 분쯤 사고사실을 에 최초로 알린 단원고 학생과의 통화에서 선박의 위치를 물으며 일반인이 파악하기 힘든 경도와 위도를 묻는 등 부실한 대응으로 골든타임을 허비했다는 의혹을 받고 있다 뿐만아니라 목포해경은 최초 신고 후 분이 지난 시 분쯤에야 세월호를 찾아 경비정을 출동시켜 시간을 허비했다는 의혹도 받고 있다 합수부는 앞서 지난 일 서해지방해양경찰청 관할 진도 해상교통관제센터에 수사관을 보내 압수수색하고 세월호 침몰 당시 교신 내역과 항적 자료 관제 관련 서류 내부 화면 등을 확보해 분석 중이라고 일 밝혔다 합수부는 진도가 지난 일 세월호가 관제구역에 진입한 사실을 레이더와 선박자동식별시스템을 통해 인지하고서도 이상 징후를 발견하지 못하는 등 부실 관제로 초동 대처에 문제가 있었던 것으로 보고 있다 합수부는 일 해운항만청이 관리하는 제주에도 수사관을 보내 사고 당시 업무 준칙 준수 여부 등에 대한 조사를 진행했다 한편 한국선급 비리를 수사 중인 부산지검 특별수사팀은 수사 대상에 오른 전현직 한국선급 임직원에 대해 계좌 추적에 들어갔다 특별수사팀은 한국선급에서 압수한 회계장부와 전산 자료 등을 분석해 자금 흐름을 추적하는 한편 비리 의혹이 있는 임직원들의 계좌를 조사할 계획이다 
46, 지난 월 일 오전 시분 전남 진도군 맹골도 부근에서 세월호가 침몰됐던 그 시각 서울대 온라인 커뮤니티 스누라이프에 여객선이 침몰 중 모두 구조될 수 있길 간절히 바랍니다라는 글 아래에 댓글이 달렸다 저 지금 여객선 안인데 구명조끼 입고 구조 기다리고 있어요 ㅋㅋㅋㅋ 물에 둥둥 떠있는 건 아니고 배 안인데 지금 상황 밖에서 보는 것만큼 그리 심각하진 않아요 한 명 한 명 구조되고 있고 곧 저도 구조될 거 같아요 너무 걱정마세요 ㅋㅋㅋ 익명으로 쓰인 댓글은 곧 거짓으로 판정났고 댓글을 쓴 당사자는 커뮤니티에서 탈퇴당했다 비슷한 시간 비슷한 메시지는 많았다 세 남성 김모씨는 자신 명의의 휴대폰 두 대를 이용해 카카오톡 대화 내용을 조작했다 마치 현장에 있던 민간 잠수부인 양 안에 들어갓다가 왓거든 안에 득실해 지금 산사람 없을 듯싶다 들어가기가 싫타라는 내용의 메시지를 만들고 이를 직접 유포했다 세 남성 김모씨는 실종자의 휴대전화 번호까지 입수해 페이스북 내용을 조작했다 실종자 이름으로 제발 이것 좀 전해주세요 제발 지금 저희 식당옆 객실에 명 있어요 제발 빨리 구조해 주세요라는 메시지를 만들어 자신이 제보받은 것처럼 꾸며 페이스북에 게재했다 두 사람은 모두 경찰에 검거됐고 구속영장을 발부받았다 아예 얼굴과 실명을 드러내놓고 허위사실을 유포한 사람도 있다 진도 현장에서 구조활동을 펼치던 민간 잠수부라며 인터뷰를 자청했던 홍가혜씨다 지난 월 일 오전 한 종합편성채널 뉴스 특보에 얼굴을 비춘 홍씨는 배 안에 생존자의 신호를 들었다는 것을 전해들었다거나 해경이 민간 잠수부 투입을 막고 있다 지원이 전혀 이뤄지지 않고 정부 관계자는 대충 시간이나 때우고 가라고 말했다고 주장했다 그러나 곧바로 홍씨가 그동안 스스로 연예부 기자라거나 한 아이돌 그룹 멤버의 사촌 언니 유명 야구선수의 여자친구 등으로 신분을 위장해 왔던 과거가 밝혀졌다 그동안은 소셜네트워크서비스 등에서 유명한 관심종자관심을 받고 싶어하는 사람에 불과했지만 이 사고 직후 홍씨에 대해 명예훼손 혐의로 구속영장이 발부됐다 이른바 관심종자는 어디에나 있다 특히 세월호 참사처럼 이목이 쏠리는 사건사고가 생기면 마치 사건과 관련된 당사자인 것처럼 위장하는 사람들이 등장한다 가 일상화되면서 관심종자들의 목적을 달성하기는 더 쉬워졌다 조작된 메시지를 온라인 커뮤니티나 에 올리기만 하면 수많은 사람이 자신의 메시지를 읽는다 이러면서 인터넷상에서 자신의 존재감을 알리고 욕구를 충족시킬 수 있다 실제로 관심종자는 단순히 주목받는 것에 도취되는 경우가 많다 지난해 월 인터넷 커뮤니티 일간베스트에는 한 네티즌이 할아버지가 자살했다며 힘없이 앉아 있는 노인 사진을 직접 찍어 올렸다 이 네티즌은 당황했지만 인증부터 할 생각을 하니 난 일베 중독인가 명복을 빌어줘라는 글도 남겼다 전우영 충남대 교수심리학는 주간조선에 자극적인 인증샷 꾸며낸 글 등은 많은 사람이 자신에게 관심을 가져주길 바라는 욕구 때문에 만들어진다고 말했다 전 교수는 관심을 받고자 하는 욕구는 누구에게나 있지만 최근 들어 자신의 욕구를 드러내기를 권장하면서 충동 조절에 어려움을 겪는 사람도 늘어나고 있다고 설명했다 또 다른 견해도 있다 양혜승 경성대 교수신문방송학가 한국언론학보를 통해 발표한 페이스북은 우리의 관계를 윤택하게 하는가를 보면 인터넷상에서는 자기표출 욕구를 충족시키려는 경향이 강하다 흔하게는 셀카셀프카메라 사진이나 자랑할 만한 주변 환경경험 등을 올린다 나아가 직접 정보를 생산하게 된다면 자기표출 욕구를 더 잘 충족시킬 수 있다는 말이다 정덕현 문화평론가는 더 많이 주목받으려면 더 자극적인 정보를 제공해야 한다며 정보에 대한 도덕적 책임도 없이 욕구만 있기 때문에 종종 거짓으로 만들어진 정보가 생산되는 것이라고 설명했다 이번에 문제가 된 홍가혜씨의 사례는 더 많은 관심을 위해 아예 허위사실을 만들어내다 이에 중독된 관심종자의 대표적 사례다 지금까지 알려진 바로는 홍가혜씨는 여자 아이돌 그룹 멤버의 사촌언니 행세를 하며 트위터에 친분을 과시하는 사진을 올리기도 했고 야구선수와 사귀다 헤어지면서 임신했는데 버림받았다는 루머를 만들어내기도 했다 갑자기 트위터와 페이스북에 자살하겠다며 유서를 올리는가 하면 다른 야구선수와 사귄다고 소문을 내기도 했다 정신질환 중에 인위적인 장애 즉 꾀병이라 불리는 질환과 비슷하다 이 장애는 경제적 이득 없이 단지 환자의 역할을 해서 타인을 관심을 유발하는 데 집중하는 경우를 의미한다 만약 주변에서 관심을 두지 않는다고 생각할 때는 일부러 자해를 시도하는 극단적 경향이 있는데 정신과에서는 뮌하우젠 증후군 이라고 부르기도 한다 요즘 말로는 관심병관심을 받고자 하는 욕구가 심해 정신병 상태에 이르는 것을 일컫는 신조어에 걸렸다고 할 만한 관심종자는 신체적 증상을 호소하지 않는 새로운 유형의 인위적인 장애 질환자라고 분류할 수도 있다 반면에 공격적으로 관심을 끌고자 하는 관심종자도 있다 지난 월 일 경찰은 인터넷 방송 어좁이에 대한 체포영장을 병원에 신청하고 해당 인터넷 방송에 대한 압수수색을 진행할 예정이라고 밝혔다 어좁이는 지난 월 일 자신의 방송을 진행하면서 세월호 참사 희생자들을 오뎅탕으로 지칭하고 교복이 젖었다는 등 막말을 쏟아내 논란을 빚었다 항의를 하는 네티즌들을 향해서는 사과 방송을 하면서도 희생자를 두고 장난을 치는 발언을 하기도 했다 폭력적이라고까지 할 수 있는 이런 사건 역시 관심종자들의 관심받고자 하는 욕구 때문에 생긴 경향이 있다 김재휘 중앙대 교수심리학는 사이버 인정 욕구라고도 하는데 허위사실을 유포하거나 인신공격을 하는 등 인터넷상의 반사회적 행동은 주목받고자 하는 자신의 욕구를 충족시킨다고 말했다 최근에는 어그로라는 인터넷 신조어까지 등장했다 주로 어그로를 끈다고 쓰이는 이 말은 영어 공격적인에서 유래한 것이다 원래는 온라인 게임에서 몬스터의 분노 수치가 올라가 캐릭터에게 달려드는 행위를 지칭하는 말이었다 그러나 최근에는 상대방을 도발해 분노를 유발하는 행위를 하는 것을 뜻할 때가 더 많다 지난 월 일 경찰에 검거된 살 고등학생 이모군도 유명한 어그로꾼어그로를 끄는 행동을 반복하는 사람이다 이군은 세월호 참사가 일어난 직후부터 카카오스토리에 여객선 침몰 ㅈㄴ 잘됫네 ㅋㅋ 부모새끼들 질질짜는거보고싶노 ㅋ 등의 악성 글을 유포한 혐의를 받고 있다 이군은 네티즌들의 신고로 아이디가 사용정지되자 아이디 개를 번갈아 사용하며 네티즌들에게 욕설을 퍼붓기도 했다 나중에는 아예 다른 사이트에 이번 참사와 관련해 모욕적인 글을 지속적으로 올리며 어그로를 끌었다 특히 이런 공격적인 관심종자들은 익명성이 보장된 곳에서 자주 발견된다 사회적 실재감 이론 에 따르면 익명의 인터넷 공간에서는 언어적 수단으로만 커뮤니케이션을 하기 때문에 상대에 대한 실재감이 낮아 상호작용의 질이 낮아진다 쉽게 마찰을 일으킬 수 있고 더 공격적인 현상이 나타나는 것이다 이수정 경기대 교수범죄심리학는 평소에도 생길 수 있는 공격성 폭력성의 충동을 조절하지 못하고 즉각적으로 표출하려는 현상이라고 설명하면서 비판을 받으면서도 지속적으로 공격적인 태도를 취하는 것은 그러면서 욕구를 충족시킬 수 있기 때문이라고 말했다 정보를 조작해 관심을 받거나 어그로를 끌어 주목받는 관심종자들의 행위는 결국 특정한 욕구를 충족시키기 위해 발생하는 것이다 최근에는 특정한 목적을 위해 관심종자를 자처하는 사람도 있다 지난 월 일 세월호 생존자를 사칭해 허위사실을 인터넷에 유포한 혐의로 경찰에서 조사를 받은 살 양과 살 군은 경찰 조사에서 실종자들이 빨리 구조됐으면 하는 마음에서 그랬다고 진술하기도 했다 군은 한 인터넷 사이트에 단원고 학년 ○반 이○○입니다 선미 쪽에 있는데 유리창 깨질까봐 무섭네요 구조대 안 와요라는 글을 올린 적 있다 정낙원 서울여대 교수언론영상학는 모바일 기기가 발전하고 실시간 소통이 가능해지면서 정보 소비자인 동시에 생산자가 된 일반 시민들이 자신들의 목적에 맞는 정보를 재생산할 수 있게 됐다며 정보 생산자보다 정보 자체가 관심을 받기를 원하면서 허위 정보를 만들어내는 것이라고 설명했다 정보를 만들어 내면서 자신이 원하던 얘기를 듣게 되고 다른 사람에게도 인정받을 수 있다는 얘기다 이 때문에 정부에 대한 불신이 이번 세월호 참사에서 많은 허위 정보를 만들어냈다는 의견도 나온다 송경재 경희대 교수인류사회재건연구소는 지난 월 일 한 라디오 방송을 통해 정부에 대한 신뢰가 떨어지자 음모론 허위 정보가 판을 치고 있다며 사람들의 불안심리를 틈타 악의적인 사용자들이 문제를 일으키고 있다고 지적했다 즉 정부의 대응 등 일련의 사고 수습 과정을 비판하는 심리가 과장되거나 재구성된 정보에 휩쓸리게 한다는 것이다 문제는 이런 관심종자와 관심글은 집단 양극화 현상을 낳을 수 있다는 것이다 캐스 선스타인 하버드대 로스쿨 교수는 자신의 저서 루머 공저 불편한 인터넷 등을 통해서 루머는 정보의 폭포 현상 을 통해서 전파돼 집단의 논의를 양극화시킨다고 말했다 일정 수 이상의 사람이 허위 정보를 믿게 되면 더 많은 사람이 그것을 따라 믿게 된다 만약 다른 정보가 들어와도 자기 합리화를 위해 정보를 무시하는 자기 검열을 하고 다른 사람과 뜻을 같이하게 된다 이러면서 몇몇 정보는 삭제되고 의견은 극단적으로 흐르는데 이것이 집단으로 부딪치면 집단양극화 로 번지게 된다 전우영 교수는 반복되는 관심종자의 관심글은 그만큼 사회의 소통이 부족하다는 얘기라며 극단적인 이야기는 같은 집단에서 반복될 수 있기 때문에 사회적인 소통을 하는 노력이 필요하다고 말했다 더 많은 기사는 주간조선 최신호에서 볼 수 있습니다 
47, 새정치민주연합 김한길안철수 공동대표는 일 세월호 참사와 관련해 야당을 포함한 정치권 전체에 책임이 있다며 사과했다 민생과 안전 관련 법안에 대해선 정부여당에 적극적으로 협조하겠다는 뜻도 밝혔다 야당 관계자는 이와 관련 우리가 말하지 않아도 세월호 참사와 관련한 정부여당의 책임론은 국민 사이에 폭넓게 퍼져 있다며 이 국면을 정치적으로 이용하려 한다는 인상을 주면 역풍逆風을 맞게 될 것이라고 했다 안 공동대표는 이날 국회에서 기자회견을 갖고 그동안 야당은 뭘 했느냐고 회초리를 드시면 달게 받겠다 정부의 무능을 탓하기 전에 정부를 제대로 감시하지 못한 국회의 책임을 통감한다고 말했다 그는 정부와 국회 여야與野가 하나가 돼 국민 안전과 존엄을 지키고 낡은 시스템을 개혁하는 총체적 점검에 나서겠다고 했다 안 대표는 세월호 참사 원인 규명과 책임자 처벌 대책 마련을 위해 연말까지 상시국회를 열 것을 제안했다 새정치민주연합은 당분간 정부여당에 대한 정치적 공세와 정쟁으로 비칠 수 있는 행동은 최소화하면서 기초연금법 등 민생 법안과 안전 관련 법안들의 처리에 협조하겠다는 방침이다 안 대표는 월 국회에서 민생 법안을 비롯한 현안을 조속히 처리하겠다 야당도 입법으로 도울 일이 있으면 무엇이든 돕겠다고 했다 이에 따라 이번 주부터 국회가 정상화하면서 주요 현안과 법안들이 처리될 것으로 보인다 새정치민주연합은 일 의원총회를 열어 정부여당의 기초연금법 절충안을 수용할지를 결정키로 했다 야당 지도부는 기초연금을 국민연금 가입 기간과 연계해 소득 하위 는 월 만만원을 지급하되 저소득층 만명은 지급액을 늘리는 방안을 검토하고 있다 야당 지도부는 이에 반대하는 강경파 의원들을 상대로 지금은 원칙보다는 기초연금이 필요한 분들에게 우선 지급하는 것이 중요하다고 설득하고 있다 일 의원총회에서는 민간 방송사에도 방송사와 종사자 측이 동수同數의 편성위원회를 구성하는 내용의 방송법 개정안을 논의키로 했다 야당이 방송법 타협안을 제시할 경우 방송법 때문에 발목이 잡혀 있던 여건의 다른 민생 법안들이 국회 미래창조과학방송통신위에서 처리될 수 있다 국회 미방위는 작년 월 이후 단 한 건의 법안도 통과시키지 못하고 있다 이와 함께 여야는 학교 안전사고 예방 및 보상법 선박 입출항 관련 법 수난 구호법 해사 안전법 등 해상 안전 관련 법안들도 처리할 계획이다 그러나 새정치민주연합은 이날 정홍원 국무총리의 사의 표명에 대해서는 무책임하며 비겁하다고 비판했다 안 대표는 가뜩이나 총체적 난맥상에서 총리가 바뀌면 대체 어떤 일이 벌어지겠는가라며 총리를 비롯한 내각은 우선 총력을 다해 이 상황을 수습하고 난 뒤 국민 뜻에 따르는 게 책임을 다하는 진실한 자세라고 했다 
48, 세월호 침몰로 숨진 단원고 학년 정차웅군의 가족은 아들 장례식을 치르면서 가장 싼 만원짜리 수의를 입혔다 검도와 농구를 잘했던 둘째 차웅이는 키가 ㎝를 넘어 관棺도 큰 것을 써야 했다 가족은 그중에서도 맨 아래 등급인 만원짜리를 골랐다 차웅이 가족은 고려대 안산병원 장례식장의 용품 담당 직원에게 국민 세금으로 아들 장례를 하는데 어떻게 비싼 것을 쓸 수 있겠느냐고 말했다 한다 가족은 장례 용품 값을 대강 물은 뒤 모두 최하 등급을 선택했다 차웅이 가족이 장례식을 검소하게 치르자 옆 빈소 차웅이 친구의 유족도 같은 장례 용품을 주문해 뜻을 함께했다고 한다 희생된 단원고 학생들의 장례비는 모두 경기도교육청에서 지원하고 있다 자식을 앞세운 부모라면 아들 떠나는 길이 조금이라도 편안하기를 바라기 마련이다 그렇기에 조금 더 좋은 관과 수의를 골랐다고 해서 뭐라 할 사람은 없을 것이다 그러나 차웅이 가족은 나라가 대주는 장례비를 삼가며 아꼈다 경황 없는 속에서도 그 돈이 국민이 낸 세금이라는 것을 잊지 않았다 차웅이 아버지는 대 중반 중소기업 회사원이고 부부가 맞벌이를 하고 있다고 한다 차웅이는 학교 책상에 공부 열심히 하기라고 써붙여 놓았다 친구들은 차웅이가 아무리 장난을 걸어도 화 한번 내지 않던 아이라고 했다 차웅이는 세월호가 침몰한 지난 일 구명조끼도 입지 않은 채 바다에서 발견됐고 치료를 받다 그날 숨을 거뒀다 친구들은 차웅이가 배가 침몰하기 직전 입고 있던 구명조끼를 벗어 친구에게 건넸다고 했다 그러고는 조끼도 없이 다른 친구를 구하려고 물속에 뛰어들었다고 한다 차웅이는 제자들 탈출을 도운 남윤철최혜정 교사 선원은 맨 마지막이라며 승객부터 대피시킨 박지영 승무원 아이들 구하러 가야 한다는 말을 남기고 실종된 양대홍 사무장과 함께 다섯 의인義人에 꼽히고 있다 열일곱 살 소년의 희생은 많은 이의 슬픔과 아픔을 어루만지고 희망을 되살려준다 차웅이의 가족은 그런 아들이 마지막 가는 길을 검소하게 보냄으로써 아들의 의로움을 더욱 빛냈다 그런 부모이기에 그런 아들을 키워냈을 것이다 차웅이 가족의 마음 씀씀이가 고맙고 그래서 더 죄스럽다 사설 국면 전환용 改閣만으론 국민 마음 얻지 못할 것 사설 청해진해운 다른 여객선도 구명벌 개 작동 안 했다 
49, 프로축구 서울이 수원 삼성과 벌인 수퍼매치 원정 경기에서 승리를 거뒀다 서울은 일 수원월드컵경기장에서 수원과 벌인 리그 클래식 라운드 경기에서 후반 분 터진 에스쿠데로의 결승골에 힘입어 대으로 이겼다 지난달 일 제주전대 서울 승에서 정규리그 첫 승을 신고한 이후 약 한 달 만의 승리다 서울은 승점 점승무패을 기록하며 위로 한 계단 올라섰다 수원은 승점 점 동률을 기록한 위 울산보다 골득실에서 뒤처져 위로 내려갔다 프로축구 전통의 강호 서울과 수원이 양팀 구장에서 벌이는 경기는 양팀의 뜨거운 라이벌 의식에 많은 관중이 몰려 수퍼매치라 불려왔다 년 월 서울경기장에서 열린 경기에서 기록한 만명은 역대 수퍼매치 최다 관중 기록으로 남아 있다 올해 첫 수퍼매치는 역대 가장 조용한 양팀 대결이 될 것으로 예상됐다 세월호 침몰에 대한 전국적인 애도 물결이 이어지는 가운데 비까지 내렸다 특히 올 시즌 데얀과 하대성이 중국 수퍼리그로 이적한 서울은 이 경기 직전 순위가 위였고 수원도 위여서 수퍼매치란 명칭이 무색하다는 이야기까지 나왔다 하지만 이날 경기에는 지난해 수원에서 열린 수퍼매치 관중 만명보다 많은 만여 명의 축구팬이 몰려 리그 최대 라이벌 매치를 지켜봤다 양 팀 선수들과 코칭스태프들은 오른쪽 가슴에 노란색 리본 스티커를 붙이고 나왔다 수원 선수들은 왼쪽 팔에 노란색 띠도 둘렀다 세월호 희생자들을 추모하고 생존자의 무사 귀환을 염원하는 의미였다 경기장 곳곳에 슬픔과 간절함을 함께 합니다 기적을 믿습니다 등의 현수막도 걸렸다 열세가 예상되던 서울은 차두리와 김진규 등 경험 많은 수비수들이 수원의 파상공세를 막아내며 빠른 역습으로 귀중한 승리를 따냈다 서울은 후반 분 김치우가 올린 크로스를 에스쿠데로가 오른발 슈팅으로 연결해 결승골을 뽑아냈다 서울은 년 월 이후 년 개월 만에 수원 원정경기에서 승리하며 징크스를 날렸다 그동안 서울은 수원 원정에서 경기 연속 무승무패으로 부진했었다 같은 날 포항 스틸야드에서 열린 경기에서는 포항이 인천에 대 완승을 거두며 승점 점승무패을 기록 전북승점을 제치고 단독 선두로 나섰다 울산은 상주와 대로 비겼다 
50, 지난 일 오전 한 네티즌이 청와대 홈페이지에 박근혜 대통령에 대한 비판적인 글을 올려 이 글을 보려는 접속자들이 몰리면서 홈페이지가 한때 마비됐다 이 글의 제목은 당신이 대통령이어선 안 되는 이유로 네티즌들 사이에서 화제가 됐다 민경욱 청와대 대변인은 일 전날 청와대 홈페이지에 정모씨란 사람이 올린 특정 글이 조회 수가 많았다고 밝히며 이같은 사실을 전했다 이 글은 세월호 참사 이후 정부의 미흡한 대처와 박근혜 대통령을 비롯한 정부의 무책임함을 비판하는 내용이다 이 글은 대통령은 자기가 해야 할 일이 뭔지도 몰랐다며 대통령은 핵심 문제를 파악하고 해결점을 찾는 일 뭐가 필요하냐 묻는 일 최우선 의제를 설정하는 일 비용 걱정하지 않도록 제반 책임을 져 주는 일을 맡아야 한다고 대통령을 비판했다 또 사람을 살리는 데 아무짝에 쓸모없는 정부는 필요없다며 대통령이 밑의 사람들에게 평소 사람의 생명이 최우선이 아니라는 잘못된 의제를 설정한 책임을 져야 한다고도 지적했다 글쓴이는 글 말미에서 대통령이란 자리가 어려운 이유는 책임이 무겁기 때문인데 책임을 지지 않는 대통령은 필요없다며 리더가 책임지지 않는 곳에서 누가 어떻게 책임지는 법을 알겠는가라고 덧붙였다 글쓴이는 자신이 해야 할 일을 일일이 알려줘야 하는 대통령은 필요없다 사람을 살리는 데 아무짝에 쓸모없는 대통령은 필요없다 결정적으로 책임을 질 줄 모르는 대통령은 필요없다는 자신의 주장을 요약반복하면서 죄책감을 느끼지도 못하는 대통령 이들세월호 선원들과 결코 다르지 않다 사람에 대해 아파할 줄도 모르는 대통령은 더더욱 필요없다 진심으로 대통령의 하야를 원한다는 강한 주장으로 글을 맺었다 해당 글은 일 오전까지 만건이 넘는 접속 건수를 기록했지만 이 글을 올린 정씨는 이날 스스로 글을 삭제했다 민 대변인은 정씨가 제가 쓴 게 아니고 페이스북에서 퍼온 것인데 이렇게 반응이 클지 몰랐다 파란을 일으킨 점에 대해 죄송하다 글을 삭제해달라는 글을 다시 올렸다며 본인이 직접 삭제하는 방법을 알려줬고 정씨가 작성한 글 건은 본인이 삭제했다고 전했다 하지만 현재까지도 청와대 홈페이지는 평소보다 배 많은 접속자가 몰리면서 접속이 불안정한 상태다 
