,x
54,세월호 침몰 사고 실종자들의 무사 귀환을 기원하는 노란 리본 캠페인에 대한 악성 유언비어가 번져 누리꾼들이 혼란을 겪고 있다에이엘티라는 한 대학교 동아리는  일 온라인 게시판에 세월호 침몰 사고로 실종된 분들을 애타게 기다리는 가족들께 대한민국 국민으로서 우리 모두 마음을 모으자는 의미로 노란 리본을 달기로 했다며 노란 리본 달기 캠페인을 제안했다 이들은 노란 리본이 형상화된 그림을 올리고 카카오톡 등 사회관계망서비스 프로필 사진으로 사용하는 것으로 마음을 모으자고 했고 많은 누리꾼들은 이 캠페인에 동참하며 기적을 바라는 마음을 전했다그런데 이 캠페인이 본격적으로 확산된  일 를 통해서 노란 리본 그림을 사용하면 저작권법에 저촉된다 벌금이  만원이다 등의 유언비어가 확산되고 있다 한 트위터리안은 노란 리본에 저작권 있다고 벌금이  만원이라는데 맞는 말인가요 ㅜㅜ 저도 달았다가 방금 지웠네요라고 반응하는 등 많은 누리꾼들이 혼란을 겪고 있다 년  월에도 노란 리본 캠페인이 있었다 아프간 탈레반이 억류중인 한국인들의 무사귀환을 바라며  개 시민사회종교단체가 노란리본 달기 운동을 연  년  월  일 오전 서울 광화문 네거리에서 뜻을 같이하는 시민들이 가로수에 노란 리본을 달고 있다 이정아 기자 그러나 이 캠페인을 처음 제안한 대학생 방혜성  양은 여기에는 어떤 상업적 목적도 없이 우리들이 처음 시작했고 노란 리본 이미지도 직접 제작했다 어떤 저작권상의 문제도 없다고 말했다 방혜성 양은 이 캠페인이 저작권을 침해하고 벌금이  만원이란 메시지를 오늘 나도 많이 받았다 굉장히 당황스럽다고 말했다 민주사회를 위한 변호사모임의 박주민 변호사는 상업적 이용이 아닌 공익적 목적을 위한 이용에 해당하고 또 노란 리본의 이미지가 저작권의 대상으로 볼 정도로 개인의 독창성이 반영되지 않은 일반적 이미지이기 때문에 저작권법 위반의 소지가 없다고 설명했다노란 리본은 베트남전 포로와 실종자들의 귀환을 기원하는 캠페인에서 유래해 현재는 무사히 돌아오기를 바란다는 상징적 의미로 통용되고 있다 여기에 더해 진정한 양심을 찾자는 그린 리본 꼭 필요한 정보만 제공하자는 회색 리본 성적 다양성을 존중하자는 무지개 리본 등으로 확산됐다허승 기자  
55,세월호 수색구조 작업에 게 모양의 해저탐사용 로봇 크랩스터  가  일 사고 해역 현장에 투입된다크랩스터는 지난해 한국해양과학기술원이 개발한 것으로 아직 시제품 단계이다 하지만 상황이 워낙 다급해 가능한 모든 수단을 쓴다는 차원에서 긴급 투입 결정을 내린 것으로 보인다이 로봇은 지난해 시제품 발표 당시 이제까지 나온 해저탐사 로봇 가운데 거친 바닷속 환경을 가장 잘 헤쳐나갈 수 있는 것으로 평가받았다 당시 미국의 정보기술 전문매체 은  개의 발이 달린 크랩스터  이 해저탐사 잠수정의 미래가 될 것이라고 평했다해저탐사 시험을 위해 부두로 옮겨진 크랩스터   해양과학기술원그동안 나온 해저로봇들은 프로펠러에 의존해 이동했다 하지만 이는 먼지를 발생시켜 시야가 막히기 일쑤이고 강한 조류를 견디는 데 취약했다 이번에 투입된 크랩스터는 게 다리 방식을 통해 이런 문제점을 해결한 것이 특징이다 크랩스터는 게와 바닷가재의 합성어이다크랩스터 로봇의  개 다리는  개의 관절로 구성돼 있어 이 다리가 빠른 유속에서도 바닷속을 안정적으로 걸어다닐 수 있게 해준다 해저  미터까지 작업이 가능하다고 한다한번 잠수하면 장시간 바닷속에 머물면서  개의 카메라를 통해 각종 데이터를 촬영 수집하고 두 앞발로 샘플도 채집할 수 있도록 설계돼 있다해양과학기술원은 지난해 거제에서 수중 시험을 실시한 데 이어 올해 중 실제 탐험에 투입하는 것을 목표로 삼아 왔다크랩스터의 무게는   길이는   폭   높이  이다 개발 작업은 서울과학기술대 목포대 충남대 부경대 국민대 한국해양대 등이 공동으로 진행했다곽노필 기자 ▷곽노필의 미래창 바로가기정면에서 본 크랩스터 해양과학기술원수중 실험을 위해 입수하는 크랩스터 해양과학기술원 
56, 세월호 사고가 발생한지 일주일이 지나서야 정부가 실종자 가족들이 모여 있는 체육관에 칸막이를 설치하는 방안을 추진하겠다고 나섰다 그동안 가족들은 체육관에 완전히 개방된 상태에서 숙식을 하느라 사생활을 보호받거나 휴식을 취하기 어렵다는 이야기가 나왔었다  일 범정부 사고대책본부는 체육관에서 체류하고 계신 희생자 가족들의 불편을 조금이라도 줄여 주기 위해 체육관에 칸막이를 설치하는 방안을 가족 측과 협의하여 추진하겠다라고 밝혔다 대책본부는 전날 밤  시에 해양수산부 장관 주재로 점검회의를 열어서 이같이 결정했다 현재 실종자 가족들은 칸막이가 없는 체육관 바닥에서 생활하고 있어 다른 사람들의 시선을 피해 쉴 수 있는 공간도 제대로 없는 형편이다 이때문에 사회관계망서비스에는 칸막이가 있는 일본과 캐나다 대피소 사진과 한국의 상황을 비교하는 사진이 올라와 공감을 얻기도 했다 사진을 보면 일본에선 체육관에 마련된 대피소에 네모난 텐트에서 가족들이 생활하는 모습을 볼 수 있다 캐나다에선 대피소에 재생용지로 사람 키만한 벽을 세워 방을 만들어 사람들이 안에서 생활하도록 했다 한 페이스북 사용자는 벌써  일째를 맞는 피해자 가족들에게 조금이나마 편안히 지낼 자리가 마련되었으면 하는 바람이 생기네요라고 글을 올렸다김지훈 기자  
57,세월호 침몰사고로 숨진 안산 단원고 학생 시신이 또 바뀐 것으로 확인됐다벌써 두 번째 사고인데도 경기도와 경기도교육청 종합상황실은 내용을 제대로 파악조차 못하고 있어 여전히 사고대응에 부실함을 보여줬다 일 오전  시  분 안산 제일병원 장례식장으로 옮겨져 군이라고 알려진 시신이 검사 결과 아닌 것으로 드러났다군 빈소에는 그간 유족과 학교 선후배 친구들의 조문이 이어져 고인의 넋을 기렸다시신이 바뀐 사실은 경기도교육청 장례절차 담당자가  일 오전  시께 검사결과 유족과 불일치 판정이 나온 사실을 확인하면서 알려졌다이에 따라 이 시신은 현재 신원미상으로 분류됐으며 당국은 유족을 다시 찾고있다경기도교육청 관계자는 검사가 어디서 이뤄져 어떻게 통보됐는지 정확히 확인되지는 않는다며 시신은 목포로 운구되지 않고 그대로 안치돼 있는 것으로 알고있다고 전했다앞서  일에는 박모양으로 알려진 시신이 이모양인 것으로 확인돼 시신이 목포에서 안산으로 옮겨진 시신이 다시 목포로 되돌아가는 일이 벌어졌다사고발생 후 시간이 경과함에 따라 당국이 같은 실수를 번복하면서 다시 정부의위기대응 능력에 대한 불신이 퍼지고 있다안산지역 한 자원봉사자는 이런 일이 반복되면 정부나 지방자치체는 사과하면 끝이지만 유족들은 가슴이 찢어진다며 이제부터라도 시신 신원확인을 철저히 해 유족의 가슴에 재차 못을 박는 일이 없도록 해야 한다고 성토했다사정이 이런데도 경기도 합동대책본부는 오후  시  분 현재까지도 시신이 바뀐사고가 발생한 사실조차 파악하지 못하고 있었다이번 일에 대해 경기도 관계자는 시신 바뀐 문제에 대해 파악된 바 없다고 하고는 추후 다시 연락을 해와 군 시신에 대해선 검사가 진행 중이다고 밝혔다경기도와 경기도교육청 안산시 안산시교육청 등이 구성한 합동대책본부는 시시각각 변하는 사고상황을 제대로 파악조차하지 못하는데다 기관별로 정보도 공유하지 않아 제구실을 못한다는 비난을 받아왔다 
58,구명설비 미비에도 합격해상사고 조사 절차 안지키기도서울연합뉴스 이태수 기자 일 시민단체 투명사회를 위한 정보공개센터가공개한 선박안전기술공단 감사 결과에서는 우리나라의 허술한 선박 점검 실태가 고스란히 드러났다진도 해역에서 침몰한 여객선 세월호의 각종 설비나 장비가 최근 실시된 선박 안전점검에서 문제가 없다고 판정받았지만 실제로는 정상적으로 작동하지 않은 정황들이 속속 나타나게 된 배경을 짐작케 하는 대목이다선박안전기술공단은 선박안전법 제 조에 따라 정부의 선박검사 업무를 대행하고 해양사고 방지를 위한 교육홍보를 하는 기관이다이곳은 지난  년 설립된 한국어선협회를 그 뿌리로 두고 있으며  년 한국선박안전기술원  년 선박검사기술협회를 거쳐  년  월부터 현재의 명칭을 사용하고 있다 작년 예산은 약  억원이었다이번에 공개된 선박안전기술공단 정기종합 감사결과 보고서에 따르면 공단은 본연의 목적인 어선 등 선박 해양사고 예방 및 조치 수행과 관련한 해양수산부 감사에서 부적정하다는 평가를 받았다공단은 해양수산부와 체결한 검사 대행협정서에 따라 해양사고 예방 및 조사절차서를 준수해야 할 의무가 있다 하지만 지난  년  월부터 작년  월까지 해경과 수협에서 통보받은  천 척의 해상사고 선박에 대해 이 절차를 제대로 준수하지않은 것으로 드러났다감사 보고서는 절차서에 따른 사고 발생 현장 대응 원인과 통계 분석을 부적정하게 하고 부실하게 관리했다고 지적했다특히 작년  월 한   유조선의 사례는 인명과 직결된 구명장비에 대해서도 부실한 검사가 이뤄졌음을 보여준다 구명설비 가운데 구명부환 구명동의 자기점화 등이 수량 부족과 표기 미이행 등으로 기준을 위반했음에도 공단이 합격 처리하고 검사증서를 발급한 것이다 해양수산부는 이에 따라 관련자에 대해 문책을 요구했다작년  월 이뤄진 해양경찰청과 해양수산부의 합동 여객선 안전점검에서는 목포해양경찰서가  시간 분동안 무려  척을 점검한 사실이 드러나기도 했다 척당 불과  분만에 점검을 마친 셈이니 부실점검이라는 비난을 피할 수 없다또 해양사고를 조사하고 심판하는 권한을 가진 중앙해양안전심판원은 운영하는 일부 교육 과정에서 사고 예방 교육을 포함하지 않아 작년 감사원 감사에서 지적을 받기도 했다부실 점검 의혹과 구명 설비 미작동 문제는 불행히도 이번 세월호 참사에서 그대로 재현됐다세월호는 지난  월 검사를 대행하는 또 다른 기관인 한국선급으로부터 제 종 중간검사를 받았지만 당시 구명정  개 가운데  개가 안전하다고 판정받았고 배의 좌우 균형을 맞춰주는 장비인 스태빌라이저는 정상 작동한다는 결과를 받았다그러나 세월호의 구명정은 단  개밖에 펼쳐지지 않아 인명피해를 키웠다는 지적을 받고 있다정보공개센터는 국내 여객선 수송실적은 지난  년  천 만명에서  년  천 만명으로 증가하는 추세지만 안전 시스템의 허점이 계속 드러나고 있다고 지적했다 
59,정부는 사이버사 대선개입 의혹사건의 핵심 인물로 꼽혀온 연제욱사진 청와대 국방비서관전 사이버 사령관을 의혹 수사  개월이 넘은  일 경질했다 국방부는 그러나 대선개입 의혹을 낳았던 대국민 사이버 심리전을 더 확대한다는 방침 아래 사령관을 준장급에서 소장급으로 높여 논란을 예고했다 김민석 국방부 대변인은  일 국방부 브리핑에서 연제욱 청와대 국방비서관을 교육사 부사령관으로 발령했다 군 사이버사 수사가 진행중인 상황에서 연 전 비서관이 군과 사이버사 요원들에게 부담을 주지 않고 향후 수사에 적극 협조하기 위해 스스로 옮기겠다는 의사를 밝힌 것이라고 설명했다 연 전 비서관은 지난  년  월부터 대선 직전인  년  월까지 군 사이버사령관으로 복무했다 그가 재직 당시 정치개입 댓글 작전을 지시  월 일치  면하고 청와대 및 국방부에 작전결과 보고를 주도  월 일치  면한 정황이 드러났음에도 수사 당국은 그에 대해 한 차례 참고인 조사를 하는 것으로 그쳐 봐주기를 하는 것이 아니냐는 비판이 있어 왔다 더욱이 그동안 계속적인 경질 압박도 무시하던 정부가 온국민의 관심이 세월호 침몰 참사에 쏠려있는 이 시점에 슬그머니 경질한 것도 주목된다 연 비서관의 후임으로는 장혁 현 국방비서관소장육사  기과 장경석소장육사  기 장군 등이 물망에 오르고 있다 이번 사건의 또다른 핵심인물로 사건 초기 수사선상에 올랐던 옥도경 현 사이버사령관도 자리에서 물러날 예정인데 국방부는 그 후임으로 조현천육사  기 소장을 내정했다 사이버사령관을 기존 준장에서 소장으로 지위를 높인 것이다 국방부에 따르면 현재  여명 수준인 사이버사 인력은 오는  년까지  명 정도로 증원한다는 계획이다 사령관을 소장급으로 올린 것은 대선개입 의혹에도 불구하고 사이버사는 확대해 간다는 방침을 공식적으로 확인한 셈이다 대국민 사이버 심리전도 계속할 방침이다 지난  월 발표된 군의 정치적 중립을 위한 세부 행동기준을 보면 군 통수권자 비방이나 정치 현안 관련 찬성반대의 글을 온라인으로 올리는 것은 금지하지만 정치 개입의 빌미가 돼온 군 통수권자 보필이나 정부국방 정책 홍보를 위한 것은 금지하지 않고 있다 국방부는 또 사이버사 요원들이 네이버다음 등 포털사이트 게시판이나 트위터페이스북 등 사회관계망서비스에서 익명으로 사이버심리전을 펼치는 것도 예전처럼 허용할 방침이다 김민석 대변인은 사이버 전력증원은 점증하는 북한의 사이버위협에 맞선 대응일 뿐만 아니라 전 세계적인 추세이기도 하다 야전에서 사단장을 역임한 소장급 인사를 사령관으로 뽑아 미래지향적으로 사이버전력을 발전시킨다는 국방부의 적극적인 조치라고 밝혔다하어영 박병수 기자  
60, 인천시는 최근 개원한 서구 국제성모병원에 세월호참사 희생자 합동분향소를 설치한다고  일 밝혔다 합동분향소는 이날 오후 마련돼 각계 인사와 일반인들이 조문할 수 있다 유가족들은 개별 빈소에서도 조문을 받을 수 있다 국제성모병원 장례식장에는 세월호참사 희생자  명의 주검이 이날 안치됐다 이들 희생자는 환갑기념으로 제주 여행을 떠났던 인천 용유초교 동창생  명 가운데 일부다 동창생들 가운데 가장 먼저 주검이 수습된 백아무개씨는 이날 오전 장례가 치러졌다 나머지  명 가운데  명은 구조됐으며  명은 실종 상태다 인천시는 합동분향소에 공무원을 배치해 유족들의 장례 편의를 최대한 지원하고 일반 시민들의 조문도 도울 것이라고 말했다 한편 시는 이날 오전 영결식이 거행된 백씨와 승무원 박지영 여씨의 장례를 위해 이들의 주검이 안치됐던 인하대병원에 장례비용 지급을 확약하는 보증서를 보냈다 장례비용은 추후 여객선사나 정부로부터 받을 계획이다 인천김영환 기자  
61,새누리당은 권은희 의원이 페이스북에 세월호 침몰 사고와 관련해 실종자 가족 행세를 하는 선동꾼이 있다는 다른 사람의 글을 올려 논란이 일자 다시 한번 소속 의원들에 대한 입행동거지 단속에 나섰다새누리당은  일 최경환 원내대표 명의로 희생자 가족과 국민에 상처를 주거나 사실이 아닌 얘기를 해서 혼란을 주지 말아달라는 내용의 문자 메시지를 소속 의원들에게 발송했다 이미 비슷한 내용의 문자 메시지를 두 차례나 보냈지만 정몽준 서울시장 예비후보 막내아들과 권 의원이 잇따라 페이스북에 부적절한 글을 올려 파문이 커지자 집안 단속을 강화하고 나선 것이다 김태흠 새누리당 원내대변인은 오늘 원내대책회의에서 소속 의원들에게 문자로 다시 지침 내리기로 결정했다며 국회의원은 보도자료 내고 국회에서 발언해야지 에스엔에스를 통해 자꾸 얘기하는 것은 문제가 있다고 말했다 김수헌 기자  
62,권은희 대구 북갑 새누리당 의원이 페이스북을 통해 세월호 사고 관련 허위사실을 퍼뜨렸다가 경찰조사를 받게 됐다 대구 성서경찰서는  일 세월호 참사 현장에서 유가족인 척하며 선동하는 여성이 밀양 송전탑 반대 시위현장에도 있었다는 허위사실을 퍼뜨린 혐의명예훼손로 권 의원과 누리꾼  명을 조사중이라고 밝혔다 권 의원은 지난  일 페이스북에 실종자 유가족에게 명찰을 나눠주려고 하자 그거 못하게 막으려고 유가족인 척 하며 선동하는 여자의 동영상이 밀양 송전탑 반대시위에도 똑같이 있네요라는 내용의 글을 게시한 혐의를 받고 있다 권 의원은 이어 실종자 가족 행세를 하며 정부를 욕하고 공무원들 뺨 때리고 악을 쓰고 욕을 하며 선동하는 이들이라며 학부모 요청으로 실종자 명찰 이름표를 착용하기로 하자 잠적해버린 이들 누구일까요 뭘 노리고 이딴 짓을 하는 걸까요라는 글을 동영상과 함께 올렸다 하지만 권 의원이 동영상에서 선동하는 여자로 지목한 권아무개 주부씨는 밀양에는 간 적이 있지만 진도에는 간 적이 전혀 없다며 권 의원을 처벌해달라고 경찰에 진정서를 냈다 권씨는 경찰에서 밀양 송전탑의 여성과 진도 참사 현장의 여성이 동일 인물이 아닌데도 권 의원이 허위사실을 퍼뜨렸다 국회의원은 사회적 지위가 높고 발언의 파급력이 커다 권 의원이 책임을 져야 한다 대통령도 유언비어를 엄히 단속한다고 했지 않았느냐고 말했다 경찰은 권 의원과 허위사실을 블로그 등에 퍼나른 누리꾼  명을 이른 시간안에 불러 조사하겠다고 밝혔다 경찰은 누리꾼들이 닉네임으로 표기돼있어 신원이 확인대는 대로 권의원과 함께 소환하겠다고 밝혔다 대구 성서경찰서 사이버범죄수사팀 김규태 경위는 권 의원이 진도 현장에서 선동꾼으로 지목한 인물은 권씨와 비슷하게 생겼지만 동일인물이 아닌 것으로 확인됐다고 말했다 권 의원은 지난  일 페이스북에 글을 띄운 뒤  시간만에 삭제한 것으로 알려졌다 권 의원 쪽은 죄송하다 할말이 없다 빠른 시간안에 입장을 정리해 밝히겠다고 해명했다 대구구대선 기자  
63,새누리당 권은희 의원 권은희 의원 공식 사이트 캡쳐세월호 침몰 사고로 온 나라가 슬픔에 잠긴 가운데 새누리당 의원들과 고위 공직자들의 부적절한 언행이 잇따르고 있다 사고를 수습하고 대책을 마련해야 할 이들이 되레 사고 현장이나 에서 무개념 행태를 보이며 물의를 빚고 있다 새누리당 권은희 의원은 지난  일 자신의 페이스북에 유가족을 폄훼하는 발언을 게재했다가 누리꾼들의 비판을 받았다 권 의원은 세월호 실종자 가족 동영상에 나온 여성이 밀양 송전탑 반대 시위에도 등장한다며 페이스북에 해당 동영상을 올리고 실종자 가족 행세를 하는 선동꾼이라고 주장했다 하지만 동영상의 여성이 실제 실종자 가족인 것으로 확인되면서 비난이 쏟아지자 권 의원은 이틀 뒤인  일 자신의 트위터에 죄송합니다라고 사과를 한 뒤 해당 글을 지웠다 정몽준 새누리당 서울시장 예비후보가  일 오전 국회 정론관에서 기자회견을 열어 자신의 아들에 대해 사과하며 고개를 숙이고 있다 김경호 기자 새누리당 서울시장 예비후보인 정몽준 의원도 자신의 막내아들이 올린 페이스북 글 때문에 곤욕을 치렀다 정 의원의 막내아들은  일 자신의 페이스북에 국민 정서 자체가 굉장히 미개해라는 내용의 글을 올렸다가 공분을 샀다 정 의원은  일 서둘러 기자회견을 열어 막내아들의 철없는 짓에 아버지로서 죄송하다며 머리를 숙였다새누리당 최고의원인 한기호 의원도 페이스북 설화를 일으켰다 그는  일 정부의 무능함을 비판하는 시민을 좌파 사이버 테러리스트로 지칭하며 색깔론을 제기했다가 여론의 질타를 받았다 온라인만이 아니다 새누리당 세종시장 후보인 유한식 현 세종시장은 세월호 사고 이틀째인  일 회식에서 폭탄주 술자리에 참석했다가 당 윤리위원회로부터 경고 조처를 받았다 새누리당 파주시장 예비후보들도 세월호 침몰 사고 당일 열린 합동연설회에서 지지자들과 헹가래를 쳤다가 구설수에 올랐다 교육부 서남수 장관은 사고 당일인  일 오후  시께 진도실내체육관을 찾았다 컵라면을 먹었다오마이뉴스 제공여당 인사들뿐 아니라 고위 공직자들도 사고 현장인 진도에서 부적절한 행동으로 거센 비판을 받았다 송영철 안전행정부 감사관은  일 진도 팽목항 상황본부의 희생자 명단 앞에서 기념 촬영을 한 사실이 알려져 직위해제 된 뒤 사표가 수리됐다앞서 서남수 교육부 장관은 사고 당일 진도실내체육관을 찾았다가 의료용 테이블에서 컵라면을 먹는 장면이 보도됐다 누리꾼들은 사고 조처보다 배고픔 해결이 먼저냐며 황제 라면이라 고 비판했다 서 장관은 지난  일 안산의 장례식장을 찾았는데 그 자리에서도 서 장관의 수행원이 유족에게 교육부 장관님 오십니다라고 귓속말을 해 유족들로부터 거센 항의를 받았다 새누리당은 최경환 원내대표 명의로 소속 의원들에게 자제령을 이미 두차례 문자로 보냈지만 권 의원의 페이스북 글로 파문이 일자  일 한번 더 같은 내용의 문자를 의원들에게 발송했다 김미향 기자  ▷포토 바로가기  슬픔도 부족한데 이 와중에 
64,세월호 침몰사고에서 구조된 단원고 학생 부모  여명은  일 오전 경기도 안산시 단원구 고잔동 안산교육지원청 앞에서 대국민 호소문을 발표하고 정부의 늑장 대응을 규탄했다학부모들은 세월호가 침몰한 지 엿새가 넘었다 구조작업은 더디고 지켜보는 부모의 가슴은 타들어간다 정부가 초기대응만 제대로 했어도 이렇게 큰 피해는 없었을 것이라고 주장했다 이들은 이어 정부의 늑장 대응에 온 국민이 규탄하고 있다 지금 당장이라도 민관 역량을 총동원해 구조작업을 진행해야 한다고 촉구했다학부모들은 침몰사고 진상규명은 그 다음에 이뤄져야 한다 또한 언론은 이슈가 아닌 진실을 보도해달라고 주문했다 아울러 아이들은 창문을 바라보다 물이 들어올까 덜컥 겁이 난다고 한다 언론 취재경쟁에 아이들이 상처받고 있다고 지적했다이들은 특히 이번 사고는 비극 그 자체이다 아직 구조되지 못한 아이들도 하늘로 간 아이들도 살아남은 아이들도 모두 우리가 책임지고 보살펴야 할 아이들이다 살아남은 아이들이 죄인이 된 심정이다 이들에 대한 지속적인 보살핌을 위해 정부와 모든 각계각층 시민사회가 애써달라고 당부했다한편 안산시는 희생된 안산 단원고등학교 학생과 교사들을 위한 추모공원을 조성 사업을 추진하기로 했다 시는 유가족들이 사고 희생자들을 위한 추모공원과 납골당 위령탑 등의 설치를 요구해옴에 따라 이를 적극 수용하기로 했다고 이날 밝혔다 이에 시는 유가족 대표 중앙정부 등과 협의를 거쳐 적당한 부지를 물색한 뒤 희생자들의 유해를 안치하고 추모할 수 있는 전용공간을 마련할 계획이다 희생자들에 대한 임시 합동분향소는 안산시 단원구 고잔동 올림픽공원에 설치돼  일 오전  시부터 조문을 받는다 안산김기성 기자   
